StationId,PollingStation,Lat,Lng,BoothType,Province,MaleBooths,FemaleBooths,MaleVoters,FemaleVoters
208,Govt Girls High School- Noordi. (Female),33.91263239819446,73.00078816266144,Female,KPK,0,2,0,806
210,Govt Girls High School- Noordi. (Female),33.91263239819446,73.0008181626614,Female,KPK,0,3,0,915
207,Govt High School- Noordi. (Male),33.914202612670046,72.99498804562833,Male,KPK,3,0,939,0
209,Govt High School- Noordi. (Male),33.91457,72.99479,Male,KPK,3,0,1056,0
205,Govt Girls High School- Chappara. (Male),33.92469518660511,73.02166498603916,Male,KPK,3,0,1083,0
206,Govt Girls High School- Chappara.(Female),33.92501,73.02171,Female,KPK,0,3,0,941
204,Govt Primary School- Sumbal Mohri.(Female),33.931184680534265,73.03133189828192,Female,KPK,0,4,0,1320
227,Govt High School- Kahal. (Female),33.93390422492002,72.96016687232576,Female,KPK,0,4,0,1305
226,Govt High School- Kahal. (Male),33.933927464338254,72.96016755317423,Male,KPK,4,0,1449,0
228,Govt Primary School- Pind Jamal Khan.,33.9343044638699,73.00459769944634,Combined,KPK,2,2,676,563
229,Govt Primary School- Kamalpur.,33.93844163680204,72.99612575188586,Combined,KPK,2,1,471,446
203,Govt Girls Primary School- Koka.(Male),33.940197128441866,73.0294987404143,Male,KPK,4,0,1549,0
231,Govt Girls Primary School- Mirpur. (Female),33.94451175505198,72.94952085046914,Female,KPK,0,4,0,1341
230,Govt Primary School- Mirpur. (Male),33.94475987648319,72.9496069115584,Male,KPK,4,0,1457,0
201,Govt Girls Middle School-Rehana.,33.94628320983258,73.0249847303341,Combined,KPK,2,2,885,736
202,Govt Primary School- Chitri.,33.95646175343988,73.02627573936478,Combined,KPK,1,1,383,311
175,Govt Primary School-Check Shah Muhammad.,33.957025741500296,72.9710127719027,Combined,KPK,1,1,353,271
30,Govt Primary School No.2- Noor Colony.(Male),33.96048820689921,72.93572412831995,Male,KPK,3,0,971,0
192,Govt Primary School- Gheba.,33.960955287140926,73.02028521677767,Combined,KPK,2,2,829,640
34,Govt Girls High School- T & T Colony.,33.968679486006465,72.92155076824903,Combined,KPK,2,2,671,620
171,Govt Primary School- Maira Ali Khan.,33.96926260895588,72.99101910247171,Combined,KPK,2,2,767,590
33,Govt High School- T & T Colony.,33.96928957717475,72.92525326042686,Combined,KPK,2,2,654,686
31,Govt Girls Middle School Noor Colony. (Female),33.97288,72.91784,Female,KPK,0,2,0,838
43,Govt Primary School- Noor Colony No.1.,33.97302845865542,72.91783550494657,Combined,KPK,2,2,476,431
44,Govt Girls  Primary School- Noor Colony No.1.,33.97307696019381,72.91789018318161,Combined,KPK,2,2,610,551
35,Govt Girls Community Middle Model School- Street No.07 TIP. (Male),33.97379549145824,72.93327932128905,Male,KPK,4,0,1530,0
37,Govt Girls Community Middle Model School- Street No.07 TIP. (Female),33.97381709906573,72.93329904257834,Female,KPK,0,4,0,1428
36,Govt Girls Community Middle Model School- Street No.07 TIP. (Male),33.97387,72.93325,Male,KPK,4,0,1732,0
38,Govt Girls Community Middle Model School- Street No.07 TIP. (Female),33.97387,72.93328,Female,KPK,0,4,0,1617
40,Worker Folks Grammer School for Boys-II Senior Section- Labour Colony Haripur.(Male),33.97548,72.91869,Male,KPK,2,0,744,0
42,Worker Folks Grammer School for Boys-II Junior Section- Labour Colony Haripur.(Female),33.97548,72.91872,Female,KPK,0,2,0,668
25,Govt High School- Central Jail.,33.97617477990237,72.91754903032195,Combined,KPK,2,2,593,514
26,Govt High School- Central Jail.,33.97622558953729,72.91758712556042,Combined,KPK,2,2,507,437
27,Govt Primary School- Central Jail.,33.978630146837986,72.92112448910402,Combined,KPK,2,2,741,632
29,Govt Primary School- Roshanabad. (Female),33.97881,72.93308,Female,KPK,0,3,0,1003
177,Govt Girls Primary School- Muradabad (Female),33.97995,72.95406,Female,KPK,0,2,0,772
172,Govt Primary School- Moonan. (Male),33.98216996595052,72.96458645596624,Male,KPK,3,0,855,0
173,Govt Girls Primary School Moonan.(Female),33.98367,72.95838,Female,KPK,0,2,0,707
183,Govt High School- Sarai Saleh.(Male),33.98463068416483,72.98637733709953,Male,KPK,3,0,895,0
187,Govt High School- Sarai Saleh.,33.98465482076644,72.9863888313906,Combined,KPK,2,2,892,675
169,Govt Primary School- Mohra- Ali Khan.(Male),33.98499358088847,72.9692421372896,Male,KPK,4,0,1461,0
24,Govt Girls Primary School- Pathan Colony. (Female),33.98507282263584,72.92031501730028,Female,KPK,0,4,0,1188
186,Govt Girls Primary School No.2- Sarai Saleh.(Female),33.98536,72.98734,Female,KPK,0,2,0,792
189,Govt Primary  School Maqsood (Female),33.9854,73.03878,Female,KPK,0,3,0,857
184,Govt High School- Sarai Saleh.(Female),33.98566,72.98643,Female,KPK,0,2,0,795
185,Govt Girls Primary School No.2- Sarai Saleh.(Male),33.985729492765444,72.98750956887686,Male,KPK,3,0,996,0
180,Govt Primary School- Sarai Saleh.,33.98654064724237,72.9848607883256,Combined,KPK,2,2,611,522
23,Govt Primary School- Jehangirabad- Darwesh No.2. (Male),33.98674639713836,72.92009810662636,Male,KPK,4,0,1473,0
194,Govt Girls Primary School- Kalawan. (Female)(Mohra Maqsood),33.98677,73.01817,Female,KPK,0,2,0,697
164,Govt Post Graduate College- Haripur. (Male),33.98680422572047,72.90267692604826,Male,KPK,2,0,1394,0
46,Govt Post Graduate College  (Female) Haripur,33.98685318214581,72.90277598570471,Female,KPK,0,3,0,834
165,Govt Post Graduate College- Haripur. (Female),33.98685318214581,72.9028059857047,Female,KPK,0,4,0,1227
181,Govt  Girls Primary School- Sarai Saleh.,33.9871277764163,72.98604049842076,Combined,KPK,2,2,673,637
163,Govt Girls Primary School  Gehr Khan (Female),33.98772,72.95343,Female,KPK,0,3,0,877
168,Govt Primary School- Darwesh (Moh: Khajuran).,33.98780318646717,72.92110925606464,Combined,KPK,2,2,705,608
178,Basic Health Unit- Sarai Saleh (Male).,33.9883463151955,72.98134058881658,Male,KPK,4,0,1687,0
179,Basic Health Unit- Sarai Saleh (Female).,33.98840747136569,72.98137998563165,Female,KPK,0,4,0,1486
170,Govt Girls Primary School-  Ali Khan.(Female),33.98930621812217,72.96687284706026,Female,KPK,0,4,0,1200
166,Govt High School- Darwesh. (Male),33.99041936598563,72.91136193534267,Male,KPK,3,0,846,0
167,Govt High School- Darwesh. (Female),33.9904414841523,72.9113605346401,Female,KPK,0,2,0,760
182,Govt  Primary School- Gar,33.99326702213138,72.98184287970203,Combined,KPK,1,1,405,331
22,Govt Girls Degree College No . 2 Haripur  (Female),33.99408,72.93075,Female,KPK,0,2,0,728
19,Govt Centenial Model Higher Secondary School- Haripur.,33.99414,72.93345,Combined,KPK,1,1,382,351
199,Govt Primary School-Check Mohri (Male).,33.994320160089465,73.05191030213739,Male,KPK,3,0,1060,0
188,Govt Girls Primary School- Maqsood.(Male),33.9944016,72.93323,Male,KPK,3,0,1033,0
190,Govt Primary School- Maira Toot.,33.9944016,72.93326,Combined,KPK,1,1,168,193
191,Govt Primary School- Thanda Choa.,33.9944016,72.93329,Combined,KPK,2,2,859,720
193,Govt Girls Primary School- Kalawan. (Male),33.9944016,72.93332,Male,KPK,3,0,894,0
195,Govt Primary School- Nikka Pah.,33.9944016,72.93335,Combined,KPK,1,1,339,271
196,Govt Primary School- Akhoon Bandi (Male).,33.9944016,72.93338,Male,KPK,3,0,878,0
197,Govt: Girls Primary School- Akhoon Bandi (Female).,33.9944016,72.93341,Female,KPK,0,2,0,714
198,Govt Primary School- Mohri.,33.9944016,72.93344,Combined,KPK,2,1,547,484
20,Govt Girls Degree College No . 2 Haripur,33.9944016,72.93347,Combined,KPK,2,2,684,639
200,Govt Girls Primary School- Check Mohri  (Female).,33.99467206989879,73.05031576522691,Female,KPK,0,3,0,910
136,Govt High School- Pind Hashim Khan. (Male),33.9948947,72.9282041,Male,KPK,3,0,1150,0
137,Govt Primary School- Nartopa. (Female),33.9948947,72.9282341,Female,KPK,0,3,0,1018
139,Govt Primary School- Pharari. (Male),33.9948947,72.9282641,Male,KPK,4,0,1315,0
140,Govt Girls Primary School- Pharari. (Female),33.9948947,72.9282941,Female,KPK,0,4,0,1302
141,Govt Primary School- Chapri.,33.9948947,72.9283241,Combined,KPK,2,2,592,522
126,Govt Middle School- Bandi Mian Pirdad.,33.9948947,72.9283541,Combined,KPK,2,2,812,607
108,Basic Health Unit- Mankarai.,33.9949133,72.9282712,Combined,KPK,2,2,810,717
109,Govt Girls Primary School- Mankarai.,33.9949133,72.9283012,Combined,KPK,2,2,586,499
110,Govt Middle School-Mankarai.,33.9949133,72.9283312,Combined,KPK,2,2,778,710
111,Govt Primary School-Mohra Mamdoo. (Male),33.9949133,72.9283612,Male,KPK,3,0,874,0
113,Govt High School- Pharalla.(Male),33.9949133,72.9283912,Male,KPK,4,0,1647,0
114,Govt Girls Middle School- Pharalla. (Female),33.9949133,72.9284212,Female,KPK,0,4,0,1499
115,Govt Primary School-Khaka.,33.9949133,72.9284512,Combined,KPK,2,2,856,740
106,Govt Girls Primary School- Neelore Maira.,33.9949133,72.9284812,Combined,KPK,2,2,697,617
107,Govt Girls Primary School- Teer.,33.9949133,72.9285112,Combined,KPK,2,2,831,700
174,Govt Primary School- Shah Muhammad.,33.9949694,72.9280161,Combined,KPK,2,2,803,672
176,Govt Primary School- Muradabad. (Male),33.9949694,72.9280461,Male,KPK,3,0,966,0
153,Govt Girls Primary School- Pandak. (Female),33.9949694,72.9280761,Female,KPK,0,1,0,329
154,Govt Primary School- Pandak. (Male),33.9949694,72.9281061,Male,KPK,1,0,345,0
155,Govt Girls Primary School No.2-Soka Pandak. (Male),33.9949694,72.9281361,Male,KPK,1,0,442,0
156,Govt Girls Primary School No.2-Soka Pandak. (Female),33.9949694,72.9281661,Female,KPK,0,1,0,392
159,Govt Girls Primary School- Talokar. (Female),33.9949694,72.9281961,Female,KPK,0,2,0,581
157,Govt Girls Middle School- Talokar.,33.9949694,72.9282261,Combined,KPK,2,2,790,648
160,Govt Girls Middle School- Talokar.(Male),33.9949694,72.9282561,Male,KPK,3,0,1109,0
161,Govt Girls Middle School- Talokar. (Female),33.9949694,72.9282861,Female,KPK,0,3,0,975
162,Govt Primary School- Gehr Khan. (Male),33.9949694,72.9283161,Male,KPK,3,0,979,0
135,Govt Girls Middle School- Magri.,33.9949694,72.9283461,Combined,KPK,2,2,648,498
28,Govt Primary School- Roshanabad. (Male),33.9949694,72.9283761,Male,KPK,3,0,1108,0
15,Govt Model Middle School- Haripur.,33.9955476,72.9300001,Combined,KPK,2,2,771,681
16,Govt Girls Primary School No.2- Haripur.,33.9955476,72.9300301,Combined,KPK,2,2,708,694
18,Govt Centenial Model Higher Secondary School- Haripur.,33.9955476,72.9300601,Combined,KPK,2,1,485,435
21,Govt Primary School No.3- Haripur.(Male ),33.9955476,72.9300901,Male,KPK,2,0,770,0
32,Govt Primary School- Qaziabad.,33.9955476,72.9301201,Combined,KPK,2,1,507,408
39,Worker Folks Grammer School for Boys-II Senior Section- Labour Colony Haripur.(Male),33.9955476,72.9301501,Male,KPK,3,0,865,0
41,Worker Folks Grammer School for Boys-II Junior Section- Labour Colony Haripur.(Female),33.9955476,72.9301801,Female,KPK,0,3,0,825
221,Govt Girls Primary School Changi Bandi,33.99686,73.02724,Combined,KPK,2,1,526,463
220,Govt Girls Primary School- Changi Bandi.,33.99686472413896,73.02727275459195,Combined,KPK,2,1,462,341
17,Govt Model Middle School- Haripur.,33.99710769529919,72.93032948578792,Combined,KPK,1,1,424,355
7,Govt Girls Primary School No.3- Haripur.,33.99837106670548,72.93643115468801,Combined,KPK,2,2,521,485
8,Govt Girls Primary School No.3- Haripur. (Male),33.99837106670548,72.936461154688,Male,KPK,2,0,761,0
9,Govt Girls Primary School No.3- Haripur.( Female),33.99837106670548,72.936491154688,Female,KPK,0,2,0,731
13,Govt High School No.2- Haripur. (Male),33.99858,72.94082,Male,KPK,2,0,765,0
12,Govt High School No.2- Haripur. (Male),33.99858307677134,72.94074927939916,Male,KPK,3,0,838,0
14,Govt High School No.2- Haripur. (Female),33.998589660719325,72.94075112734245,Female,KPK,0,4,0,1466
223,Govt High School- Changi Bandi. (Female),33.99859,73.03238,Female,KPK,0,2,0,631
222,Govt High School- Changi Bandi. (Male),33.99859047318064,73.03236000106911,Male,KPK,3,0,813,0
225,Govt Primary School- Changi Bandi.,33.9988,73.0323,Combined,KPK,1,1,420,333
4,Govt Girls High School No.2- Haripur.(Male),33.999094836260454,72.93076539729198,Male,KPK,3,0,1109,0
149,Office of XEN Public Health-Haripur. (Male),33.99913,72.94097,Male,KPK,4,0,1388,0
5,Govt Girls High School No.2- Haripur. (Female),33.99914402354578,72.93079021712494,Female,KPK,0,3,0,1068
11,Govt Primary School No.1- Haripur.(Female),33.99916,72.93901,Female,KPK,0,2,0,767
10,Govt Primary School No.1- Haripur. (Male),33.99919457092996,72.93896458570035,Male,KPK,3,0,801,0
148,Office of XEN Public Health-Haripur. (Male),33.99919964171161,72.94108187727784,Male,KPK,4,0,1388,0
224,Govt Primary School- Changi Bandi.,33.99942898822336,73.03217182867637,Combined,KPK,2,2,523,465
3,Govt Girls Post Graduate Collage-Haripur. (Female),34.000193524080224,72.93015360120624,Female,KPK,0,4,0,1398
1,Govt Girls Post Graduate Collage-Haripur. (Male),34.00020488734317,72.93012561395848,Male,KPK,2,0,733,0
2,Govt Girls Post Graduate Collage-Haripur. (Male),34.00020488734317,72.9301556139585,Male,KPK,2,0,790,0
45,Govt Post Graduate College (Male) Haripur,34.0003,72.93031,Male,KPK,3,0,999,0
6,City Middle School No.4- Haripur.,34.00143274180831,72.93128395951749,Combined,KPK,2,2,581,542
147,District Director Extension Agriculture Office- Haripur.,34.00255645581129,72.94121859892961,Combined,KPK,2,2,736,678
150,Office of Union Council-Sikandarpur. (Female),34.00329974682083,72.94172473794872,Female,KPK,0,4,0,1288
151,Office of Union Council-Sikandarpur. (Female),34.00339,72.94161,Female,KPK,0,3,0,1288
145,Govt Primary School- Sikandarpur. (Male),34.00353109558208,72.9399160123333,Male,KPK,4,0,1388,0
146,Govt Girls Primary School- Sikandarpur. (Female),34.00358159961638,72.93994892505458,Female,KPK,0,4,0,1267
152,Govt Girls Middle School Sikanderpur,34.00358159961638,72.9399789250546,Combined,KPK,2,2,511,418
103,Govt Girls Primary School- Pind Hashim Khan.(Male),34.0050083,72.9338298,Male,KPK,3,0,969,0
105,Govt Primary School- Pind Hashim Khan.,34.0050083,72.9338598,Combined,KPK,2,2,661,555
116,Govt High School- Sarai Niamat Khan.,34.0050083,72.9338898,Combined,KPK,2,1,493,452
117,Govt High School- Sarai Niamat Khan.,34.0050083,72.9339198,Combined,KPK,2,2,772,680
118,Rural Health Center- Sarai Niamat Khan.,34.0050083,72.9339498,Combined,KPK,2,1,563,404
119,Rural Health Center- Sarai Niamat Khan.,34.0050083,72.9339798,Combined,KPK,2,2,583,515
120,Govt Primary School- Banda Munir Khan.,34.0050083,72.9340098,Combined,KPK,2,2,699,615
121,Govt Girls Primary School- Banda Munir Khan.,34.0050083,72.9340398,Combined,KPK,2,1,571,490
122,Govt Primary School- Talhad. (Male),34.0050083,72.9340698,Male,KPK,3,0,1005,0
124,Govt Primary School- Dharam Pani.,34.0050083,72.9340998,Combined,KPK,2,2,670,618
125,Govt Middle School- Sarrian Dharam Pani.,34.0050083,72.9341298,Combined,KPK,2,2,766,644
127,Govt Primary School- Bayan Ahmad Ali Khan.,34.0050083,72.9341598,Combined,KPK,2,2,676,658
128,Govt Primary School- Bandi Mian Pirdad.,34.0050083,72.9341898,Combined,KPK,2,2,759,587
129,Govt High School-Noorpur.(Male),34.0050083,72.9342198,Male,KPK,3,0,1063,0
131,Govt Primary School- Noorpur.,34.0050083,72.9342498,Combined,KPK,2,2,711,575
132,Govt Girls Primary School- Shingri.,34.0050083,72.9342798,Combined,KPK,1,1,368,330
133,Govt Primary School- Karach.,34.0050083,72.9343098,Combined,KPK,1,1,403,321
134,Govt Girls Middle School- Paswal.,34.0050083,72.9343398,Combined,KPK,2,2,583,520
214,Govt Girls Primary School- Malkyar. (Female),34.00794900115644,72.92311978231261,Female,KPK,0,4,0,1199
213,Govt Girls Primary School- Malkyar. (Male),34.00795359120963,72.9231102891501,Male,KPK,4,0,1427,0
211,Govt Primary School-Malkyar(Male),34.00849500642816,72.92733466502615,Male,KPK,3,0,849,0
212,Govt Primary School-Malkyar. (Female),34.00859,72.92711,Female,KPK,0,2,0,794
217,Basic Health Unit- Dheri Sikandarpur.,34.010933240845205,72.94387360901015,Combined,KPK,2,2,557,482
112,Govt  Girls Primary School-Mohra Mamdoo.(Female),34.01152,72.95681,Female,KPK,0,2,0,717
219,Govt Primary School- Dheri Sikandarpur. (Female),34.01257,72.94989,Female,KPK,0,3,0,1017
218,Govt Primary School- Dheri Sikandarpur.(Male),34.013671327470995,72.94936283885512,Male,KPK,4,0,1230,0
216,Govt Primary School-Makhan Colony.(Female),34.018084471128226,72.93942916154266,Female,KPK,0,3,0,991
215,Govt Primary School-Makhan Colony.(Male),34.018126337309454,72.93944389378939,Male,KPK,4,0,1292,0
144,Govt Primary School- Jama.,34.03823902193882,72.92780771574088,Combined,KPK,2,2,742,651
138,Govt High School- Pind Hashim Khan.,34.03909,73.0115,Combined,KPK,2,2,746,637
143,Govt Girls  Primary School- Jogi Mohra.,34.04014172477808,72.93826511035336,Combined,KPK,1,1,547,465
142,Govt Primary School- Bajeeda.,34.040388514971106,72.94670419142325,Combined,KPK,1,1,531,501
94,Govt High School- Jatti Pind.,34.04477631449888,72.95317842975344,Combined,KPK,2,2,923,813
104,Govt Girls Primary School- Pind Hashim Khan.(Female),34.05617,73.00362,Female,KPK,0,2,0,787
95,Govt Primary School- Sumbal Negir.,34.05630691362768,72.97805647539418,Combined,KPK,1,1,428,384
93,Govt Primary  School- Dana Colony.,34.06166284668325,72.94936467935253,Combined,KPK,2,2,622,542
97,Govt Girls High School Kaag (Female),34.06351424493005,72.94425182308721,Female,KPK,0,4,0,1301
96,Govt High School- Kaag.(Male),34.06802533130446,72.93969442187921,Male,KPK,4,0,1560,0
99,Govt High School- Alloli.,34.07365030916577,72.96924530177913,Combined,KPK,2,1,536,462
100,Govt High School- Alloli.,34.07365030916577,72.9692753017791,Combined,KPK,2,1,524,472
130,Govt High School-Noorpur.(Female),34.07393,73.07862,Female,KPK,0,3,0,847
98,Govt Primary School- Bhan Gharham.,34.07635579927987,72.96658148482058,Combined,KPK,2,2,860,689
102,Govt Girls Primary School- Alloli.,34.07829959870179,72.97300956709958,Combined,KPK,2,2,700,673
101,Govt Primary School- Alloli.,34.07839559801471,72.97294603122981,Combined,KPK,2,2,729,620
90,Govt Primary School-Neelore.,34.08504986567686,72.9966559847397,Combined,KPK,2,2,792,703
76,Govt Girls Primary School- Darwaza.,34.09183105277633,72.95003800025721,Combined,KPK,2,1,605,534
91,Govt Primary School-Bhat.,34.10231934924008,73.00191491445223,Combined,KPK,1,1,475,424
79,Govt Middle School- Goraki.,34.10251025680111,72.9844178990334,Combined,KPK,2,2,640,551
92,Govt Primary School- Behki.,34.104224290255786,73.02080412496507,Combined,KPK,1,1,448,411
77,Govt Primary School- Chanjiala.,34.105079135038274,72.94411069593683,Combined,KPK,2,1,520,427
123,Govt Girls Primary School- Talhad. Female),34.11114,73.05391,Female,KPK,0,3,0,858
89,Govt Middle School- Banda Mughlan.,34.113637847945505,73.02411532746888,Combined,KPK,2,2,717,616
78,Govt Midddle School- Kacchi.,34.11587221781213,72.95738558850441,Combined,KPK,2,2,959,813
88,Govt High School- Kakotri. (Female),34.12452,73.01176,Female,KPK,0,4,0,1157
87,Govt High School- Kakotri.(Male),34.12467156851643,73.01182715978067,Male,KPK,4,0,1193,0
84,Govt Primary School-Airan.,34.125344146475825,72.98783085691257,Combined,KPK,2,2,692,665
86,Govt Primary School- Nalaki.,34.13114015564243,73.00751659178384,Combined,KPK,2,1,583,492
85,Govt Primary School-Talhala,34.13139429560099,72.99396965342025,Combined,KPK,2,2,789,784
57,Govt Primary School- Sawabi Maira (Male).,34.131439465998795,72.85901358978167,Male,KPK,3,0,1103,0
58,Govt Girls Primary School- Swabi Maira.(Female),34.133071132080254,72.86114047682331,Female,KPK,0,3,0,891
83,Govt High School- Macha Da Maira.,34.13583421184083,72.98750164097447,Combined,KPK,2,2,814,709
59,Govt Primary School-Chajjaka.,34.13887258356287,72.88395475598367,Combined,KPK,1,1,223,139
55,Govt Primary School- Saidpur Jam.(Male),34.14939259106347,72.91865310314344,Male,KPK,3,0,1104,0
56,Govt Primary School- Saidpur Jam. (Female),34.14949,72.9186,Female,KPK,0,3,0,1064
82,Govt Primary School- Kangar Amgah.,34.15076695971524,73.01866182346691,Combined,KPK,2,1,665,556
53,Govt Primary School-  Kalinger No.2.,34.15232185357178,72.86807659619777,Combined,KPK,2,2,718,624
81,Govt Higher Secondary School- Beer. (Female),34.16042578973882,72.95871034452223,Female,KPK,0,3,0,1182
80,Govt Higher Secondary School- Beer. (Male),34.1649556876271,72.95353411179289,Male,KPK,4,0,1269,0
52,Govt High School- Kalinger.,34.166783862579564,72.8724683661218,Combined,KPK,2,2,1069,923
54,Govt Primary School-  Kalinger No.1.,34.16718353123415,72.87683564361461,Combined,KPK,2,2,674,573
51,Govt Primary School- Dana Kalinger.,34.176081747930695,72.85344947914254,Combined,KPK,2,2,727,565
64,Govt Primary School- Tavi.,34.18444879302205,72.83694753842714,Combined,KPK,1,1,142,92
63,Govt Primary School- Kanikot.,34.186125299381224,72.92890397421844,Combined,KPK,1,1,332,325
62,Govt Primary School Mari,34.19486,72.8825,Combined,KPK,1,1,428,369
61,Govt Primary School- Gandaf.,34.195458762920126,72.86640616539047,Combined,KPK,2,2,601,548
72,Govt Primary School- Swar Maira.,34.19843622428318,72.85491029740017,Combined,KPK,2,1,681,502
60,Govt Primary School- Kheri.,34.199539590764665,72.90357288425831,Combined,KPK,1,1,436,417
66,Govt Girls Primary School- Dalri.,34.20486815766396,72.9331504201717,Combined,KPK,2,2,646,563
65,Govt Primary School- Dalri.,34.20635601564798,72.93877183759568,Combined,KPK,1,1,525,448
68,Govt Primary School-Chaintri.,34.20792708037297,72.95464367668201,Combined,KPK,2,2,725,678
67,Govt Primary School- Hall Judal.,34.20962491137914,72.9629470866612,Combined,KPK,2,2,767,619
71,Govt Primary School- Bandi Labial.,34.21890888410621,72.93364785843703,Combined,KPK,2,1,512,465
48,Govt Primary School- Pamba.,34.22220166503707,72.87952795612883,Combined,KPK,1,1,276,238
49,Govt Primary School- Ladarmang.,34.22559572117777,72.89692718774795,Combined,KPK,2,1,476,377
50,Govt High School- Badhora.,34.22751367671008,72.90889330800626,Combined,KPK,1,2,476,496
70,Govt Primary School- Kund Kalu Khan.,34.230869909191924,72.93680810940984,Combined,KPK,1,1,477,361
47,Govt Middle School- Hassan Bhai.,34.23728916355111,72.88042813921311,Combined,KPK,2,2,591,500
69,Govt Primary School- Karlakian.,34.24488422684717,72.92078447864354,Combined,KPK,2,1,486,425
73,Govt Primary School- Dera.,34.27236916793129,72.84637339703134,Combined,KPK,2,2,813,583
75,Govt Primary School- Saijpur.,34.279006542459676,72.90537382387183,Combined,KPK,2,1,510,390
74,Govt Girls Middle School-Kariplian.,34.290668070097524,72.84844471405886,Combined,KPK,2,2,828,747
