StationId,PollingStation,Lat,Lng,BoothType,Province,MaleBooths,FemaleBooths,MaleVoters,FemaleVoters
111,Govt. Primary School Rum Wali       (Combined)    *P,29.583182791563054,73.2517606129073,Combined,Punjab,2,1,1103,507
109,Govt. High School Raju Wala        (Male)    *P,29.611603119039877,73.27980364114072,Male,Punjab,2,0,1196,0
108,Govt. Girls Model Primary School Mahmood Pura            (Combined)    *P,29.61210985704317,73.21356226037332,Combined,Punjab,2,1,936,653
110,Basic Health Centre Raju Wala        (Female)    *P,29.615191129170615,73.27754292428584,Female,Punjab,0,2,0,662
211,Govt. primary School Hazoor Singh Mouza Ghurmakh Singh    (Combined)    *P,29.638953444705,73.20290120063277,Combined,Punjab,2,1,1060,641
107,Govt. Primary School Bhawan Shah           (Combined)    *P,29.642221642381624,73.29441475563374,Combined,Punjab,2,1,754,510
106,Govt. Primary School Bhawan Shah           (Combined)    *P,29.642221642381624,73.2944447556337,Combined,Punjab,1,1,543,354
212,Govt. primary School Labh Singh       (Combined)    *P,29.65299143572682,73.23254077538098,Combined,Punjab,2,1,841,617
286,Govt. Girls Primary School Roda Singh    (Combined)    *P,29.65740731650649,73.23927396255901,Combined,Punjab,2,1,792,552
289,Govt. Girls Primary School Roda Singh    (Combined)    *P,29.65740731650649,73.239303962559,Combined,Punjab,1,1,501,361
213,Govt. Boys Primary School Ali Muhammad Chishti (Ahata Muhammad Khan)    (Combined)    *P,29.661752663251054,73.16672787765695,Combined,Punjab,2,2,1192,683
114,Govt. Boys High School Ghulab Ali Rati Rampura        (Combined)    *P,29.6709271019152,73.27400890033351,Combined,Punjab,2,1,793,534
115,Govt. Boys High School Ghulab Ali Rati Rampura        (Combined)    *P,29.6709271019152,73.2740389003335,Combined,Punjab,1,1,503,369
214,Office Union Council Khattan    (Combined)    *P,29.673321626160135,73.18015628194732,Combined,Punjab,1,1,467,317
215,Office Union Council Khattan    (Combined)    *P,29.673321626160135,73.1801862819473,Combined,Punjab,2,1,755,532
216,Govt. Girls Middle School Khattan       (Combined)    *P,29.675048817335767,73.18465009720931,Combined,Punjab,2,1,748,515
112,Govt. Girls Middle School Ghulab Ali Teku Rampura     (Female)    *P,29.676898741393796,73.2712628748604,Female,Punjab,0,2,0,974
217,Govt. Boys High School Khattan    (Combined)    *P,29.678082740130254,73.1794777519356,Combined,Punjab,2,1,854,577
116,Basic Health Unit Ghulab Ali     (Female)    *P,29.690661052323495,73.2695499599107,Female,Punjab,0,2,0,1011
117,Basic Health Unit Ghulab Ali     (Male)    *P,29.690661052323495,73.2695799599107,Male,Punjab,3,0,1553,0
113,Basic Health Centre Ghulab Ali         (Male)    *P,29.690668963825573,73.26956779273677,Male,Punjab,3,0,1286,0
202,Govt. Boys Primary School Qazi Wala Gurbachan Singh     (Combined)    *P,29.69776364,73.12679057,Combined,Punjab,2,2,1121,721
287,Govt Boys Primary Scool Chak Aziz Din    (Combined)    *P,29.7006742705628,73.20274938071279,Combined,Punjab,2,1,791,510
288,Govt. Primary School Hari Ram pura    (Combined)    *P,29.702533370017854,73.22451826209615,Combined,Punjab,2,2,766,520
195,Govt. Boys primary School Hakim Ameer-U-Din     (Combined)    *P,29.7034233,73.0823917,Combined,Punjab,2,1,1007,605
118,Govt. Primary School Bajik      (Combined)    *P,29.704466769767755,73.27140340400115,Combined,Punjab,1,1,672,447
119,Govt. Primary School Bajik      (Combined)    *P,29.704466769767755,73.2714334040011,Combined,Punjab,1,1,893,701
204,Govt. Boys High School Khetranwala          (Combined)    *P,29.70595773080669,73.16642251721562,Combined,Punjab,1,1,565,419
205,Govt. Boys High School Khetranwala          (Combined)    *P,29.70595773080669,73.1664525172156,Combined,Punjab,2,1,780,582
206,Govt. Boys Primary School Fazal Hussainwala    (Combined)    *P,29.72949513,73.1625784,Combined,Punjab,1,1,543,411
207,Govt. Boys Primary School Fazal Hussainwala    (Combined)    *P,29.72949513,73.1626084,Combined,Punjab,1,1,608,405
201,Govt. Girls Community Model School Nathoo Dhakka     (Combined)    *P,29.732961033256846,73.12233988526698,Combined,Punjab,2,1,857,591
199,Govt.Boys Middle School Nathoo Dhakka        (Combined)    *P,29.733803803424195,73.12237468792816,Combined,Punjab,1,1,615,407
123,Govt. Boys Middle School Toba Rehman Shah          (Combined)    *P,29.737657922603464,73.314084264079,Combined,Punjab,2,2,1074,764
69,Govt. Primary School Basti Kokarian Wali     (Male)    *P,29.74209868855329,73.23144470348541,Male,Punjab,4,0,1905,0
203,Govt. Boys Primary School Said Sar Akkanwali    (Combined)    *P,29.74219092,73.12497644,Combined,Punjab,2,2,1198,740
70,Govt. Primary School Basti Akoka Mohallah Hiji Sheney Khan     (Female)    *P,29.746283575166856,73.23819692731107,Female,Punjab,0,3,0,1371
121,Govt. Girl High School Soondha  (Combined)    *P,29.74722,73.29144,Combined,Punjab,2,2,1053,757
200,Govt. Boys Primary School Ramzan Shah        (Combined)    *P,29.74734916326718,73.09797307766327,Combined,Punjab,2,1,729,571
120,Boys High School Soondha Part-II            (Combined)    *P,29.747798481395233,73.29733312043712,Combined,Punjab,2,1,734,509
122,Govt. Boys High School Soondha Part-I        (Combined)    *P,29.747810719819455,73.29731041307242,Combined,Punjab,1,1,595,444
193,Govt. Boys Primary School Naseera Jhodheka    (Combined)    *P,29.75087874645894,73.0705972586908,Combined,Punjab,2,1,810,435
74,Govt. Girls High School Doonga Boonga Middle Portion      (Female)    *P,29.750974464964536,73.24392945609924,Female,Punjab,0,3,0,1251
194,Govt. Girls Primary School Naseera Jhodheka    (Combined)    *P,29.752054848005137,73.07217434258422,Combined,Punjab,1,1,669,366
75,Govt. Girls High School Doonga Boonga Portion High      (Male)    *P,29.753619805231278,73.2392645588837,Male,Punjab,3,0,1592,0
71,Rural Health Center Doonga Bunnga       (Female)    *P,29.753639863866397,73.2446428751192,Female,Punjab,0,3,0,1544
76,Govt. Girls Higher Secondary School Donga Bonga     (Female)    *P,29.75365382322612,73.23933671922697,Female,Punjab,0,2,0,1182
72,Rural Health Centre Doonga Bunga      (Male)    *P,29.753666502936426,73.24463658088528,Male,Punjab,2,0,1202,0
73,Rural Health Centre Doonga Bunga      (Male)    *P,29.753666502936426,73.2446665808853,Male,Punjab,2,0,955,0
77,Govt. Girls Higher Secondary School Donga Bonga      (Male)    *P,29.7536767046799,73.2392915974703,Male,Punjab,3,0,1518,0
78,Govt. Higher Secondary School Doonga Bunga       (Male)    *P,29.753683432361377,73.23765514996003,Male,Punjab,2,0,1073,0
79,Govt. Higher Secondary School Doonga Bunga       (Male)    *P,29.753687064908057,73.23764188932427,Male,Punjab,2,0,1052,0
80,Govt. Higher Secondary School Doonga Bunga       (Female)    *P,29.753687064908057,73.2376718893243,Female,Punjab,0,3,0,1542
138,Govt Boys primary  School Sundar Bishnoian        (Combined)    *P,29.76108032181039,73.31408392818234,Combined,Punjab,1,1,388,251
144,Al-Khair Public School Chak Bahma Hans (Combined)    *P,29.76138,73.31931,Combined,Punjab,1,1,648,454
208,Govt. Girls primary School Basti Mogga       (Female)    *P,29.76224933300651,73.19265614512645,Female,Punjab,0,2,0,1059
209,Govt. Boys Primary School Basti Mogga   Mauza Kamal Mohammad ( Male)    (Male)    *P,29.762321791148363,73.1860709656146,Male,Punjab,3,0,1673,0
210,Govt. Girls Primary School Sher Muhammad Khan   (Akkanwali Khurd)     (Combined)    *P,29.76431828,73.14655698,Combined,Punjab,2,1,905,619
127,Govt. Girls Elementary  School Dinan Bashnoian            (Combined)    *P,29.7660537737799,73.26378486036965,Combined,Punjab,2,1,911,666
223,Govt. Boys Primary School (Tanzeem) Jahane Wala     (Combined)    *P,29.766410463701497,73.20383761546812,Combined,Punjab,2,1,825,530
126,Govt. Boys Middle School Dinan Wala       (Combined)    *P,29.76813823506369,73.26528043060485,Combined,Punjab,2,1,942,726
220,Govt. Primary School Sundar Wali Kaisar Singh    (Combined)    *P,29.769672938677363,73.21847819197664,Combined,Punjab,2,2,1168,737
198,Govt. Girls High School Jand Wala       (Female)    *P,29.778096581894275,73.1041516545404,Female,Punjab,0,3,0,1602
228,Govt. Primary School Boys Chak NO. 18/G      (Combined)    *P,29.78084770891719,72.9045054371667,Combined,Punjab,1,1,518,450
229,Govt. Primary School Boys Chak NO. 18/G      (Combined)    *P,29.78084770891719,72.9045354371667,Combined,Punjab,1,1,711,516
196,Govt. Boys High School Jand Wala       (Male)    *P,29.785947108708317,73.10430983751404,Male,Punjab,2,0,1010,0
197,Govt. Boys High School Jand Wala       (Male)    *P,29.785947108708317,73.104339837514,Male,Punjab,2,0,1253,0
227,Govt. Primary School Boys Chak NO. 17/G          (Combined)    *P,29.786070057229082,72.88463859203162,Combined,Punjab,2,2,1052,865
187,Govt. Girls English Medium High School Mohib Ali     (Combined)    *P,29.78751777,73.18930343,Combined,Punjab,2,2,1000,652
137,Govt Boys Primary  School Tara Jat        (Combined)    *P,29.788793494073282,73.3074834105044,Combined,Punjab,1,1,651,437
221,Govt. Boys Middle School Sooraj Ganj      (Male)    *P,29.78982512,73.23372892,Male,Punjab,3,0,1298,0
222,Govt. Boys Middle School Sooraj Ganj      (Female)    *P,29.78982512,73.23375892,Female,Punjab,0,2,0,938
226,Govt. High School Boys Chak NO. 23/G          (Combined)    *P,29.791622733247845,72.93883730769528,Combined,Punjab,2,2,1065,828
184,Govt. Boys High School Kat Allah Yar Chashti    (Combined)    *P,29.79610777,73.17128521,Combined,Punjab,1,1,511,311
143,Govt. Girls Primary School  Kat Dial Wali (Combined)  *P,29.79647,73.25188,Combined,Punjab,2,2,1185,814
246,Govt. Primary School Model  24/G     (Combined)    *P,29.796696996439458,72.98463032447799,Combined,Punjab,2,1,686,557
125,Gpvt. Girls Primary School Khiraj Pura          (Female)    *P,29.79904934282406,73.25367412617275,Female,Punjab,0,3,0,1296
124,Govt. Boys Primary School Khiraj Pura       (Male)    *P,29.79912095338532,73.25381287809029,Male,Punjab,4,0,1923,0
224,Rural Health Centre Farid Kot Chak NO. 23/G       (Male)    *P,29.80209597990201,72.9320765235277,Male,Punjab,2,0,1229,0
225,Rural Health Centre Farid Kot Chak NO. 23/G       (Female)    *P,29.80209597990201,72.9321065235277,Female,Punjab,0,2,0,969
245,Govt. Boys Primary School Chak No.22/G     (Combined)    *P,29.803657739347493,72.93456768379143,Combined,Punjab,1,1,308,237
161,Govt. Primary School Dholi Wala     (Combined)    *P,29.804533066154402,73.08498981910647,Combined,Punjab,1,1,604,500
162,Govt. Primary School Dholi Wala     (Combined)    *P,29.804533066154402,73.0850198191065,Combined,Punjab,1,1,576,406
233,Govt-Girls Middle School 30/G     (Combined)    *P,29.807773905821094,73.0372780336562,Combined,Punjab,2,1,710,544
234,Govt-Girls Middle School 30/G     (Combined)    *P,29.807773905821094,73.0373080336562,Combined,Punjab,1,1,727,517
247,Govt. Girls Middle School 27/G     (Combined)    *P,29.81059628363659,72.98968705598391,Combined,Punjab,1,1,592,477
146,Govt. Girls Elementary School Korian wali       (Combined)    *P,29.811549137135763,73.33054138576485,Combined,Punjab,1,1,517,455
185,Basic Health Center PunjKosi    (Male)    *P,29.81182655,73.16145818,Male,Punjab,3,0,1374,0
186,Basic Health Center PunjKosi    (Female)    *P,29.81182655,73.16148818,Female,Punjab,0,2,0,773
145,Govt. Boys Primary School Korian wali           (Combined)    *P,29.81259044576907,73.32894678344023,Combined,Punjab,1,1,671,499
140,Govt. Girls Elementary School Ram Pura          (Female)    *P,29.813640968272537,73.31433456748545,Female,Punjab,0,3,0,1533
231,Govt. High School Boys 28/G (Middle Portion)    (Female)    *P,29.81423145861091,73.008684233421,Female,Punjab,0,2,0,1117
232,Govt. High School Boys 28/G(High Portion)    (Male)    *P,29.814542835097516,73.0085388242868,Male,Punjab,3,0,1370,0
235,Govt.Primary School Model 26/G    (Combined)    *P,29.81497008657823,72.9567715617877,Combined,Punjab,2,1,751,508
141,Govt. Boys High School Ram Pura         (Male)    *P,29.815587521562957,73.30819949655749,Male,Punjab,4,0,1756,0
142,Govt. Boys High School Ram Pura         (Male)    *P,29.815587521562957,73.3082294965575,Male,Punjab,2,0,367,0
256,Govt. Primary School Model  Chak NO. 11/G     (Female)    *P,29.822077130375472,72.91180628762987,Female,Punjab,0,4,0,1907
257,Govt. Primary School Boys Chak NO. 11/G      (Male)    *P,29.824153780966192,72.91194799256556,Male,Punjab,2,0,1189,0
258,Govt. Primary School Boys Chak NO. 11/G      (Male)    *P,29.824153780966192,72.9119779925656,Male,Punjab,2,0,1074,0
218,Govt. Primary School Mangla Nai     (Combined)    *P,29.826190457103188,73.19591382731907,Combined,Punjab,2,1,919,645
191,Govt. Girls Primary school Najeeb Abad      (Combined)    *P,29.829712590978637,73.16951059798517,Combined,Punjab,1,1,740,445
242,Union Council Office 7/G    (Combined)    *P,29.830007360958877,72.97598183119767,Combined,Punjab,1,1,286,273
241,Govt. High School Girls 6/G     (Combined)    *P,29.83071827522994,72.98126008680373,Combined,Punjab,2,2,1031,857
189,Govt.Boys High School Nathey Wala       (Combined)    *P,29.831440029624844,73.11897858599019,Combined,Punjab,1,1,646,395
188,Govt.Boys High School Nathey Wala       (Combined)    *P,29.831440029624844,73.1190085859902,Combined,Punjab,1,1,638,340
254,Govt. Primary School Boys Chak NO. 3/FW manzoor wala      (Male)    *P,29.831732123726177,72.88049892215777,Male,Punjab,3,0,1661,0
285,Govt. Primary School Boys Kora Bhotna    (Combined)    *P,29.83344,72.78038,Combined,Punjab,2,2,955,709
219,Govt. Boys Middle School Kishen Gharh        (Combined)    *P,29.83599524,73.2307999,Combined,Punjab,1,1,649,446
244,Govt. High School Boys 9/G     (Combined)    *P,29.836190806251942,72.94901387617264,Combined,Punjab,1,1,628,552
240,Govt. Girls Primmary School 5/G    (Combined)    *P,29.83797,73.00093,Combined,Punjab,1,1,502,415
252,Govt. Primary School Boys Chak NO. 2/FW     (Male)    *P,29.838162301573277,72.89035648212922,Male,Punjab,3,0,1460,0
253,Govt. Primary School Boys Chak NO. 2/FW     (Female)    *P,29.838162301573277,72.8903864821292,Female,Punjab,0,2,0,1101
163,Govt. Boys Primary School Nehalka       (Combined)    *P,29.841319686072804,73.05778082387626,Combined,Punjab,2,2,1094,791
190,Govt. Boys Primary School Gajjiana     (Combined)    *P,29.842798878657053,73.16070866954902,Combined,Punjab,1,1,619,475
153,Govt. Girls High school Noor sir     (Male)    *P,29.84290561964358,73.09492875341978,Male,Punjab,2,0,1212,0
154,Govt. Girls High school Noor sir     (Male)    *P,29.84290561964358,73.0949587534198,Male,Punjab,3,0,1294,0
130,Govt.  Middle boys School Sawi Wala         (Male)    *P,29.842934254348425,73.2485995343401,Male,Punjab,2,0,1263,0
129,Govt Girls Middle School Swai wala            (Female)    *P,29.843967340768227,73.24513171858135,Female,Punjab,0,2,0,1023
255,Govt. Community Center Chak NO. 3/FW Rehaman Wala     (Female)    *P,29.844256384346448,72.88082809258327,Female,Punjab,0,2,0,1228
230,Govt. Girls Primary School Chak No 4/G    (Combined)    *P,29.845010784129535,73.0263570419603,Combined,Punjab,2,1,742,601
155,Govt.Boys High School Noor Sir    (Female)    *P,29.847460201554668,73.09320178991477,Female,Punjab,0,4,0,1769
139,Govt Boys primary  School Bhako Shah          (Combined)    *P,29.847669687128036,73.33818409418589,Combined,Punjab,2,1,746,479
131,Govt. Boys Primary School Jagga Suntika        (Combined)    *P,29.851061820416582,73.286807845853,Combined,Punjab,2,1,893,748
243,Govt. Model  Primary School 8/G       (Combined)    *P,29.851754448099573,72.954977038607,Combined,Punjab,2,2,1014,758
248,Govt. Boys Primary School- Darbar Mari Showq Shah      (Male)    *P,29.85389758681122,72.90556685000227,Male,Punjab,3,0,1256,0
249,Govt. Boys Primary School- Darbar Mari Showq Shah      (Female)    *P,29.85389758681122,72.9055968500023,Female,Punjab,0,2,0,1002
179,Govt. Girls community Model School Maharwali     (Combined)    *P,29.854824962960716,73.20098697346305,Combined,Punjab,1,1,667,465
180,Govt. Girls community Model School Maharwali     (Combined)    *P,29.854824962960716,73.201016973463,Combined,Punjab,2,1,860,656
239,Govt. Elementray  School Girls 3/G    (Combined)    *P,29.85700633301575,73.01277008919472,Combined,Punjab,2,1,749,608
158,Govt. Boys Model Primary School Moraan wala (New Noor Sar)     (Combined)    *P,29.85842838904914,73.08091810972337,Combined,Punjab,2,2,990,779
178,Govt. Girls High School Mahar Wali Female    (Female)    *P,29.858482270861725,73.19496237391375,Female,Punjab,0,2,0,1117
238,Govt.Primary School Boys 2/G    (Combined)    *P,29.8589449925833,72.98292807468746,Combined,Punjab,1,1,565,442
177,Govt. Boys High School Mahar Wali      (Male)    *P,29.85916636847374,73.19791449017097,Male,Punjab,3,0,1583,0
192,Govt. Girls Primary School Basti Wali Kot(Murad Kharal)     (Combined)    *P,29.862768228144468,73.12495337773585,Combined,Punjab,2,1,883,650
268,Govt. Girls Primary School Mohar Shraif       (Female)    *P,29.86463022449433,72.83463626987587,Female,Punjab,0,2,0,1235
271,Govt. Girls Primary School Mohar Shraif       (Female)    *P,29.86463022449433,72.8346662698759,Female,Punjab,0,4,0,1734
273,Govt. Primary School Boys Mohar Shraif      (Female)    *P,29.865162018786283,72.83877635366716,Female,Punjab,0,2,0,1212
133,Govt Boys High school Dhani Mani Ram        (Combined)    *P,29.865731327841,73.25007870189201,Combined,Punjab,2,1,845,578
134,Basic Health Unit Markaz Center kot Hamraj       (Combined)    *P,29.866516961169438,73.25211405793262,Combined,Punjab,2,2,948,726
267,Govt. High School Boys Mohar Sharif (Primary Block)       (Male)    *P,29.86681138959194,72.8448335808478,Male,Punjab,4,0,1815,0
269,Govt. High School Boys Mohar Shraif  (High Portion)        (Male)    *P,29.866860940239032,72.84486075113817,Male,Punjab,3,0,1293,0
270,Govt. High School Boys Mohar Shraif  (High Portion)        (Male)    *P,29.866860940239032,72.8448907511382,Male,Punjab,2,0,1187,0
272,Falahi Markz Behbood-e-Abadi Mohar Sharif      (Male)    *P,29.86785,72.8375,Male,Punjab,3,0,1656,0
250,Rural health Center Chak Dhudhyan Mari Showq Shah     (Female)    *P,29.872366765356723,72.93588286615183,Female,Punjab,0,2,0,848
251,Rural health Center Chak Dhudhyan Mari Showq Shah     (Male)    *P,29.872366765356723,72.9359128661518,Male,Punjab,2,0,1220,0
237,Govt. Middle  School Boys 1/G (Zaheer Abad)     (Combined)    *P,29.87296507393847,72.98096349996959,Combined,Punjab,2,2,1021,769
183,Govt. Boys Primary School Asad Khan (Bhadan wali)      (Combined)    *P,29.87305965948798,73.1387700674894,Combined,Punjab,2,1,1000,666
181,Govt.  Boys Primary School Mitha Akoka       (Male)    *P,29.87360123021351,73.17034434761324,Male,Punjab,3,0,1314,0
132,Govt. Girls primary school kot sher ?Muhammad      (Combined)    *P,29.874811186100924,73.28129019076289,Combined,Punjab,2,1,779,553
182,Govt. Girls Primary School Mitha Akoka     (Female)    *P,29.875675077818467,73.16487366747829,Female,Punjab,0,2,0,997
284,Govt. Primary School Boys Kumera    (Combined)    *P,29.88097313710396,72.77686433010945,Combined,Punjab,1,1,530,357
175,Govt. Girls Primary School Kanwar Pura   (Jhalaran)       (Combined)    *P,29.882571911847304,73.21343319648564,Combined,Punjab,2,1,813,596
236,Govt.Primary School Boys 1/FW     (Combined)    *P,29.88361420249062,72.99221223355248,Combined,Punjab,1,1,277,199
101,Govt. Boys primary school Malik Pura       (Combined)    *P,29.884756246217318,73.3359414499884,Combined,Punjab,1,1,423,395
102,Govt. Boys primary school Malik Pura       (Combined)    *P,29.884756246217318,73.3359714499884,Combined,Punjab,2,1,726,501
159,Govt. Boys High  School Kat Ganga Singh           (Male)    *P,29.887069681416342,73.10187728911585,Male,Punjab,3,0,1332,0
160,Govt. Boys High  School Kat Ganga Singh           (Female)    *P,29.887069681416342,73.1019072891158,Female,Punjab,0,2,0,1023
135,Govt. Boys Primary School Sukh Rampura          (Combined)    *P,29.887681197217937,73.29490780300739,Combined,Punjab,2,1,840,563
176,Govt. Boys Middle School Orki Abdulla Shah    (Combined)    *P,29.892969224743172,73.19303773764166,Combined,Punjab,2,1,809,581
274,Govt. Primary School boys Shraif Deh    (Combined)    *P,29.893096595161197,72.87261263010326,Combined,Punjab,2,2,925,698
149,Govt. Higher Secondary School Boys Madrassa (Pat-I)       (Combined)    *P,29.896027650497288,73.0368107118434,Combined,Punjab,1,1,419,279
150,Govt. Higher Secondary School Boys Madrassa (Pat-II)      (Combined)    *P,29.896028262403355,73.03681048807954,Combined,Punjab,1,1,619,521
151,Govt. Higher Secondary School Boys Madrassa (Pat-II)      (Combined)    *P,29.896028262403355,73.0368404880795,Combined,Punjab,1,1,607,360
156,Office AEO Madrissa Nanik Chand    (Combined)    *P,29.896165085034124,73.03668110154624,Combined,Punjab,2,2,1131,840
157,Office AEO Madrissa Nanik Chand    (Combined)    *P,29.896165085034124,73.0367111015462,Combined,Punjab,2,1,744,520
152,Govt. Girls High School Madrassa       (Combined)    *P,29.897191036273487,73.03805866931663,Combined,Punjab,2,1,897,612
164,Govt. Boys School Basti Kapooran    (Combined)    *P,29.897309503946488,73.14429706744968,Combined,Punjab,2,1,810,586
136,Govt. Boys high School chak Ghumana(Talia)      (Combined)    *P,29.897456363215404,73.2816065174703,Combined,Punjab,2,2,832,774
277,Govt. Primary School Boys Main Abadi Jheduwan      (Combined)    *P,29.90131884046058,72.8098070180464,Combined,Punjab,2,1,879,608
281,Govt. Primary School Girls Hassam      (Combined)    *P,29.90358046785846,72.85392254875855,Combined,Punjab,2,1,808,502
282,Govt. Primary School Girls Hassam      (Combined)    *P,29.90358046785846,72.8539525487585,Combined,Punjab,1,1,477,324
276,Govt. Primary School Girls Nai Abadi Jheduwan     (Combined)    *P,29.905100526606844,72.80733096760265,Combined,Punjab,2,2,1041,651
99,Govt. Girls Model primary School Girdari Wala Sharki Goro Sar           (Male)    *P,29.90759877343461,73.36754725101994,Male,Punjab,2,0,1168,0
100,Govt. Girls Model primary School Girdari Wala Sharki Goro Sar           (Female)    *P,29.90759877343461,73.3675772510199,Female,Punjab,0,2,0,1000
172,Govt. Community Model Boys Primary School Manohar Garh  (Murkhai)    (Combined)    *P,29.90954729867445,73.17890342482538,Combined,Punjab,1,1,370,259
128,Govt. Boys Primary School Dhab Snateka       (Combined)    *P,29.909587339905013,73.25276752336904,Combined,Punjab,2,2,1014,945
104,Govt. Boys High School Bala Arain      (Combined)    *P,29.91041372108611,73.35369202933227,Combined,Punjab,2,1,834,651
105,Govt. Girls Model High  School Bala Arian        (Combined)    *P,29.91052473176,73.35226067530947,Combined,Punjab,2,2,832,698
264,Govt. Boys Middle School Chopa      (Combined)    *P,29.911252605072303,72.92501075163666,Combined,Punjab,2,1,794,554
265,Govt. Boys Middle School Chopa      (Combined)    *P,29.911252605072303,72.9250407516367,Combined,Punjab,1,1,531,403
266,Govt. Girls Middle School Chopa     (Combined)    *P,29.911637514339397,72.9258024079418,Combined,Punjab,2,2,1108,739
279,Govt. boys Middle School Mehta Jhedu     (Combined)    *P,29.91324933415965,72.85677661857083,Combined,Punjab,1,1,563,351
280,Govt. boys Middle School Mehta Jhedu     (Combined)    *P,29.91324933415965,72.8568066185708,Combined,Punjab,1,1,737,514
259,Govt. Primary School Girls Taloka     (Combined)    *P,29.914257186607383,72.87718541110165,Combined,Punjab,2,2,1016,650
263,Govt. Primary School Girls Fatani     (Combined)    *P,29.914876056055416,72.89665263877627,Combined,Punjab,1,1,634,409
260,Govt. Primary School Boys Fatani     (Combined)    *P,29.91701900551132,72.89404469111912,Combined,Punjab,2,1,774,528
261,Govt. Primary School Boys Fatani     (Combined)    *P,29.91701900551132,72.8940746911191,Combined,Punjab,2,2,980,691
275,Govt. Primary School Boys  Bonga Jhedu Basti Munwar Shah / kaliay shah    (Combined)    *P,29.91739661032097,72.80824465378025,Combined,Punjab,2,2,1119,597
103,Govt. Girls Primary School  Mehmooda Jhudheka    (Combined)    *P,29.918132021072008,73.33214111140194,Combined,Punjab,2,2,1091,852
174,Govt. Boys Primary School Tahliwala Chak Ghulam Muhammad      (Combined)    *P,29.920289838472033,73.18087244704391,Combined,Punjab,1,1,665,496
173,Govt. boys Primary School Kat Lal singh      (Combined)    *P,29.927724357824196,73.16833213870679,Combined,Punjab,1,1,490,332
85,Govt. Boys Primary School Chak Nawas Pura   Basti Jeto    (Combined)    *P,29.929221254061915,73.21351628789725,Combined,Punjab,1,1,630,424
84,Govt. Boys Middle School Bairwala      (Combined)    *P,29.93390529502527,73.2529130315644,Combined,Punjab,2,1,789,613
165,Govt. Girls Middle School Dhani Mohammad Yar Chishti. Hafizabad      (Combined)    *P,29.936948438216664,73.12330003841545,Combined,Punjab,2,1,676,583
166,Govt. Girls Middle School Dhani Mohammad Yar Chishti. Hafizabad      (Combined)    *P,29.936948438216664,73.1233300384154,Combined,Punjab,1,1,524,369
262,Govt. Primary School Boys Basti Ludhera Muza Fatani     (Combined)    *P,29.93833561913713,72.88432766899125,Combined,Punjab,1,1,387,234
87,Govt. Girls Primary School Rehman Tughera       (Combined)    *P,29.94071902510582,73.28198617916105,Combined,Punjab,2,2,1173,838
94,Govt. Boys Middle School Kot Fatteh Muhammad Shah        (Male)    *P,29.94339822617042,73.37514473891747,Male,Punjab,2,0,1262,0
95,Govt. Boys Middle School Kot Fatteh Muhammad Shah        (Male)    *P,29.94339822617042,73.3751747389175,Male,Punjab,2,0,960,0
93,Govt. Girls Primary School  Kot Fateeh Muhammad Shah        (Female)    *P,29.943694265258504,73.37161149999896,Female,Punjab,0,3,0,1593
83,Govt. Girls High School Hafizwala    (Combined)    *P,29.949477809056145,73.23247640447646,Combined,Punjab,2,2,980,747
96,Govt. Girls Middle School Lakhmir Dhduddi    (Combined)    *P,29.95143861605752,73.33796285194916,Combined,Punjab,1,1,693,514
97,Govt. Girls Middle School Lakhmir Dhduddi    (Combined)    *P,29.95143861605752,73.3379928519492,Combined,Punjab,1,1,531,346
