StationId,PollingStation,Lat,Lng,BoothType,Province,MaleBooths,FemaleBooths,MaleVoters,FemaleVoters
256,Govt Girls Primary School Bahadar Wala,30.3074482,71.9349201,Combined,Punjab,2,2,611,527
257,Govt Girls Primary School Bahadar Wala,30.3074482,71.9349501,Combined,Punjab,1,1,477,334
1,Govt Boys High  School Sarai Sidhu,30.3076898,71.9346518,Male,Punjab,3,0,1178,0
2,Govt Boys High  School Sarai Sidhu,30.3076898,71.9346818,Male,Punjab,4,0,1138,0
27,Govt Boys High School  Piple Mirali,30.3076898,71.9347118,Combined,Punjab,2,2,725,527
28,Govt Boys Primary School  Kuksan Abad,30.3076898,71.9347418,Male,Punjab,3,0,973,0
29,Govt Boys Primary School  Kuksan Abad,30.3076898,71.9347718,Female,Punjab,0,2,0,680
31,Govt Girls Model Middle School Grahim Wala at Heveli Mubarak Shah (Ist Portion),30.3076898,71.9348018,Male,Punjab,3,0,1251,0
32,Govt Girls Model Middle School Grahim Wala at Heveli Mubarak Shah (2nd Portion),30.3076898,71.9348318,Female,Punjab,0,2,0,913
33,Govt Girls Primary School Saee Mirali,30.3076898,71.9348618,Combined,Punjab,2,2,695,509
5,Govt Girls Primary School Sarai Sidhu,30.3076898,71.9348918,Male,Punjab,4,0,1194,0
6,Govt Girls Primary School Sarai Sidhu,30.3076898,71.9349218,Male,Punjab,4,0,1438,0
34,Govt Boys Middle School  Bregh Sargana,30.3076898,71.9349518,Combined,Punjab,2,2,881,606
35,Govt Boys Pry School  Manzar Aabad Bagar Sargana,30.3076898,71.9349818,Combined,Punjab,2,2,717,614
36,Govt Girls Middle School  Manzar Abad,30.3076898,71.9350118,Male,Punjab,4,0,1248,0
37,Govt Girls Middle School  Manzar Abad (2nd  Portion),30.3076898,71.9350418,Female,Punjab,0,2,0,900
38,Govt Girls Primary School Qaim Sahu,30.3076898,71.9350718,Combined,Punjab,2,2,810,639
39,Govt Boys Middle School  Kot Gohar Muhammad,30.3076898,71.9351018,Male,Punjab,4,0,1518,0
40,Govt.Girls Middle School-Kot Ghoar Muhammad,30.3076898,71.9351318,Female,Punjab,0,3,0,1182
7,Govt Girls High  School Sarai Sidhu,30.3076898,71.9351618,Female,Punjab,0,3,0,1115
8,Govt Girls High  School Sarai Sidhu,30.3076898,71.9351918,Female,Punjab,0,3,0,992
44,Govt.Boys Pry School .Nand Pur (1st Portion),30.3076898,71.9352218,Male,Punjab,3,0,1107,0
45,Govt.Boys Pry School .Nand Pur (1st Portion),30.3076898,71.9352518,Combined,Punjab,2,1,610,475
46,Govt.Boys Pry.School Nand Pur (2nd Portion),30.3076898,71.9352818,Female,Punjab,0,2,0,794
47,Govt.Girls Primary School Arjani Wala.,30.3076898,71.9353118,Combined,Punjab,1,1,400,349
48,Govt.Girls Primary School Arjani Wala.,30.3076898,71.9353418,Combined,Punjab,2,1,579,489
9,Rural Health Center Sarai Sidhu,30.3076898,71.9353718,Male,Punjab,3,0,1020,0
10,Office of the Town Committee Sarai Sidhu,30.3076898,71.9354018,Female,Punjab,0,2,0,879
77,Govt.Boys High School Baqir Pur (1st Port) .,30.3076898,71.9354318,Male,Punjab,1,0,473,0
78,Govt.Boys High School Baqir Pur (2nd  Port),30.3076898,71.9354618,Female,Punjab,0,1,0,366
11,Govt Boys Primary School  Gharbi,30.3076898,71.9354918,Combined,Punjab,1,1,248,196
82,Govt.Boys Middle School Karam Shah.,30.3076898,71.9355218,Combined,Punjab,2,1,514,352
12,Govt Boys Primary School North Sarai Sidhu,30.3076898,71.9355518,Combined,Punjab,2,1,561,336
13,Govt Boys Primary School  Jhallar Daultana,30.3076898,71.9355818,Combined,Punjab,2,2,726,604
208,Office of the U/C Kot Bahadir,30.3082198,71.937676,Male,Punjab,3,0,1276,0
209,Office of the U/C Kot Bahadir,30.3082198,71.937706,Female,Punjab,0,2,0,885
210,Govt Girls Primary School Kory Wala,30.3082198,71.937736,Male,Punjab,3,0,1345,0
211,Govt Girls Primary School Kory Wala,30.3082198,71.937766,Female,Punjab,0,3,0,1030
212,Govt Boys Primary School Chak No 14/V,30.3082198,71.937796,Combined,Punjab,2,2,1056,766
213,Govt Girls Primary School Chak No 13/V,30.3082198,71.937826,Combined,Punjab,2,2,937,697
158,Govt Boys Middle School  Hassan Pur,30.3082198,71.937856,Combined,Punjab,1,1,377,282
159,Govt Boys Middle School  Hassan Pur,30.3082198,71.937886,Combined,Punjab,2,1,599,484
160,Govt Boys Primary School Ali Pur,30.3082198,71.937916,Combined,Punjab,2,2,787,525
285,Govt Boys Middle School  Darkhawast wala -kohi Wala,30.327200378075773,71.75052376880687,Male,Punjab,2,0,590,0
278,Govt Boys Primary School  Kotla syed Kabir,30.327275211678135,71.71868323327696,Combined,Punjab,2,2,955,685
287,Govt Girls Primary School Chah Tolay Wala -Kohi Wala,30.3293611001263,71.7469767590004,Female,Punjab,0,1,0,422
284,Govt Boys High School Haji Pur,30.340632201153188,71.72841125505067,Combined,Punjab,2,1,684,488
274,Govt Boys Middle School  Korai Balouch (Ist Portion),30.344337796222273,71.69070625141526,Male,Punjab,4,0,1697,0
275,Govt Boys Middle School  Korai Balouch (IInd  Portion),30.344337796222273,71.6907362514153,Female,Punjab,0,3,0,1256
277,Office of Union Council Moonganwala,30.358754664958777,71.70969373222707,Female,Punjab,0,2,0,912
279,Govt Boys Middle School  Inayat Pur (Ist Portion),30.35882631905689,71.7404674258008,Combined,Punjab,2,1,551,400
280,Govt Boys Middle School  Inayat Pur (2nd Portion),30.35882631905689,71.7404974258008,Combined,Punjab,2,2,701,523
276,Govt. Model  Middle School  Moongawala,30.358844016102214,71.70897462423271,Male,Punjab,3,0,1190,0
294,Govt Boys Middle School  Mirali Wala Okanwala,30.359367277316498,71.7835548082898,Combined,Punjab,2,2,943,635
295,Govt Boys Middle School  Mirali Wala Okanwala,30.359367277316498,71.7835848082898,Combined,Punjab,1,1,386,377
217,Govt Girls High  School  Jawaind Singh wala  5 / Kassi (Ist Portion),30.3619181,71.805339,Male,Punjab,2,0,933,0
218,Govt Girls High  School  Jawaind Singh wala 5/ Kassi  (IInd  Portion),30.3619181,71.805369,Female,Punjab,0,2,0,774
206,Govt Girls Middle School 12/Qitta,30.3620594,71.8077709,Combined,Punjab,2,1,614,468
214,Govt Boys High School Chak No 5/Kassi (Ist Portion),30.3638254,71.8019568,Male,Punjab,4,0,1466,0
215,Govt Boys High School Chak No 5/Kassi (Ist Portion),30.3638254,71.8019868,Combined,Punjab,2,2,1038,703
216,Govt Boys High School Chak No 5/Kassi (IInd  Portion),30.3638254,71.8020168,Female,Punjab,0,3,0,1206
283,Govt Girls Primary School Shah Pur Nathuwala,30.364122468270775,71.75388895409051,Combined,Punjab,2,2,591,520
282,Govt. Girls Pry. School Chak Wali Dad,30.370849219433374,71.74374186744782,Combined,Punjab,1,1,358,279
330,Govt Girls Middle School Bolachan,30.37643828292853,71.66246479294536,Combined,Punjab,2,2,776,653
221,Govt Girls Middle  School 3/Kassi (Basti Syedaan ),30.3767725,71.8198101,Combined,Punjab,2,1,589,463
296,Govt Model Primary School  Shah Wala (Okanwala),30.37963410208652,71.72044198229908,Combined,Punjab,2,2,1008,741
297,Govt Boys Primary School  Qureshiwala (Okanwala)(Ist Portion),30.380422787955176,71.76371732552825,Male,Punjab,3,0,1220,0
298,Govt Boys Primary School  Qureshiwala (Okanwala) (IInd  Portion),30.380422787955176,71.7637473255282,Female,Punjab,0,2,0,965
270,Govt Boys Primary School  Basti Diwana wala Sarfraz Pur.,30.381461629343484,71.6941157096638,Combined,Punjab,2,2,685,559
205,Govt Girls High School  Mulapur,30.384397972095844,71.84316478019619,Combined,Punjab,2,1,567,449
201,Govt Boys Middle School  Mula pur (Ist Portion),30.38650434656573,71.83896905512209,Male,Punjab,3,0,1009,0
202,Govt Boys Middle School  Mula pur,30.38650434656573,71.8389990551221,Female,Punjab,0,2,0,904
331,Govt Girls Primary School Sandrana (Basti Bootywala),30.388492179881116,71.68781940662554,Combined,Punjab,2,2,882,658
329,Govt Boys Middle  School  Basti Balochan,30.389951473318916,71.66223001007543,Combined,Punjab,2,1,568,455
234,Govt Boys Primary School  Kabirwala Rural Qitta Baddu Wana,30.390110015546835,71.87658331920909,Combined,Punjab,2,2,905,720
273,Govt Boys Middle School  Ibrahim Pur,30.392055171749835,71.69070131329698,Combined,Punjab,2,2,1061,730
199,Govt. Pry. Masjad Maktab School Gharib abad Mulapur,30.39462534091465,71.84616571249447,Male,Punjab,4,0,1422,0
200,Govt. Pry. Masjad Maktab School Gharib abad Mulapur,30.39462534091465,71.8461957124945,Female,Punjab,0,3,0,1119
246,Govt Boys Primary School  Karam Pur Jutta,30.3957012671627,71.76619982335536,Combined,Punjab,2,2,712,559
203,Govt. Boys Degree Collage Kabirwala Multan Road(1st Port),30.396832945619263,71.85074773328029,Male,Punjab,4,0,1579,0
204,Govt. Boys Degree Collage Kabirwala Multan Road  (IInd-Port),30.396832945619263,71.8507777332803,Female,Punjab,0,3,0,1310
181,T.M.O. Office Kabirwala,30.398856075615,71.85334917119492,Male,Punjab,3,0,1058,0
182,T.M.O. Office Kabirwala,30.398886591231054,71.85336180249296,Female,Punjab,0,2,0,842
179,Govt. Girls Pry. School Dara-ul-Aloom Eid Gah Ist Portation,30.40058036436518,71.8649389085441,Male,Punjab,4,0,1684,0
180,Govt Girls Primary School Dar-ul-Aloom Eid-Gah Kabirwala,30.400582187903947,71.86489963415227,Female,Punjab,0,4,0,1435
173,Govt Boys High  School  Dar-ul - Aloom Kabirwala (Ist Portion),30.400584872280774,71.86378091097302,Male,Punjab,4,0,1737,0
174,Govt Boys High  School  Dar-ul - Aloom Kabirwala (Ist Portion),30.400584872280774,71.863810910973,Male,Punjab,3,0,957,0
175,Govt Boys High School  Dar-ul - Aloom Kabirwala (IInd  Portion),30.400584872280774,71.863840910973,Female,Punjab,0,4,0,1577
176,Govt Boys High School  Dar-ul - Aloom Kabirwala (IInd  Portion),30.400584872280774,71.863870910973,Female,Punjab,0,2,0,842
166,Govt Girls Vocational College Kabirwala,30.400621099213634,71.87133857490447,Female,Punjab,0,2,0,895
241,Govt Girls Higher Secondary School  Kukar Hatta (Ist Portion),30.401139753499596,71.75414490099571,Male,Punjab,4,0,1449,0
242,Govt Girls Higher Secondary School  Kukar Hatta (IInd Portion),30.401139753499596,71.7541749009957,Female,Punjab,0,3,0,1152
219,Govt Boys Primary School  5/Kassi,30.4017466,71.8617654,Combined,Punjab,2,1,546,453
220,Govt Girls Primary School 3/Kassi (Jadeed ),30.4017466,71.8617954,Combined,Punjab,2,2,841,662
288,Govt Boys High School kohi Wala (Ist Portion),30.4017466,71.8618254,Male,Punjab,3,0,1331,0
289,Govt Boys High School Kohi Wala (IInd  Portion),30.4017466,71.8618554,Female,Punjab,0,3,0,1144
290,Govt Girls Higher Secondary School  Kohi Wala (Ist Portion),30.4017466,71.8618854,Male,Punjab,3,0,1108,0
291,Govt Girls Higher Secondary School  Kohi Wala (Ist Portion),30.4017466,71.8619154,Combined,Punjab,2,2,714,605
292,Govt Girls Higher Secondary School  Kohi Wala (2nd Portion),30.4017466,71.8619454,Combined,Punjab,2,1,720,495
293,Govt Girls High School  Kohi Wala (IInd  Portion),30.4017466,71.8619754,Female,Punjab,0,2,0,776
177,Govt Girls Primary School Muhammad Pur Muqeem (Near Pir Darbar Pir Kabir),30.402127990834778,71.8694197059696,Male,Punjab,4,0,1556,0
239,Govt Boys High School Kukkar Hatta (Ist Portion),30.402510281214763,71.75727100999104,Male,Punjab,3,0,1216,0
165,Govt Girls Degree College Kabirwala,30.40251572249968,71.86999381081353,Male,Punjab,3,0,1080,0
240,Govt Boys High School Kukkar Hatta (IInd  Portion),30.402535207208317,71.75729449745958,Female,Punjab,0,2,0,930
248,Govt Girls Primary School Shadian Wala Ameer Pur (Ist Portion),30.4031151251395,71.80263912550285,Male,Punjab,4,0,1625,0
249,Govt Girls Primary School Shadian Wala Ameer Pur (IInd  Portion),30.4031151251395,71.8026691255028,Female,Punjab,0,3,0,1273
271,Govt Boys Primary School  Rasool Pur Kalan,30.40344814368608,71.68801744371146,Combined,Punjab,1,1,393,311
272,Govt Boys Primary School  Rasool Pur Kalan,30.40344814368608,71.6880474437115,Combined,Punjab,2,1,648,487
189,Govt Girls High School  Maan Wala (Ist Portion),30.404157845836174,71.8536149212795,Male,Punjab,3,0,1325,0
190,Govt Girls High School  Maan Wala (Ist Portion),30.404157845836174,71.8536449212795,Male,Punjab,3,0,1140,0
191,Govt Girls High School  Maan Wala (IInd  Portion),30.404157845836174,71.8536749212795,Female,Punjab,0,2,0,600
192,Govt Girls High School  Maan Wala (IInd  Portion),30.404157845836174,71.8537049212795,Female,Punjab,0,3,0,1325
243,BHU Kukar Hatta,30.404346875735776,71.76207856098083,Combined,Punjab,2,2,509,391
244,BHU Kukar Hatta,30.404346875735776,71.7621085609808,Combined,Punjab,2,2,821,680
247,Govt Girls Model Primary School Asim Abad (Ameer Pur),30.40503152619112,71.80747834702258,Combined,Punjab,1,1,224,184
187,Govt Boys High School  Man Wala (Ist Portion),30.406868555064538,71.85332996567121,Male,Punjab,4,0,1733,0
188,Govt Boys High School  Maan Wala (IInd  Portion),30.406868555064538,71.8533599656712,Female,Punjab,0,4,0,1399
185,Govt. Boys High School Maan wala- Kabirwala,30.40689156893847,71.85329053171233,Female,Punjab,0,3,0,1311
186,Govt. Boys High School Maan wala- Kabirwala,30.40689156893847,71.8533205317123,Female,Punjab,0,2,0,851
178,Govt Girls High  School  Kabirwala,30.40700539011906,71.86651778234618,Female,Punjab,0,3,0,1357
184,Govt Girls Middle  School Street No 48- Roshan Wala  Ist Portion Kabirwala,30.407199264539244,71.86016630175757,Male,Punjab,4,0,1480,0
183,Govt Girls Middle  School Street No 48- Roshan Wala  Ist Portion Kabirwala,30.407202798534993,71.86017330245058,Male,Punjab,3,0,1174,0
171,Govt Boys Zargham Shaheed High  School   Mukhdoompur Road Kabirwala,30.408522943311727,71.87096216409289,Male,Punjab,4,0,1688,0
172,Govt Boys Zargham Shaheed High  School   Mukhdoompur Road Kabirwala,30.408522943311727,71.8709921640929,Female,Punjab,0,4,0,1438
167,Govt Boys High School Kabirwala,30.410065434164913,71.8694979865655,Male,Punjab,3,0,1257,0
169,Govt. Boys High School Kabirwala,30.410065434164913,71.8695279865655,Combined,Punjab,2,2,729,629
170,Govt. Boys High School Kabirwala,30.410065434164913,71.8695579865655,Combined,Punjab,2,2,618,544
168,Govt Boys High School Hostal Kabirwala,30.410425615265417,71.86950769067877,Female,Punjab,0,3,0,983
193,Govt Boys Primary School Maan wala (Molvi Wala) (Ist Portion),30.41090105453875,71.83193887566259,Male,Punjab,3,0,1057,0
194,Govt Boys Primary School Maan wala (Molvi Wala) (IIst Portion),30.41090105453875,71.8319688756626,Female,Punjab,0,2,0,852
324,Govt Boys High School Mankot (IInd  Portion),30.411941589979598,71.6403770108398,Combined,Punjab,2,2,953,799
245,Govt Boys Primary School  No.2 Mapal Wala Karam pur,30.415192136294948,71.7760956203241,Combined,Punjab,2,2,755,568
327,Govt Girls Middle School Ihsan Pur,30.415353140759727,71.62314503523183,Combined,Punjab,1,1,407,276
267,Govt Girls Middle School  Ameer Garh,30.416324189947733,71.69275290268907,Combined,Punjab,2,1,565,454
195,Govt Girls Primary School  Mastan Shah Wala Kabirwala,30.418570653107697,71.83776193898332,Combined,Punjab,2,2,670,528
196,Govt Girls Primary School  Mastan Shah Wala Kabirwala,30.418570653107697,71.8377919389833,Combined,Punjab,2,1,568,410
232,Govt Boys Primary School  Qitta Habib Shah wala,30.423006426564577,71.88125792688088,Combined,Punjab,2,2,879,677
197,Govt Girls Model Middle School Gadara- Kabirwala (Ist Portion),30.423810181767177,71.82409831907684,Male,Punjab,3,0,1270,0
198,Govt Girls Model Middle School Gadara- Kabirwala  Basti Haswar Shah (2nd Portion),30.423810181767177,71.8241283190768,Female,Punjab,0,3,0,998
262,Govt Boys High School Chak Hyder Abad (Ist Portion),30.424921790258956,71.72253052849136,Male,Punjab,2,0,795,0
263,Govt Boys High School Chak Hyder Abad (IInd  Portion),30.424921790258956,71.7225605284914,Female,Punjab,0,2,0,636
323,Govt Girls Primary School Saif Pur,30.42531356726107,71.6259717109775,Combined,Punjab,1,1,149,99
320,Govt Boys Primary School  Gagra Kalandar Jahanian,30.427910730830366,71.59373780865442,Combined,Punjab,1,1,383,328
265,Govt Girls Middle School  Nawan Sheher Chak Hyder Abad,30.42796310602864,71.70802934831417,Combined,Punjab,2,2,889,704
266,Govt Girls Middle School  Nawan Sheher Chak Hyder Abad,30.42796310602864,71.7080593483142,Combined,Punjab,1,1,457,352
264,Govt Boys Primary School   Khan Pur Chak Hyder abad,30.42796807281471,71.70326094805017,Combined,Punjab,2,2,1028,859
250,Govt Boys Middle School Narhal,30.428000376689486,71.798474872566,Combined,Punjab,2,2,752,666
268,Govt. Boys Primary School Ahmad Pur (Kotli Syed Baha-ud-Din),30.429458031903984,71.68394090807058,Combined,Punjab,1,1,422,291
321,Govt Model Primary School  Hanjan wahi,30.429950949148456,71.62064203906897,Combined,Punjab,2,2,675,570
322,Govt Model Primary School  Hanjan wahi,30.429950949148456,71.620672039069,Combined,Punjab,2,1,602,480
225,Govt Boys High School Mu barak Pur (Ist  Portion),30.431546948501197,71.93245622601518,Male,Punjab,3,0,1366,0
226,Govt Boys High School Mu barak Pur (IInd  Portion),30.431546948501197,71.9324862260152,Female,Punjab,0,2,0,962
227,Govt Model Primary School  Nabbi Pur,30.433040692002603,71.89590740183252,Combined,Punjab,2,2,680,530
228,Govt Model Primary School Nabbi pur,30.433040692002603,71.8959374018325,Combined,Punjab,2,2,699,577
231,Govt Boys Primary School Tawakal Wala,30.437387228702086,71.8599577755904,Combined,Punjab,2,2,888,596
302,Govt Boys Middle School  salarwahin Kohna (Ist Portion),30.437672445178563,71.6650765544113,Male,Punjab,4,0,1494,0
303,Govt Boys Middle School  salarwahin Kohna (IInd Portion),30.437672445178563,71.6651065544113,Female,Punjab,0,3,0,1022
318,Govt Girls Primary School Mian Pur,30.439033925632636,71.62369248482806,Combined,Punjab,2,2,593,522
252,Govt Boys Middle School  Butta Kot,30.439475422054485,71.82213511450551,Combined,Punjab,2,2,997,856
319,Govt Girls Primary School  Khair Din Hamyana,30.440118717548366,71.56017000812751,Combined,Punjab,1,1,426,400
261,Govt Girls Primary School Kot Wala Ghagar.,30.440398122960296,71.73999074594745,Combined,Punjab,2,2,712,576
304,Govt Girls Middle School Salarwahin Kohna (Ist Portion),30.443131478005096,71.65327062638701,Male,Punjab,3,0,1329,0
305,Govt Girls Middle School Salarwahin Kuhna (IInd  Portion),30.443131478005096,71.653300626387,Female,Punjab,0,3,0,1028
255,Govt. Boys  Primary School-  Basti Sher Garh,30.44337169469407,71.79082452900873,Combined,Punjab,1,1,489,455
259,Govt Boys Middle School  Chatore Garh (Old),30.444300599949145,71.74843504763199,Combined,Punjab,2,1,562,471
269,Govt Boys Primary School  Khan Bahadar Garh,30.449307014813705,71.71813144127816,Combined,Punjab,2,2,948,698
315,Govt Boys Middle School  Shah Dhanayal.,30.452528641315247,71.62847114117231,Combined,Punjab,2,2,721,574
237,Govt Boys Middle School  Mari Sahu (Ist Portion),30.45269821903243,71.87816041114077,Male,Punjab,3,0,1199,0
238,Govt Boys Middle School  Mari Sahu (IInd  Portion),30.45269821903243,71.8781904111408,Female,Punjab,0,3,0,1004
301,Govt Boys Primary School  Basti Sohara at Kotli Bhutta,30.456709360349386,71.83019500766903,Combined,Punjab,2,1,594,466
253,Govt Boys Middle School  Haqnawaz Wala,30.45737718661326,71.80571532518069,Combined,Punjab,2,2,644,571
254,Govt Boys Middle School  Haqnawaz Wala,30.45737718661326,71.8057453251807,Combined,Punjab,2,2,585,492
229,Govt Boys Middle School  Chak Shar Khan (Ist Portion),30.45870964547419,71.84755038767103,Combined,Punjab,1,1,339,257
230,Govt Boys Middle School  Chak Shar Khan (Ist Portion),30.45870964547419,71.847580387671,Combined,Punjab,2,2,821,546
62,Govt.Boys High School -Aujla,30.4607417061659,71.76304021761604,Combined,Punjab,2,2,926,578
316,Govt Boys High School Salarwahin Nao (Ist Portion),30.46213127436842,71.61909604374894,Combined,Punjab,1,1,495,428
317,Govt Boys High School Salarwahin Nao (2nd Portion),30.46213127436842,71.6191260437489,Combined,Punjab,2,2,824,695
258,Govt Model Primary School  Chatore Garh (Jadeed)  Ist Portion,30.46263535798634,71.73392875535195,Combined,Punjab,2,1,532,397
260,Govt Model Primary School  Chatore Garh (Jadeed)  IInd Portion,30.46263535798634,71.7339587553519,Combined,Punjab,2,1,518,412
300,Govt Boys Primary School  Sultanabad,30.467040188120286,71.825029819868,Combined,Punjab,2,2,886,609
307,Govt. Boys Primary School (Basti Ghous Pur) (Ist-Port),30.46791748199586,71.6969435198255,Combined,Punjab,1,1,245,228
308,Govt. Boys Primary School Basti Ghos Pur (Iind-Port),30.46791748199586,71.6969735198255,Combined,Punjab,1,1,454,356
131,Govt Boys Primary School Mast Pur  (New) Jadeed,30.47213403238542,71.91719162220113,Combined,Punjab,2,2,774,639
132,Govt Boys Primary School  Mast Pur  (New) Jadeed,30.47213403238542,71.9172216222011,Combined,Punjab,2,2,719,546
312,Govt Boys Middle School  Thull Najeeb,30.47243984721996,71.6562773997905,Combined,Punjab,2,2,978,703
299,Govt Boys High School Chak Naurang Shah,30.47297397650258,71.84448774722848,Combined,Punjab,2,1,511,487
235,Office of Union Council Mari Sahu,30.475681395121043,71.87612511446528,Combined,Punjab,2,2,632,514
60,Govt.Boys Pry School Chhapranwala.,30.478544984162326,71.77935876671371,Combined,Punjab,1,1,367,349
63,Govt.Boys High School Murad Man .,30.480884291846476,71.80296362810063,Male,Punjab,4,0,1465,0
61,Govt. Girls Pry. School Chhapranwala) Talib Sahu,30.481270114989343,71.77422968674885,Combined,Punjab,2,1,529,397
64,Govt.Girls Pry.School Murad Man,30.481597715105234,71.7948579236999,Female,Punjab,0,3,0,1115
127,Govt Boys Primary School Feroz Wala Rai Pur,30.482583937050784,71.8906858987796,Combined,Punjab,2,2,678,575
306,Govt Model Primary School  Khatti Chor,30.485026082062557,71.7148300691372,Combined,Punjab,2,2,696,517
313,Govt Boys Middle School  Jhok Azam,30.487492457740426,71.63417496200364,Combined,Punjab,2,2,646,506
310,Govt Boys Middle School  Jamal Kay Taragar,30.48895644132095,71.67751720493915,Combined,Punjab,2,2,790,608
314,Govt Boys Primary School   Jamal Kay taragar,30.488987198376275,71.67753186570908,Combined,Punjab,2,2,852,694
164,Govt Boys Primary School  Jutta Kassi,30.49185726873712,71.75251924096412,Combined,Punjab,2,1,633,495
133,Govt Girls Primary School Ary Wala Mast Pur,30.4957235,71.949408,Combined,Punjab,2,2,726,607
134,Govt Boys Higher Secondary School Jodh Pur (Ist Portion),30.4957235,71.949438,Male,Punjab,4,0,1487,0
135,Govt Boys Higher Secondary School Jodh Pur (2nd  Portion),30.4957235,71.949468,Female,Punjab,0,4,0,1169
136,Govt Girls Higher Secondary   School  Jodh Pur (Ist Portion),30.4957235,71.949498,Male,Punjab,3,0,1203,0
137,Govt Girls Higher Secondary   School  Jodh Pur (2nd  Portion),30.4957235,71.949528,Female,Punjab,0,3,0,1067
138,Govt Boys Middle School  Basti Rajput Jodh Pur (Ist Portion),30.4957235,71.949558,Male,Punjab,3,0,1023,0
139,Govt Boys Middle School  Basti Rajput Jodh Pur (Ist Portion),30.4957235,71.949588,Combined,Punjab,2,2,933,722
140,Govt Boys Middle School  Basti Rajput Jodh Pur (2nd  Portion),30.4957235,71.949618,Female,Punjab,0,2,0,816
222,Govt Boys Middle School  Bilawal Pur,30.4957235,71.949648,Male,Punjab,4,0,1727,0
223,Govt Boys Middle School  Bilawal Pur,30.4957235,71.949678,Female,Punjab,0,3,0,1280
236,Govt Boys Middle School  Bastti Lakha Mari Sahu,30.498676036270364,71.86098741753187,Combined,Punjab,2,2,1048,814
129,Govt Boys Primary School  Jamadar Wala Ruken Wala,30.50338424431121,71.9056250879863,Combined,Punjab,2,2,798,664
130,Govt Boys Primary School  Jamadar Wala Ruken Wala,30.50338424431121,71.9056550879863,Combined,Punjab,1,1,345,273
68,Govt.Boys High School Hashmat Mirali.,30.50566432946293,71.82861997737768,Combined,Punjab,2,2,755,562
309,Govt Boys Middle School  Binda Sargana,30.50623314895059,71.6968590594809,Combined,Punjab,2,2,992,645
69,B.H.U. Hashmat Mirali.,30.50905785217987,71.83959082663644,Combined,Punjab,1,1,479,356
128,Govt Boys Primary School  Rukan Wala,30.51114014146235,71.92059856042025,Combined,Punjab,2,1,577,409
67,Govt.Girls Middle School-Hashmat Mirali.,30.51295898588711,71.84125626413649,Combined,Punjab,2,2,1045,830
311,Govt Boys Primary School  Khokhra Mohabat taragar,30.515014588841105,71.6702517906715,Combined,Punjab,2,2,681,497
73,Govt.Girls High School Mohri Pur.,30.516749312935048,71.88158306052931,Combined,Punjab,2,2,1017,636
70,Govt.Boys High School Mohri Pur (P-I).,30.518094340886744,71.88586961316469,Combined,Punjab,1,1,308,149
142,Govt Model Middle School Chak Sultan Mehmood (2nd  Portion),30.5180957,71.9665957,Combined,Punjab,2,1,540,447
71,Govt.Boys High School Mohri Pur (Primary Portion).(P-II),30.518138779478612,71.88585913265048,Combined,Punjab,2,1,594,342
72,Govt.Boys High School Mohri Pur (Middle Portion).(P-III),30.518138779478612,71.8858891326505,Combined,Punjab,2,2,1033,756
162,Govt Girls Middle School  Mumdal,30.52094842464748,71.72350868044671,Combined,Punjab,2,1,622,466
163,Govt Girls Middle School  Mumdal,30.52094842464748,71.7235386804467,Combined,Punjab,2,1,760,530
65,Govt. Model  Pry. School Tangra (1st Port.),30.522704330789285,71.80261550923625,Male,Punjab,3,0,1108,0
66,Govt. Model  Pry. School Tangra (2nd Port) .,30.522704330789285,71.8026455092362,Female,Punjab,0,2,0,822
56,Govt.Boys Pry.school Kassi Jhendeer.,30.52366322868063,71.76410998427177,Combined,Punjab,2,2,762,659
161,Govt Boys High School Mumdal,30.52414430481948,71.7281430638988,Combined,Punjab,2,1,747,472
42,Govt. Model Primary School-Choper Hatta..,30.528375206168814,71.95519485455637,Male,Punjab,4,0,1463,0
75,Govt.Boys pry.School Ahmad Wala at Farid pur (1st Port).,30.529139805651358,71.87309578354291,Combined,Punjab,2,1,639,407
76,Govt .Boys pry.School Ahmad Wala at Farid Pur (2nd Port).,30.529162510108627,71.87308378896704,Combined,Punjab,2,1,658,445
74,Govt.Boys High School Farid Pur.,30.54004987833744,71.84136913480927,Combined,Punjab,1,1,486,350
141,Govt Boys Primary School  Chak Sultan Mehmood (Ist Portion),30.5404678,71.9837834,Combined,Punjab,1,1,462,369
143,Govt Boys Middle  School  Bahawal Pur (Ist Portion),30.5404678,71.9838134,Male,Punjab,4,0,1624,0
144,Govt Boys Middle  School  Bahawal Pur (2nd  Portion),30.5404678,71.9838434,Female,Punjab,0,3,0,1301
43,Govt.Girls Pry.School Basti Chopar Hatta (GARBI),30.5404678,71.9838734,Female,Punjab,0,3,0,1146
41,Govt.Higher Secondary School Jassokanwen.,30.541369722315288,71.91827973290218,Combined,Punjab,2,2,856,689
83,Govt.Boys  Primary School- Dandi Sargana,30.54448328518543,71.78730979926114,Male,Punjab,4,0,1435,0
84,B.H.U.Dandi Sargana .,30.54471956626118,71.80664415437106,Female,Punjab,0,3,0,1094
59,Govt.Boys Pry.School Chiragh Bella.(Toe Wala).,30.545225832266343,71.75143154717283,Combined,Punjab,1,1,270,157
