StationId,PollingStation,Lat,Lng,BoothType,Province,MaleBooths,FemaleBooths,MaleVoters,FemaleVoters
133,CANAL REST HOUSE KHAN GARH (Combined),30.0641827,71.1907805,Combined,Punjab,1,1,568,431
149,Government BOYS PRIMARY SCHOOL GAIRAY WAHIN (IMPROVISED) (Combined),30.0641827,71.1908105,Combined,Punjab,1,1,436,329
150,Government BOYS PRIMARY SCHOOL GAIRAY WAHIN (IMPROVISED) (Combined),30.0641827,71.1908405,Combined,Punjab,1,1,366,289
151,Government BOYS PRIMARY SCHOOL GAIRAY WAHIN (Male),30.0641827,71.1908705,Male,Punjab,2,0,1158,0
156,Government BOYS PRIMARY SCHOOL KAMAL PUR (Combined),30.0641827,71.1909005,Combined,Punjab,1,1,453,332
158,Government BOYS PRIMARY SCHOOL KAMAL PUR (Combined),30.0641827,71.1909305,Combined,Punjab,1,1,759,569
159,Government BOYS PRIMARY SCHOOL BASTI MAQSOOD PURA (Combine),30.0641827,71.1909605,Combined,Punjab,1,1,711,568
165,Government BOYS PRIMARY SCHOOL SADAY WAHIN (Combined),30.0641827,71.1909905,Combined,Punjab,1,1,697,546
105,Government BOYS PRIMARY SCHOOL CHEMRU WALI (Combined),30.0641827,71.1910205,Combined,Punjab,1,1,461,381
154,Government BOYS MIDDLE SCHOOL BASTI MODH (Combined),30.0643994,71.1829123,Combined,Punjab,1,1,329,277
155,Government BOYS MIDDLE SCHOOL BASTI MODH (Combined),30.0643994,71.1829423,Combined,Punjab,1,1,791,654
185,Government BOYS ELEMENTARY SCHOOL WASENDY WALI (Combined),30.0643994,71.1829723,Combined,Punjab,1,1,924,700
182,Government BOYS PRIMARY SCHOOL Bilal Wala (Combined),30.0643994,71.1830023,Combined,Punjab,1,1,985,776
271,Government  Boys Primary School- Basti Jalal (Combined),30.0662658,71.1884818,Combined,Punjab,1,1,982,866
170,Government GIRLS ELEMENTARY SCHOOL RAQBA NOOR KHAN (Combined),30.071406,71.1820287,Combined,Punjab,1,1,724,579
188,Government BOYS PRIMARY SCHOOL JAAL WALA (Combined),30.071406,71.1820587,Combined,Punjab,1,1,937,714
58,Government BOYS PRIMARY SCHOOL RAQBA SARKAR (Male),30.071406,71.1820887,Male,Punjab,2,0,1104,0
59,Government BOYS PRIMARY SCHOOL RAQBA SARKAR (Female),30.071406,71.1821187,Female,Punjab,0,2,0,823
160,Government BOYS PRIMARY SCHOOL ALI WAH (Combined),30.0734506,71.1950325,Combined,Punjab,1,1,840,725
178,Government BOYS PRIMARY SCHOOL CHAN WALI (Combined),30.0734506,71.1950625,Combined,Punjab,1,1,540,415
180,Government BOYS PRIMARY SCHOOL PATI DARIG (Combined),30.0734506,71.1950925,Combined,Punjab,1,1,970,697
75,Government BOYS PRIMARY SCHOOL CHANAR JADEED (IMPROVISED) (Combined),30.0734506,71.1951225,Combined,Punjab,1,1,370,326
