StationId,PollingStation,Lat,Lng,BoothType,Province,MaleBooths,FemaleBooths,MaleVoters,FemaleVoters
240,Government Boys Primary School Allah Ditto Babar-   (Male),25.59741290944716,68.85181661159366,Male,Sindh,3,0,1332,0
241,Government Boys Primary School Allah Ditto Babar-  (Female),25.597416905797285,68.85182829865691,Female,Sindh,0,3,0,1086
44,Government High School Ali Sher Muhajir-     (Combined),25.60193985323,68.72321097652524,Combined,Sindh,2,2,799,535
45,Government Boys Primary School Sajan Solangi-    (Combined),25.609899941775076,68.709041688053,Combined,Sindh,2,2,488,447
33,Government Boys Primary School Umer Saand    (Combined),25.614648231568204,68.70012840725907,Combined,Sindh,2,2,1162,946
35,Government Boys Primary School Loung Baladi-  (Combined),25.614744799808868,68.67085374460746,Combined,Sindh,2,2,513,449
41,Government Boys Primary School Mal Khan Thebo-    (Male),25.628651978521766,68.7155695548629,Male,Sindh,2,0,921,0
42,Government Boys Primary School Mal Khan Thebo-    (Female),25.628651978521766,68.7155995548629,Female,Sindh,0,2,0,825
30,Government Boys Primary School Piyar Ali Khaskheli     (Combined),25.629618943651316,68.8910743191793,Combined,Sindh,2,2,537,501
19,Government Boys Middle School Kot Mir Ghulam Muhammad Talpur    (Combined),25.635695552389386,68.81053427554609,Combined,Sindh,2,2,629,651
34,Government Boys Primary School Murad  Baloch-        (Combined),25.637023853203036,68.67527750112141,Combined,Sindh,2,2,635,485
31,Government  Boys Primary School Gul Muhammad  Pali   (Combined),25.640877079317317,68.70685058380637,Combined,Sindh,2,2,580,503
6,Government High School Jhando Mari-  (Male),25.64443780639378,68.90943543160466,Male,Sindh,4,0,1142,0
7,Government Boys Primary School Jhando Mari-  (Female),25.64464790603741,68.90926292295799,Female,Sindh,0,4,0,977
17,Government Boys Primary School Old Mirabad-   (Male),25.649471783894455,68.7883275875276,Male,Sindh,4,0,1594,0
18,Government Middle School Old Mirabad    (Female),25.649850762755353,68.78840034172333,Female,Sindh,0,4,0,1373
20,Government Boys Primary School Dost Muhammad Dars    (Combined),25.65081074566572,68.80995332320143,Combined,Sindh,2,2,780,625
36,Government Boys Primary School Mitho Mirjat-  (Male),25.651263063448372,68.6983715802997,Male,Sindh,2,0,844,0
32,Government Boys Primary School Ghulam Nabi Shah        (Combined),25.662567528576897,68.75588272742439,Combined,Sindh,2,2,492,392
8,Government Boys Primary School Zardari Farm-   (Combined),25.672576724340505,68.8443731248359,Combined,Sindh,2,2,364,286
9,Government Boys Primary School Saleh Khaskheli-   (Combined),25.676114658157186,68.80446096068134,Combined,Sindh,2,2,832,668
15,Government Boys Primary School Pir Jurial  Shah ji Mari   (Male),25.681977067073063,68.74443955368453,Male,Sindh,4,0,1021,0
16,Government Girls Primary School Pir Jurial  Shah ji Mari-  (Old Building)  (Female),25.68416846411856,68.743158894903,Female,Sindh,0,4,0,1020
11,Government Girls Lower Secondary School Mashaikh Hoti   (Female),25.684455428825693,68.7749270741824,Female,Sindh,0,4,0,1411
10,Government Boys Primary School Mashaekh Hoti-        (Male),25.68445822115119,68.77286607916783,Male,Sindh,4,0,1489,0
5,Government Boys Primary School Bilawal Mari-   (Combined),25.685907660427233,68.88079466795311,Combined,Sindh,2,2,384,303
38,Government Boys Primary School Bachal Shah-  (Combined),25.68877665291241,68.68995136191633,Combined,Sindh,2,2,767,584
2,Government Boys Primary School Morio Sand-    (Male),25.689711326880015,68.7542971300242,Male,Sindh,4,0,986,0
3,Government Boys Primary School Morio Sand-     (Female),25.689711326880015,68.7543271300242,Female,Sindh,0,2,0,993
12,Government Middle School Syed Abdul Ghafoor Shah   (Combined),25.70790265667324,68.73707389077958,Combined,Sindh,2,2,596,506
14,Government Boys Primary School Panah Shah   (Female),25.709757871560978,68.70347553234352,Female,Sindh,0,4,0,1223
13,Government Middle School Syed Panah Shah (Male),25.712018684534005,68.70436622861357,Male,Sindh,4,0,1352,0
1,Government Boys Primary School Lal Khan Lashari-    (Combined),25.717924334430496,68.77452949413723,Combined,Sindh,2,2,791,615
4,Government Middle School Jurio Magsi-   (Combined),25.72881741111454,68.79264381615415,Combined,Sindh,2,2,462,341
