StationId,PollingStation,Lat,Lng,BoothType,Province,MaleBooths,FemaleBooths,MaleVoters,FemaleVoters
204,Gazala Sec. School 14-BI-  UC-8- Sector 14/C- Bilal Colony-  Orangi Town. (Ist Floor) (M),24.8512,67.00012,Male,Sindh,3,0,1482,0
205,Gazala Sec. School 14-BI-  Sector 14/C- Bilal Colony-  UC-8- Orangi Town. (Ground Floor). (F),24.8512,67.00015,Combined,Sindh,1,2,277,1146
235,Shahbaz Model Academy,24.87142,67.02253,Female,Sindh,0,2,0,1051
20,GBPS New Happay Garden at Bismillah Colony,24.92733,66.99164,Combined,Sindh,1,2,570,1115
21,GBPS New Happy Garden at Bismillah Colony,24.92733,66.99167,Male,Sindh,3,0,1535,0
7,Ever Green Loyer Sec. School,24.92796,66.99784,Combined,Sindh,2,1,853,539
31,Al-Habib Public School,24.92845,66.97923,Combined,Sindh,1,1,809,418
33,Al-Habib Public School Shah Moh,24.92845,66.97926,Combined,Sindh,1,2,364,997
30,Hasnain Public School,24.93047,66.98232,Combined,Sindh,2,1,745,383
32,Hasnain Public School,24.93047,66.98235,Male,Sindh,3,0,1490,0
22,Iqra Islamic Foundation l,24.93075,66.98636,Female,Sindh,0,2,0,1053
26,Zafar Public Sec-10,24.93097,66.98558,Combined,Sindh,1,2,361,1107
10,GBPS Bismillah Colony,24.93165,66.98795,Male,Sindh,3,0,1554,0
11,GBPS Bismillah Colony,24.93165,66.98798,Combined,Sindh,1,2,392,597
1,EAB GGSS Sec10,24.9317,66.98817,Male,Sindh,3,0,1609,0
3,EAB GGSS. sec-10,24.9317,66.9882,Male,Sindh,4,0,1768,0
5,Talant World Public School,24.93178,66.98924,Combined,Sindh,3,1,1330,481
6,Talant World Public School,24.93178,66.98927,Combined,Sindh,1,2,827,786
8,Aisha Public School,24.9335,66.98737,Combined,Sindh,3,1,1323,258
9,Aisha Public School,24.9335,66.9874,Female,Sindh,0,2,0,1139
37,Mehran Public School,24.93502,66.99423,Combined,Sindh,1,3,213,1374
36,GBPS. Hanifia Boys Harya Colony,24.93515,66.98634,Male,Sindh,4,0,1742,0
15,GBPS Hanifia Haryana Colony,24.93525,66.98642,Combined,Sindh,2,2,1155,802
4,GBPS. Aqsa Al-Fateh,24.93532,66.99149,Female,Sindh,0,4,0,1460
16,GBPS Yaqoobabad at Haryana Colony,24.93533,66.98529,Combined,Sindh,2,2,1046,667
17,GBPS Ideal Sec School,24.93533,66.98532,Combined,Sindh,3,1,1456,337
18,GBPS Ideal Sec School,24.93533,66.98535,Combined,Sindh,1,2,738,1032
28,GBPS. Yaqoobabad Sec-10,24.93533,66.98538,Male,Sindh,3,0,1709,0
19,Good luck Sec School,24.93554,66.9865,Combined,Sindh,3,1,1519,271
12,Natianal Public School,24.93636,66.98758,Male,Sindh,3,0,1671,0
14,GBPS Banaras No.2,24.93641,66.98802,Female,Sindh,0,4,0,1487
13,National Public School,24.93659,66.98763,Combined,Sindh,2,1,1187,483
35,Superior Model Sec School,24.93692,66.99043,Combined,Sindh,1,3,326,1417
57,The Minhaj School d,24.93764,66.98499,Combined,Sindh,2,1,677,477
58,The Minhaj School d,24.93764,66.98502,Combined,Sindh,1,1,464,302
59,Muslim Millat School,24.9378,66.98384,Combined,Sindh,2,1,779,526
60,Muslim Millat School,24.9378,66.98387,Combined,Sindh,2,2,942,474
61,Muslim Millat School,24.9378,66.9839,Combined,Sindh,2,2,1321,705
85,Shaheen School Fareed Colony,24.93798,66.97977,Combined,Sindh,2,1,1110,646
34,Bright Way Grammar School,24.93831,66.98937,Male,Sindh,4,0,1723,0
95,The weliken High School,24.93881,66.98366,Male,Sindh,2,0,1240,0
96,The Weliken High School,24.93881,66.98369,Female,Sindh,0,2,0,822
53,Islamia Children School,24.93954,66.99082,Female,Sindh,0,4,0,1669
43,Al-Faisal Sec School,24.93957,66.99247,Female,Sindh,0,4,0,1627
56,Al-Raza Grammar School,24.93966,66.98731,Combined,Sindh,2,1,856,593
260,Mahmood Public School-  UC-10- Orangi Town.(M),24.9403,67.00094,Combined,Sindh,2,1,1200,257
52,Georage Ludwig Rxroth Cambridge School,24.94054,66.98891,Combined,Sindh,2,1,1539,187
259,Pak. Sec. School- Plot NO:- 96 & 97-  Sector 9-D- UC-10- Orangi Town.(M),24.94055,67.00059,Male,Sindh,3,0,1572,0
262,Pak. Sec. School- Plot No:- 96 & 97-  Sector 9-D- UC-10- Orangi Town.(M),24.94055,67.00062,Male,Sindh,3,0,1517,0
274,KMC School OT-15- Sector 9-E-  UC-11- Orangi Town  (Left Side of the Billding) (M),24.94065,67.00159,Male,Sindh,3,0,1428,0
275,KMC School OT-15- Sector 9-E-  UC-11- Orangi Town.  (Left Side of the Billding) (F),24.94065,67.00162,Combined,Sindh,1,2,233,1146
282,KMC School 8-L- Opposite Mono Technical- UC-11-  Orangi Town. (M),24.94065,67.00165,Combined,Sindh,2,1,1008,318
283,KMC School 8-L-  Opposite Mono Technical-  UC-11- Orangi Town. (M),24.94065,67.00168,Male,Sindh,3,0,1268,0
284,KMC School 8-L-  Opposite Mono Technical-  UC-11- Orangi Town. (F),24.94065,67.00171,Female,Sindh,0,3,0,1256
267,Shafugta Memorial School- Sector 12-L- Opposite Town Office- UC-10- Orangi Town. (Ground Floor) (F),24.94096,66.99957,Female,Sindh,0,2,0,1122
54,Reliant Grammar School,24.94175,66.98964,Combined,Sindh,2,1,1406,192
55,Al Mehran Sec School,24.94176,66.98901,Combined,Sindh,2,1,790,549
263,Orangi Children Academy- Sector 12/L-  UC-10- Orangi Town.(F),24.9423,66.99842,Female,Sindh,0,3,0,1046
264,Orangi Children Academy-  Sector 12/L- UC-10- Orangi Town.(F),24.9423,66.99845,Female,Sindh,0,2,0,1018
73,Dala Salle School,24.94292,66.9931,Combined,Sindh,1,3,290,1271
82,Dela-salle Grammar Foundation  School,24.94292,66.99313,Female,Sindh,0,3,0,1240
253,Anees Public Secandary School-  Sector 12-L- UC-10-  Orangi Town- (F),24.94453,66.99747,Combined,Sindh,1,2,239,1105
72,Allah Wala Rafiq School,24.94472,66.99157,Male,Sindh,4,0,1580,0
254,GGLSS Khadda- Sector 9-E-  UC-10- Orangi Town.(C),24.94477,67.00509,Combined,Sindh,2,1,876,607
277,GBPS No.3 Sector 9/E-  UC-11- Orangi Town. (F),24.94477,67.00512,Combined,Sindh,1,2,615,775
279,Govt. Model Urdu Boys Primary School- Sector 8-L-  UC-11- Orangi Town-  (GBPS Iqra 8-L) (F),24.94477,67.00515,Combined,Sindh,2,2,938,512
280,Govt. Boys Secondary School No.9-  Sector 8-L- UC-11-  Orangi Town-  (GBPS Iqra 8-L) (M),24.94477,67.00518,Male,Sindh,3,0,1596,0
77,GBSS Anjum-e-Muhammadi,24.94536,66.98495,Combined,Sindh,1,2,277,1215
86,GBPS.Anjuman-e-Muhammadi,24.94536,66.98498,Combined,Sindh,2,1,922,456
87,GBPS.Anjuman-e-Muhammadi,24.94536,66.98501,Combined,Sindh,2,1,766,378
88,GBPS.Anjuman-e-Muhammadi,24.94536,66.98504,Male,Sindh,3,0,1505,0
76,Khudkar no 2 Irani Camp,24.94536,66.985,Male,Sindh,2,0,1511,0
89,GBPS. Khudkar School,24.94536,66.98503,Combined,Sindh,1,2,212,1217
90,GBPS. Khukar School,24.94536,66.98506,Male,Sindh,4,0,1715,0
91,GBPS. Khudkar Scholl,24.94536,66.98509,Female,Sindh,0,3,0,1291
249,Unique Universe Multimedia School-  12-L- Orangi Sector.,24.94604,66.9984,Combined,Sindh,1,2,769,784
192,Govt. Girls College- Sec.15-C-  UC-8- Orangi Town (M),24.94679,66.99855,Male,Sindh,2,0,1035,0
193,Govt. Girls College- Sec.15-C-  UC-8- Orangi Town (M),24.94679,66.99858,Male,Sindh,2,0,1009,0
194,Govt. Girls College- Sector 15-C-  UC-8- Orangi Town (F),24.94679,66.99861,Female,Sindh,0,3,0,1517
195,Govt. Girls College- Sector 15-C-  UC-8- Orangi Town. (M),24.94679,66.99864,Male,Sindh,3,0,1540,0
248,Goverment Girls Collage- Sector 15/C-  Near Brohi Hotel-  UC-10- Orangi Town-(F),24.94679,66.99867,Combined,Sindh,2,2,968,763
237,Faiz Public School Ghousia Balouch Colony,24.94774,66.99383,Female,Sindh,0,2,0,927
121,The Embelish Academy,24.94792,66.98891,Combined,Sindh,1,3,321,1178
278,Govt. Boys Secondary School No.9-  Sector 8-L- UC-11- Orangi Town-  (GBPS Iqra 8-L) (M),24.94792,67.00605,Combined,Sindh,2,1,841,645
281,Govt. Girls Secondary School-  Mujahid Colony- Sector 8-L- UC-11-  Orangi Town- (GBPS Iqra 8-L) (F),24.94792,67.00608,Female,Sindh,0,3,0,1356
115,The Little Paradise Academy School,24.94803,66.98575,Combined,Sindh,2,1,1048,394
162,Little Heaven Secondary School- Lal Shahbaz Nagar,24.94803,66.98578,Female,Sindh,0,2,0,1172
165,Little Heaven Secondary School- Lal Shahbaz Nagar,24.94803,66.98581,Female,Sindh,0,2,0,1131
255,Uressia Public School- Plot No. 10 & 11-  Sector 13/F- UC-10- Orangi Town.  (Ist Floor).(M),24.94805,67.00556,Male,Sindh,3,0,1540,0
256,Uressia Public School- Plot No. 10 & 11 Sector 13/F-  UC-10-  Orangi Town.(Ground Floor) (F),24.94805,67.00559,Combined,Sindh,1,3,215,1355
120,KMC School Millat Colony,24.94846,66.98647,Male,Sindh,2,0,1419,0
119,PNG Grammar School,24.94847,66.99088,Female,Sindh,0,4,0,1698
92,Little Angel School,24.94858,66.98072,Male,Sindh,2,0,1164,0
93,Little Angel School,24.94858,66.98075,Female,Sindh,0,4,0,1745
127,GBPS Mujahidabad-2,24.94889,66.97806,Combined,Sindh,2,2,1147,839
257,GBSS 13-G- Gabol Colony-  Sector 13-G- UC-10-  Orangi Town.  (Right side of the hall) (M),24.9496,67.0057,Male,Sindh,3,0,1492,0
258,GBSS 13-G- Gabol Colony-  Sector 13-G- UC-10-  Orangi Town. (In the hall) (F),24.9496,67.00573,Female,Sindh,0,3,0,1007
270,GBSS 13-G- Gabol Colony-  Sector 13-G- UC-10- Orangi Town.  (Main building ground floor) (M),24.9496,67.00576,Combined,Sindh,2,1,784,564
271,GBSS 13-G- Gabol Colony-  Sector 13-G- UC-10-  Orangi Town. (At first floor) (F),24.9496,67.00579,Combined,Sindh,2,1,741,483
273,GBSS 13-G- Gabool Colony-  UC-10- Orangi Town.(F),24.9496,67.00582,Combined,Sindh,1,2,289,1099
272,GGPS Muhammadi 13-H-  UC-10- Orangi Town.(M),24.94968,67.00563,Male,Sindh,3,0,1265,0
116,Shaheen Children Academy,24.95004,66.98699,Combined,Sindh,1,2,663,812
94,Native School L Block,24.951,66.98139,Male,Sindh,2,0,1273,0
250,Al Hamd Grammar School-  Sector 13/F- UC-10-  Orangi Town.(M),24.95102,67.00023,Combined,Sindh,2,1,905,601
251,Al Hamd Grammar School-  Sector 13/F- UC-10-  Orangi Town.(F),24.95102,67.00026,Combined,Sindh,2,2,880,589
118,The World Grammar School,24.95131,66.98864,Male,Sindh,3,0,1322,0
117,The World Grammar School,24.95139,66.98861,Male,Sindh,2,0,1209,0
125,KMC school Touheed,24.95167,66.97694,Male,Sindh,4,0,1700,0
126,KMC school Touheed,24.95167,66.97697,Female,Sindh,0,3,0,1204
113,Hafiz ur Rehman School Main Pakistan Bazar- Orangi Town- Sector 11 1/2,24.95169,66.98707,Combined,Sindh,2,1,976,499
206,Paramount Grammar School-  Sector 14/C- UC-8-  Orangi Town. (M),24.95185,66.99969,Male,Sindh,4,0,1625,0
196,Aziz e Millat School- Sector 15/A-  UC-8- Orangi Town. (Left Side) (F),24.95201,67.00061,Female,Sindh,0,3,0,1175
197,Aziz e Millat School- Sector 15/A-  UC-8- Orangi Town. (Left Side) (F),24.95201,67.00064,Combined,Sindh,1,2,226,1153
198,Aziz e Millat School 15-C- Sector 15/A-  UC-8- Orangi Town. (M),24.95201,67.00067,Male,Sindh,4,0,1653,0
199,Aziz e Millat 15-C- Sector 15/A-  UC-8- Orangi Town. (M),24.95201,67.0007,Male,Sindh,3,0,1435,0
203,GBPS Muhammadi 14-BI-  UC-8- Orangi Town. (C),24.95217,67,Combined,Sindh,2,2,1306,820
112,GBPS Dew Drops Imam Colony,24.95222,66.98583,Female,Sindh,0,2,0,906
114,GBPS Dew Drops Imam Colony,24.95222,66.98586,Combined,Sindh,1,2,685,764
276,GBPS Khursheed Islam-  Sector 9/E- UC-11-  Orangi Town.(M),24.95222,66.98589,Combined,Sindh,2,1,1014,350
238,Nizam Public Memorial School,24.95247,66.99573,Combined,Sindh,2,1,1353,350
239,Nizam Public Memorial School,24.95247,66.99576,Combined,Sindh,1,2,536,959
110,Scholar Sec School,24.9528,66.98492,Combined,Sindh,2,2,1066,629
75,Scholar Grammar School,24.9528,66.98495,Female,Sindh,0,2,0,954
79,Scholar Grammar School,24.9528,66.98498,Female,Sindh,0,2,0,831
234,Shaheedain Watan School,24.95329,66.992,Male,Sindh,2,0,1387,0
201,Faran High School- Sector 14/B-  UC-8- Orangi Town. (M),24.95333,66.99828,Male,Sindh,3,0,1256,0
202,Faran High School- Sector 14/B-  UC-8- Orangi Town. (F),24.95333,66.99831,Combined,Sindh,1,2,325,1140
200,Darkhshan Grammar School-  UC-8- Orangi Town. (F),24.95362,66.99818,Female,Sindh,0,2,0,1220
240,Adyturm Grammar School,24.95382,66.99445,Male,Sindh,3,0,1689,0
241,Adyturm Grammar School,24.95382,66.99448,Combined,Sindh,1,3,308,1417
230,Jinnah High School- Plot No:- 735- 736- Junaid Nagar- Opposite Sindh Lab- Pakistan Bazar- UC-9- Orangi Town.(M),24.95397,66.98827,Combined,Sindh,1,2,746,852
231,Jinnah High School- Plot No:- 735- 736- Junaid Nagar- Opposite Sindh Lab- Pakistan Bazar- UC-9- Orangi Town.(M),24.95397,66.9883,Male,Sindh,3,0,1335,0
108,Rehman Children School,24.954,66.98648,Female,Sindh,0,4,0,1453
242,The Ideal Montessori School,24.95401,66.99229,Combined,Sindh,2,2,985,697
243,The Ideal Montessori School,24.95401,66.99232,Combined,Sindh,2,2,1087,803
107,Rehman Children School,24.95417,66.98638,Male,Sindh,4,0,1649,0
232,Rahman Children School- Gali No:- 1- Mukhdum Shah Colony- Sector 11 1/2- Pakistan Bazar- UC-9- Orangi Town.(M),24.95419,66.98698,Female,Sindh,0,2,0,815
233,Rahman Children School- Gali No:- 1- Mukhdum Shah Colony- Sector 11 1/2- Pakistan Bazar- UC-9- Orangi Town.(M),24.95419,66.98701,Male,Sindh,2,0,1193,0
244,Apex Grammar Secondary School-  Thorani Goth- (M),24.95427,66.99255,Combined,Sindh,2,2,821,880
245,Apex Grammar Secondary School-  Thorani Goth- (M),24.95427,66.99258,Combined,Sindh,2,1,1080,507
228,Best Way Grammar School- Warsia Colony- Sector 11 1/2- UC-9- Orangi Town. (M),24.95443,66.99033,Male,Sindh,2,0,1308,0
101,GBPS.Qasim Ul Uloom,24.95506,66.97113,Combined,Sindh,2,1,909,579
102,GBPS.Qasim Ul Uloom,24.95506,66.97116,Combined,Sindh,2,1,1106,429
104,GBPS Qasim Ul Uloom,24.95506,66.97119,Combined,Sindh,2,1,1114,287
252,Governrment Urdu Boys Primary School- Sector 13- at 12-L- UC-10- Orangi Town.  (Old Name Al Falah Pry School)-(M),24.95506,66.97122,Male,Sindh,3,0,1386,0
214,KMC School Disco Mor- 14-G - UC-8- Orangi Town. (M),24.95528,66.99555,Male,Sindh,4,0,1760,0
215,KMC School Disco Mor- 14-G- UC-8- Orangi Town. (F),24.95528,66.99558,Female,Sindh,0,4,0,1455
229,e-City Grammar School- Warsia Colony Near Old Police Station Pakistan Bazar- Sector 11 1/2- Opposite Abdullah Bin Masood Masjid- UC-9- Orangi Town.(F),24.95558,66.99203,Female,Sindh,0,4,0,1711
128,Shaheen grammer Academy,24.95722,66.97833,Male,Sindh,3,0,1661,0
129,Shaheen Grammar Academy,24.95754,66.9782,Female,Sindh,0,3,0,1164
130,Jinnah Public School,24.95754,66.97823,Male,Sindh,3,0,1592,0
105,Govt Degree College Baba Willayat Ali Shah d,24.95757,66.97964,Combined,Sindh,2,1,678,431
106,Govt Degree College Baba Wilayat Ali Shah d,24.95757,66.97967,Combined,Sindh,2,1,882,393
62,Govt Girls Degree College 11 E,24.95757,66.9797,Male,Sindh,3,0,1392,0
63,Govt Girls Degree College 11 E,24.95757,66.97973,Female,Sindh,0,2,0,1148
156,Allied  School  Abu Zar Ghaffari Colony- UC-7- Orangi Town,24.95778,66.98306,Male,Sindh,3,0,1339,0
157,Allied  School  Abu Zar Ghaffari Colony- UC-7- Orangi Town,24.95778,66.98309,Combined,Sindh,1,2,225,1166
158,Allied  School  Abu Zar Ghaffari Colony- UC-7- Orangi Town,24.95778,66.98312,Male,Sindh,3,0,1391,0
159,Allied  School  Abu Zar Ghaffari Colony- UC-7- Orangi Town,24.95778,66.98315,Female,Sindh,0,2,0,1144
109,Paramount Grammar School,24.9579,66.99907,Combined,Sindh,2,2,944,740
111,Paramount Grammar School,24.9579,66.9991,Male,Sindh,3,0,1170,0
217,Islamia High School- Sector 14-H- Allah Waris Colony- UC-6- Orangi Town. (M),24.95811,66.99541,Male,Sindh,4,0,1547,0
218,Islamia High School- Sector 14-H- Allah Waris Colony- UC-6- Orangi Town. (F),24.95811,66.99544,Female,Sindh,0,2,0,1107
219,Islamia High School- Sector 14-H- Allah Waris Colony- UC-6- Orangi Town. (M),24.95811,66.99547,Male,Sindh,3,0,1625,0
220,Islamia High School- Sector 14-H- Allah Waris Colony- UC-6- Orangi Town. (M),24.95811,66.9955,Female,Sindh,0,4,0,1703
103,Rabia Girls College Baba Willayat Ali Shah,24.95887,66.97528,Female,Sindh,0,2,0,776
131,Superior Sec School,24.95889,66.9775,Combined,Sindh,1,3,249,1255
226,The Benchmark School-Sector 11 1/2- Near Rehmat Chowk- UC-9- Orangi Town. (M),24.95917,66.98888,Male,Sindh,3,0,1541,0
227,The Benchmark School-Sector 11 1/2- Near Rehmat Chowk- UC-9- Orangi Town. (M),24.95917,66.98891,Combined,Sindh,1,3,284,1411
208,PAk. Islamia School- Sector 14/D-  UC-8- Orangi Town.  (Ground Floor). (C),24.95944,66.99525,Combined,Sindh,2,1,1299,277
212,Azan Public School- Sector 14-E-  UC-8- Orangi Town. (C),24.96027,66.9957,Combined,Sindh,2,2,940,683
210,Hermain School System,24.96029,66.99562,Combined,Sindh,1,2,499,960
211,Hermain School System,24.96029,66.99565,Female,Sindh,0,2,0,932
268,Hermain Grammar School-  Sector 13/H- UC-10-  Orangi Town.(M),24.96029,66.99568,Combined,Sindh,2,2,1235,871
222,Shaheen Public School- K-338- Sector 11- Shamsi Colony- UC-9- Orangi Town. (M),24.96064,66.99162,Combined,Sindh,3,1,1386,229
223,Shaheen Public School- K-338- Sector 11- Shamsi Colony- UC-9- Orangi Town.(F),24.96064,66.99165,Female,Sindh,0,4,0,1667
189,GGSS Raja Tanveer Colony- J.M Govt. Primary School- Sector 11-1/2- UC-7- Orangi Town. (M),24.96083,66.96944,Male,Sindh,3,0,1444,0
190,GGSS Raja Tanveer Colony- J.M Govt. Primary School- Sector 11-1/2- UC-7- Orangi Town. (M),24.96083,66.96947,Male,Sindh,2,0,1199,0
191,GGSS Raja Tanveer Colony- J.M Govt. Primary School- Sector 11-1/2- UC-7- Orangi Town. (C),24.96083,66.9695,Combined,Sindh,2,2,654,778
160,Decent Paradise- Plot No. 474- Chishti Nagar- Sector 11 1/2- UC-7- Orangi Town. (M),24.96143,66.98225,Combined,Sindh,2,1,1044,470
161,Decent Paradise- Plot No. 474- Chishti Nagar- Sector 11 1/2- UC-7- Orangi Town. (M),24.96143,66.98228,Male,Sindh,3,0,1563,0
164,Decent Paradise- Plot No. 474- Chishti Nagar- Sector 11 1/2- UC-7- Orangi Town. (M),24.96143,66.98231,Male,Sindh,3,0,1586,0
176,Liaquat Memorial School- UC-7- Orangi Town- (F),24.96233,66.97442,Combined,Sindh,1,3,306,1162
163,Al Khyum Sec. School- Chishti Nagar- UC-7- Orangi Town. (C),24.96245,66.97906,Combined,Sindh,2,2,740,740
185,GBPS Arafat- Raees Amrohi- Sector 11 1/2- UC-7- Orangi Town. (M),24.96273,66.97201,Male,Sindh,2,0,1149,0
186,GBPS Arafat- Raees Amrohi- Sector 11 1/2- UC-7- Orangi Town. (F),24.96273,66.97204,Combined,Sindh,1,2,277,963
187,GBPS Arafat- Raees Amrohi- Sector 11-1/2- UC-7- Orangi Town- (M),24.96273,66.97207,Male,Sindh,3,0,1533,0
188,GBPS Arafat- Raees Amrohi- Sector 11-1/2- UC-7- Orangi Town- (F),24.96273,66.9721,Female,Sindh,0,4,0,1648
213,Johar Public School- Sector 14/G- Johar Chowk- UC-8- Orangi Town. (C),24.96357,66.99475,Combined,Sindh,2,1,885,631
216,Johar Public School. Sector 14/G- Johar Chowk- UC-08- Orangi Town.(M),24.96357,66.99478,Combined,Sindh,2,1,1161,524
169,Shobi Grammar School- Shah Waliullah Nagar- UC-7- Orangi Town. (Gate No.1). (M),24.96427,66.9805,Male,Sindh,2,0,968,0
170,Shobi Grammar School- Shah Waliullah Nagar- UC-7- Orangi Town. (Gate No.1). (M),24.96427,66.98053,Male,Sindh,2,0,859,0
171,Shobi Grammar School- Shah Waliullah Nagar- UC-7- Orangi Town. (Gate No.3). (F),24.96427,66.98056,Female,Sindh,0,4,0,1395
166,Salma Public Secondary School (Montesory Section) Shah Waliullah Nagar- Sheet-4- UC-7- Orangi Town- (M),24.96575,66.97755,Combined,Sindh,2,1,1293,257
167,Salma Public Secondary School (Montesory Section) Shah Waliullah Nagar- Sheet-4- UC-7- Orangi Town- (F),24.96575,66.97758,Female,Sindh,0,4,0,1580
168,Salma Public Secondary School (Secondary Section) Shah Waliullah Nagar- Sheet-4- UC-7- Orangi Town- (M),24.96575,66.97761,Male,Sindh,4,0,1668,0
172,Salma Public Sec. School (Secondary Section) Shah Waliullah Nagar- Sheet-4- UC-7- Orangi Town- (M),24.96575,66.97764,Combined,Sindh,2,1,1239,415
173,Salma Public Sec. School (Secondary Section) Shah Waliullah Nagar- Sheet-4- UC-7- Orangi Town- (M),24.96575,66.97767,Combined,Sindh,2,1,957,324
174,Salma Public Sec. School (Montessory Section) Shah Waliullah Nagar- Sheet-4- UC-7- Orangi Town- (F),24.96575,66.9777,Female,Sindh,0,3,0,1362
175,Salma Public Sec. School (Secondary Section) Shah Waliullah Nagar- Sheet-4- UC-7- Orangi Town- (M),24.96575,66.97773,Male,Sindh,3,0,1322,0
221,Al-Qamar Academy- Sector 14-I- Sir Syed Colony- UC-6- Orangi Town. (C),24.96603,66.99419,Combined,Sindh,2,1,1288,400
134,Kamran Grammar Secondary School- ( Blilal Colony- Sector 11 1/2- UC-6- Orangi Town. (F),24.96743,66.98939,Female,Sindh,0,2,0,918
178,Iqra Taleem ul Islam- Mansoor Nagar- Sector 11 1/2- UC-7- Orangi Town. (M),24.9684,66.98244,Male,Sindh,2,0,1243,0
179,Iqra Taleem ul Islam- Mansoor Nagar- Sector 11 1/2- UC-7- Orangi Town. (F),24.9684,66.98247,Female,Sindh,0,4,0,1399
180,Iqra Taleem ul Islam- Mansoor Nagar- Sector 11 1/2- UC-7- Orangi Town. (M),24.9684,66.9825,Combined,Sindh,2,1,1081,252
181,Iqra Taleem ul Islam- Mansoor Nagar- Sector 11 1/2- UC-7- Orangi Town. (M),24.9684,66.98253,Male,Sindh,3,0,1461,0
135,H.A. Sattar Tameer Millat Model School- Ghaziabad Sector 11 1/2- UC-6- Orangi Town. (M),24.96891,66.9876,Male,Sindh,3,0,1457,0
136,H.A. Sattar Tameer Millat Model School- Ghaziabad- Sector 11 1/2- UC-6- Orangi Town. (F),24.96891,66.98763,Female,Sindh,0,3,0,1243
144,H.A. Sattar Tameer Millat Model School- Ghaziabad- Sector 11 1/2- UC-6- Orangi Town. (F),24.96891,66.98766,Female,Sindh,0,4,0,1534
122,Programmar English School,24.96963,66.99211,Combined,Sindh,2,1,947,646
123,Programmar English School,24.96963,66.99214,Combined,Sindh,2,1,804,580
124,Programmar English School,24.96963,66.99217,Combined,Sindh,2,1,735,532
182,Waseem Grammar School- Mansoor Nagar- Sector 11 1/2- UC-7- Orangi Town. (F),24.96986,66.97913,Female,Sindh,0,3,0,977
183,Waseem Grammar School- Mansoor Nagar- Sector 11 1/2- UC-7- Orangi Town. (M),24.96986,66.97916,Male,Sindh,2,0,1305,0
184,Medico High School- Yaqoobabad- UC-7- Orangi Town. (F),24.97139,66.97444,Combined,Sindh,1,2,335,1098
137,Al-Hamad School- Plot No. M-711- Ghaziabad- Sector 11 1/2- UC-6- Orangi Town. (M),24.97206,66.9882,Male,Sindh,3,0,1374,0
138,Al-Hamad School- Plot No. M-711- Ghaziabad- Sector 11 1/2- UC-6- Orangi Town. (F),24.97206,66.98823,Combined,Sindh,1,2,317,999
132,Samuel Public School- Gaziabad- Sector 11 1/2- UC-6- Orangi Town- (M),24.97435,66.98682,Male,Sindh,2,0,1318,0
133,Samuel Public School- Gaziabad- Sector 11 1/2- UC-6- Orangi Town- (M),24.97435,66.98685,Combined,Sindh,2,1,835,562
154,Shahab English School- Sector 16-C- Near Mastana Baba Mazar- Gulshan Bihar- UC-6- Orangi Town. (M),24.97713,66.99168,Combined,Sindh,2,1,1072,453
155,Shahab English School- Sector 16-C- Near Mastana Baba Mazar- Gulshan Bihar- UC-6- Orangi Town. (M),24.97713,66.99171,Combined,Sindh,1,1,559,356
151,Bakshi Sec School- Sector 16-C- Gulshan Bihar- UC-6- Orangi Town. (F),24.97722,66.99249,Combined,Sindh,1,3,321,1283
150,Ashraf Memorial School- Sector 16-C- Near Mastana Baba Mazar- Gulshan Bihar- UC-6- Orangi Town. (M),24.97861,66.99528,Male,Sindh,3,0,1646,0
148,TCF School- Gulshan-e-Zia- Ghaziabad- Sector 11 1/2- UC-6- Orangi Town. (F),24.979,66.9843,Female,Sindh,0,4,0,1375
142,Qaid-e-Millat Public School- M-3238- Ghaziabad- Sector 11 1/2- UC-6- Orangi Town. (F),24.9796,66.98756,Female,Sindh,0,4,0,1387
153,Sun Shinning Public School- Sector 16-C- Gulshan Bihar- Opposite Asia Ground- UC-6- Orangi Town. (F),24.98,66.99528,Female,Sindh,0,3,0,1308
269,Sun Rise Schoolm- 13-H-  UC-10- Orangi Town.(F),24.98007,66.99542,Combined,Sindh,2,1,980,721
152,National Trust Special Education Complex- Gulshan Bihar- Sector 16-C- UC-6- Orangi Town. (M),24.98028,66.9911,Male,Sindh,3,0,1536,0
149,GBPS Noorani- Gulshan-e-Zia- Sector 11 1/2- UC-6- Orangi Town. (C),24.98118,66.98243,Combined,Sindh,2,1,1083,341
207,GBPS Noor ul Islam 14-C -  Bilal Colony- UC-8-  Orangi Town. (F),24.98118,66.98246,Combined,Sindh,1,2,283,1298
139,Umair children Public School- Gulshan-e-Zia- Sector 11 1/2- UC-6- Orangi Town. (C),24.98163,66.98494,Combined,Sindh,1,1,607,481
140,Umair children Public School- Gulshan-e-Zia- Sector 11 1/2- UC-6- Orangi Town. (C),24.98163,66.98497,Combined,Sindh,1,1,583,390
141,Umair Children Public School- Gulshan-e-Zia- Sector 11 1/2- UC-6- Orangi Town. (M),24.98163,66.985,Male,Sindh,4,0,1614,0
143,New Grammar Children Secondary School- Plot No:-M-687- 748- Gulshan-e-Zia- UC-6- Orangi Town. (M),24.98254,66.98786,Male,Sindh,4,0,1813,0
147,Al-Ilm Publilc School- Plot No:-2657- Liaquat Chowk- UC-6- Orangi Town. (M),24.98425,66.98795,Male,Sindh,3,0,1401,0
145,Dil Mansoor School- Gulshan-e-Zia- Sector 11 1/2- UC-6- Orangi Town. (C),24.9854,66.98622,Combined,Sindh,2,1,895,441
146,Dil Mansoor School- Gulshan-e-Zia- Sector 11 1/2- UC-6- Orangi Town. (C),24.9854,66.98625,Combined,Sindh,2,1,915,365
