StationId,PollingStation,Lat,Lng,BoothType,Province,MaleBooths,FemaleBooths,MaleVoters,FemaleVoters
367,Government Boys Elementary School Bharoke. (P),32.11178,74.64729,Combined,Punjab,1,1,736,587
366,Government Girls Elementry  School Fateh Wali.,32.11818,74.64566,Combined,Punjab,1,1,426,317
365,Government Boys Primary School Lala Sayda. (P),32.12621,74.65693,Combined,Punjab,2,1,983,695
364,Government Boys Primary School Meero Bhadiar (P),32.13573,74.63885,Combined,Punjab,2,2,1034,797
356,Government Boys High School Saukin  Wind (Male) (P),32.14906,74.61781,Male,Punjab,2,0,1208,0
357,Government Boys High School Saukin  Wind (Female) (P),32.14906,74.61784,Female,Punjab,0,2,0,954
363,Government Boys Primary School Bharoke  (P),32.1499,74.66245,Combined,Punjab,2,1,999,637
372,Government Girls Community Model Thatha Bawa. (P),32.1525,74.62139,Combined,Punjab,1,1,793,566
360,Government Girls Primary School Rajadewali. (P),32.1525,74.62155,Combined,Punjab,1,1,703,543
358,Government Girls High School Saukinwind (Male),32.15383,74.6203,Male,Punjab,2,0,1587,0
359,Government Girls High School Saukinwind. (Female),32.15383,74.62033,Female,Punjab,0,2,0,1250
361,Government Boys Elementary SchoolChuhar Munda. (P),32.15451,74.64525,Male,Punjab,2,0,1271,0
362,Government Boys Elementary SchoolChuhar Munda. (P),32.15451,74.64528,Female,Punjab,0,2,0,924
380,Government Boys High School Dhodha. (Male)  (P),32.16059,74.6883,Male,Punjab,2,0,1502,0
381,Government Boys High School Dhodha. (Female)  (P),32.16059,74.68833,Female,Punjab,0,2,0,1074
383,Government Girls High School Dhodha.,32.16233,74.69751,Combined,Punjab,1,1,844,645
371,Government Model Primary School Shah Hussain. (P),32.16352,74.66909,Combined,Punjab,1,1,803,500
312,Government Girls Primary School Kotli Gopi Rai (P),32.16593,74.72729,Combined,Punjab,1,1,815,568
282,Government Boys Primary School Panjgrain (P),32.17078,74.74944,Combined,Punjab,2,1,955,713
382,Government Model Elementay School  Aidal Pur. (P),32.17831,74.70834,Combined,Punjab,1,1,421,336
313,Government Girls Elementary School Wahga (P),32.17921,74.71698,Combined,Punjab,1,1,551,450
369,Government Community Model School Pejoke (P),32.18298,74.58953,Combined,Punjab,2,1,952,768
306,Government Boys Primary School Khewa Bajwa (P),32.18466,74.65285,Combined,Punjab,1,1,744,634
379,Government Boys Primary School  Noor Pur. (P),32.18556,74.64194,Combined,Punjab,1,1,744,568
378,Government Girls Primary School Dado Wali.  (P),32.18667,74.62251,Combined,Punjab,2,1,936,647
305,Government Girls Primery School Chak Ishaq.,32.19164,74.6813,Combined,Punjab,1,1,406,327
368,Governmet Girls Primary School  Mehmand Wali. (Combined),32.1926,74.60784,Combined,Punjab,1,1,522,348
283,Government Boys Elementary School Takhat Pur (P),32.19313,74.72993,Combined,Punjab,1,1,857,673
304,Civil Dispensary Uncha Paharang (P),32.19316,74.69687,Combined,Punjab,2,1,939,680
370,Government Girls Primary School  Aqimachi. (P),32.19388,74.59061,Combined,Punjab,1,1,621,475
303,Government Girls Primary School Pohla. (P),32.1939,74.72141,Combined,Punjab,1,1,451,364
376,Government Model Primary School  Thatha Malkhi. (P),32.19421,74.56508,Combined,Punjab,1,1,351,269
314,Government Boys Islamia High School Kalass Wala. (P),32.20181,74.64957,Combined,Punjab,1,1,624,421
315,Government Boys Islamia High School Kalass Wala. (Male) (P),32.20181,74.6496,Male,Punjab,3,0,1629,0
316,Government Boys Islamia High School Kalass Wala. (Female) (P),32.20181,74.64963,Female,Punjab,0,2,0,1357
377,Governmet Girls Primary School  Sharak Pur (Combined),32.20279,74.55373,Combined,Punjab,1,1,276,187
317,Government Girls  High School Kalass Wala. (P),32.20292,74.64727,Combined,Punjab,1,1,767,571
318,Government Girls  High School Kalass Wala. (Male) (P),32.20292,74.6473,Male,Punjab,3,0,1848,0
319,Government Girls  High School Kalass Wala. (Female) (P),32.20292,74.64733,Female,Punjab,0,2,0,1587
284,Government Girls Primary School Chak Qurashian (P),32.20454,74.73575,Combined,Punjab,1,1,507,347
287,Government Girls High School Chicherwali. (P),32.21087,74.57901,Combined,Punjab,1,1,593,443
289,Government Girls High School Chicherwali. (Female) (P),32.21087,74.57904,Female,Punjab,0,2,0,995
302,Government Girls Primary School Kalowali Khurd (P),32.21291,74.72688,Combined,Punjab,1,1,638,468
296,Government Girls Elementary SchoolQazi Paharang  (P),32.21438,74.69231,Combined,Punjab,2,1,908,558
281,Government Girls Primary School Sojowali (P),32.21438,74.74474,Combined,Punjab,1,1,591,475
288,Government Boys High SchoolChicherwali.(Male) (P),32.21509,74.58524,Male,Punjab,2,0,1279,0
311,Government Girls Elementry  School Bhulair Bajwa.,32.21519,74.61301,Combined,Punjab,1,1,540,354
309,Government Boys Elementary School Bholair Bajwa. (Male) (P),32.21545,74.61271,Male,Punjab,3,0,1669,0
310,Government Boys Elementary School Bholair Bajwa. (Female) (P),32.21545,74.61274,Female,Punjab,0,2,0,1289
298,Government Girls Elementary School Haibat Pur. (P),32.21867,74.67145,Combined,Punjab,1,1,626,481
291,Government Girls Elementary School Kalowali Saydan  (P),32.22457,74.72759,Combined,Punjab,2,2,1050,732
373,Government BoysPrimary School Faqiranwali. (P),32.22976,74.58777,Combined,Punjab,1,1,842,568
290,Government Girls Primary School Fattaha (P),32.23006,74.73666,Combined,Punjab,1,1,476,253
307,Government Girls Elementary School Khokhar (P),32.23153,74.68862,Combined,Punjab,2,1,1016,734
301,Government Boys Elementary School Basi Wala. (P),32.23156,74.59837,Combined,Punjab,2,2,1071,811
292,Government Boys Primary School Bholar Maray Wala.. (P),32.23188,74.62565,Combined,Punjab,1,1,789,508
297,Office Union Council Talwandi Inayat Khan (P),32.23331,74.6609,Combined,Punjab,1,1,693,615
293,Government Boys Primary School Charar (P),32.23906,74.62873,Combined,Punjab,1,1,598,428
285,Government Girls Primary School Budha Khurd (P),32.23942,74.72726,Combined,Punjab,1,1,448,288
294,Government Girls Primary School Dadu Bajwa. (P),32.2395,74.64365,Combined,Punjab,1,1,685,521
286,Government Boys Elementary School Kala Pahar (P),32.24303,74.71124,Combined,Punjab,1,1,467,347
299,Government Boys Elementary School Gujjar Goraya. (P),32.24635,74.6216,Combined,Punjab,1,1,829,554
207,Government Girls Elementry  School Dhair Pir Muhammad.,32.2475,74.71319,Combined,Punjab,1,1,641,490
191,Government Boys Primary School Bholar Rohi Wala.. (P),32.24901,74.55721,Combined,Punjab,1,1,688,459
350,Government Girls Elememtary School Mallalu  Pasrur.  (P),32.25023,74.65739,Combined,Punjab,1,1,712,654
308,Government Girls Primary School Sodian (P),32.25214,74.69688,Combined,Punjab,1,1,904,662
351,Government Boys Elementry School Nanglian. (Male) (P),32.25249,74.65723,Male,Punjab,2,0,1133,0
352,Government Boys Elementry School Nanglian. (Female) (P),32.25249,74.65726,Female,Punjab,0,2,0,895
348,Government Girls Primary School Muslim Colony Pasrur. (Male)  (P),32.25294,74.65102,Male,Punjab,2,0,1287,0
349,Government Girls Primary School Muslim Colony Pasrur. (Female)  (P),32.25294,74.65105,Female,Punjab,0,2,0,1113
193,Government Boys Elementary School Kul Bajwa. (P),32.25423,74.57316,Combined,Punjab,2,2,999,779
300,Government Boys Primary School Taqi Pur. (P),32.2548,74.60419,Combined,Punjab,1,1,804,553
204,Government Model Primary School Dulam Wala.,32.25496,74.62489,Combined,Punjab,1,1,594,406
295,Government Girls High School Noshehra. (P),32.25796,74.65923,Combined,Punjab,1,1,600,473
238,Government Boys Elementary School- Kamal Pur Chishtian. (P),32.26077,74.71048,Combined,Punjab,1,1,821,768
202,Government Girls Primery School Nangal Mirza. (Female),32.26126,74.64796,Female,Punjab,0,2,0,1122
353,Government Aisha Girls High School  Pasrur. (Male)(P),32.26146,74.66988,Male,Punjab,3,0,1690,0
354,Government Aisha Girls High School  Pasrur. (Female)(P),32.26146,74.66991,Female,Punjab,0,2,0,1200
355,Government Aisha Girls High School  Pasrur. (P),32.26146,74.66994,Combined,Punjab,1,1,724,585
339,Committee Ghar Pasrur.(Male)  (P),32.26406,74.65905,Male,Punjab,2,0,1555,0
340,Committee Ghar Pasrur.(Female)  (P),32.26406,74.65908,Female,Punjab,0,2,0,1366
346,Government  Boys Primary School No.2 Pasrur. (Male)  (P),32.26413,74.66338,Male,Punjab,2,0,1054,0
347,Government  Boys Primary School No.2 Pasrur. (Female)  (P),32.26413,74.66341,Female,Punjab,0,2,0,862
337,Government Girls High SchoolPasrur(Male)(P),32.26445,74.65584,Male,Punjab,2,0,1037,0
338,Government Girls High SchoolPasrur(Female)(P),32.26445,74.65587,Female,Punjab,0,2,0,866
236,Office Union Council Nokrian Mughlan. (P),32.26475,74.67902,Combined,Punjab,2,1,918,727
201,Government Boys Primary School. Mirza Bajwa.(Nangal Mirza) (Male) (P),32.2649,74.64026,Male,Punjab,2,0,1469,0
344,Government City Boys Elementary SchoolPasrur. (Male) (P),32.26511,74.66478,Male,Punjab,3,0,2063,0
345,Government City Boys Elementary SchoolPasrur. (Female) (P),32.26511,74.66481,Female,Punjab,0,3,0,2543
328,Government Elementry College for Teacher Training Centre.(Male) (P),32.26528,74.65556,Male,Punjab,2,0,1365,0
329,Government Elementry College for Teacher Training Centre.(Female) (P),32.26528,74.65559,Female,Punjab,0,2,0,1085
330,Government Elementry College for Teacher Training Centre.(P),32.26528,74.65562,Combined,Punjab,1,1,486,428
331,Government Elementry College for Teacher Training Centre. (Male) (P),32.26528,74.65565,Male,Punjab,2,0,1355,0
332,Government Elementry College for Teacher Training Centre. (Female) (P),32.26528,74.65568,Female,Punjab,0,2,0,1183
215,Government Model Primary School Dogri Ghumna (P),32.26532,74.65555,Combined,Punjab,2,1,911,684
374,Government Boys High School New Sohawa. (Male) (P),32.26547,74.65487,Male,Punjab,2,0,1367,0
375,Government Boys High School New Sohawa.(Female) (P),32.26547,74.6549,Female,Punjab,0,2,0,909
194,Government Girls Primary School Alkrray.,32.26588,74.69392,Combined,Punjab,1,1,327,277
342,Office Wapda Kalas wala Road Pasrur. (Male) (P),32.26637,74.66665,Male,Punjab,2,0,1408,0
343,Office Wapda Kalas wala Road Pasrur. (Female) (P),32.26637,74.66668,Female,Punjab,0,2,0,1197
237,Government Girls High School Chuhan.,32.26926,74.68278,Combined,Punjab,1,1,336,250
322,Government Boys Degree College Pasrur. (P),32.26947,74.66068,Combined,Punjab,2,2,929,861
325,Gvot.Boys Degree College Pasrur.  (P),32.26947,74.66071,Combined,Punjab,2,1,950,727
326,Gvot.Boys Degree College Pasrur. (Male) (P),32.26947,74.66074,Male,Punjab,2,0,1371,0
327,Gvot.Boys Degree College Pasrur. (Female) (P),32.26947,74.66077,Female,Punjab,0,2,0,1152
200,Government Girls High School- Mussapur. (P),32.26972,74.63023,Combined,Punjab,1,1,835,651
333,Government Boys High SchoolNo.1 Pasrur. (Male) (P),32.27064,74.66621,Male,Punjab,2,0,1354,0
334,Government Boys High SchoolNo.1 Pasrur. (Female) (P),32.27064,74.66624,Female,Punjab,0,2,0,1136
324,Government Boys High School No.1 Pasrur. (P),32.27089,74.66579,Combined,Punjab,1,1,726,559
335,Office Markeet Committee Pasrur.(Male) (P),32.27127,74.66679,Male,Punjab,3,0,1651,0
336,Office Markeet Committee Pasrur.(Female) (P),32.27127,74.66682,Female,Punjab,0,2,0,1332
189,Government Boys Elementary School Bhag. (P),32.27225,74.74562,Combined,Punjab,1,1,719,482
203,Government Boys Primary School- Kotli Haji Pur. (P),32.27328,74.6145,Combined,Punjab,2,1,931,797
206,Government Girls Primary School Dugri Hundlan. (P),32.27571,74.71967,Combined,Punjab,1,1,721,573
341,Government Boys High SchoolNo.2 Pasrur. (P),32.27618,74.6917,Combined,Punjab,1,1,646,584
255,Government Girls Primery School Kot Kalal.,32.27745,74.63295,Combined,Punjab,1,1,480,370
320,Government Girls Model Primary School Bhorakay. (P),32.27884,74.64613,Combined,Punjab,1,1,900,653
205,Government Girls Comunity Model School Tawrianwala. (P),32.27934,74.59499,Combined,Punjab,1,1,831,625
321,Government Abad Technical Training Centre Pasrur. (P),32.27978,74.65614,Combined,Punjab,1,1,696,570
190,Government Girls Primary School Kamla Bhag. (P),32.28027,74.76715,Combined,Punjab,1,1,393,283
184,Government Girls High School Ban Bajwa. (Female),32.28188,74.56446,Female,Punjab,0,2,0,1109
187,Government Girls High School Ban Bajwa. (Male),32.28188,74.56449,Male,Punjab,2,0,1111,0
188,Government Girls High School Ban Bajwa. (Female),32.28188,74.56452,Female,Punjab,0,2,0,840
185,Government Boys Primary School Ban Bajwa (Male) (P),32.28201,74.55971,Male,Punjab,2,0,1276,0
186,Government Boys Primary School Ban Bajwa (Female) (P),32.28201,74.55974,Female,Punjab,0,2,0,947
244,Government Girls Primery School Esa..,32.28552,74.7178,Combined,Punjab,1,1,329,205
323,Government Girls Primary School Malo Patial. (P),32.2859,74.66221,Combined,Punjab,1,1,748,605
208,Government Girls Primary School Karpal Pur. (P),32.28704,74.56361,Combined,Punjab,1,1,575,479
231,Government Boys Primary School Naoul (P),32.28717,74.6322,Combined,Punjab,1,1,841,627
192,Government Boys Primary School Chak Kala (Nangal). (P),32.29042,74.54814,Combined,Punjab,1,1,722,498
232,Government Boys Elementary School Loharke (P),32.29082,74.62167,Combined,Punjab,2,2,1015,879
243,Government Boys Primary School Arki. (P),32.29163,74.70396,Combined,Punjab,1,1,464,339
226,Government Girls High School Godha (P),32.29295,74.59857,Combined,Punjab,2,1,1002,717
210,Government Boys High School Kotli Faqir Chand.(Male)(P),32.29328,74.53603,Male,Punjab,3,0,1687,0
211,Government Boys High School Kotli Faqir Chand.(Female)(P),32.29328,74.53606,Female,Punjab,0,2,0,1356
235,Government Girls Primery School Sabal Pur. (Female),32.29469,74.67956,Female,Punjab,0,2,0,1105
212,Government Boys Primary School Mukta. (P),32.29498,74.53033,Combined,Punjab,1,1,783,580
230,Government Boys High School Mali Pur. (P),32.29572,74.64698,Combined,Punjab,1,1,783,699
196,Government BoysPrimary School Sohavi. (P),32.29616,74.51905,Combined,Punjab,2,2,989,796
234,Government Boys Elementary School Sabalpur.(Male)  (P),32.29741,74.67673,Male,Punjab,2,0,1464,0
157,Government Boys High School Shahzada (Female) (P),32.29936,74.75308,Female,Punjab,0,2,0,1120
158,Government Boys High School Shahzada. (P),32.29936,74.75311,Combined,Punjab,1,1,547,474
233,Government Boys Elementary School Ramke. (P),32.29974,74.65752,Combined,Punjab,1,1,886,733
246,Government Girls Primery School Kapoor Pur. (Female),32.30155,74.72457,Female,Punjab,0,2,0,1164
156,Government Girls High School Shahzada (Male) (P),32.30197,74.7552,Male,Punjab,2,0,1262,0
245,Government Boys Primary School Kapoor Pur(Male( (P),32.30249,74.72346,Male,Punjab,2,0,1468,0
218,Government Girls Primary School Sadanwali (P),32.30325,74.55741,Combined,Punjab,1,1,417,269
225,Government Girls Primary School Kalowali. (P),32.30376,74.56587,Combined,Punjab,1,1,793,605
271,Government Boys Primary School Jajo Pur  (P),32.30405,74.69128,Combined,Punjab,1,1,745,595
153,Government Girls Primary School Daria Nangal (P),32.30528,74.77972,Combined,Punjab,1,1,509,387
274,Government Girls High School Lape Wali (P),32.30651,74.68153,Combined,Punjab,1,1,543,484
198,Government Boys Primary School Paropi Nagra. (P),32.30722,74.51398,Combined,Punjab,1,2,855,653
183,Government Boys High School Ban Bajwa (Male)  (P),32.30798,74.56831,Male,Punjab,2,0,1526,0
227,Government Girls Primary School Panwana. (Male) (P),32.30862,74.61625,Male,Punjab,2,0,1070,0
228,Government Girls Primary School Panwana. (Female) (P),32.30862,74.61628,Female,Punjab,0,2,0,905
229,Government Girls Primary School Saray Shah Fatah. (P),32.30963,74.63775,Combined,Punjab,1,1,377,310
152,Government Girls Primery School Chak Machana.,32.30977,74.81497,Combined,Punjab,1,1,677,491
222,Government Girls Elementary School Randawa (P),32.31007,74.58592,Combined,Punjab,2,2,999,820
155,Government Boys Primary School Dhoul. (P),32.31039,74.75826,Combined,Punjab,1,1,869,641
272,Government Boys Primary School Vains (P),32.31089,74.70226,Combined,Punjab,1,1,598,502
268,Government Boys Primary School Bhaganian (P),32.31398,74.66785,Combined,Punjab,1,1,652,555
248,Government Boys Primary School Kamal Pur Bajwa. (P),32.31463,74.72478,Combined,Punjab,1,1,607,479
273,Government Boys Primary School Matteky (P),32.31752,74.68835,Combined,Punjab,2,1,910,732
214,Government Girls Elementry School Ferozke Nagra.(Female),32.3178,74.53192,Female,Punjab,0,2,0,1030
220,Government Girls High School Jodhala. (Male) (P),32.31806,74.55742,Male,Punjab,2,0,1470,0
221,Government Girls High School Jodhala. (Female) (P),32.31806,74.55745,Female,Punjab,0,2,0,1145
247,Government Girls Primary School Sikandar Pur. (P),32.31824,74.71912,Combined,Punjab,1,1,515,442
199,Government Boys Primary School Ranike.. (P),32.31915,74.49767,Combined,Punjab,1,1,661,493
154,Government Girls High School Chahur.  (P),32.31942,74.83024,Combined,Punjab,2,2,951,810
197,Government Girls High School Adamke Nagra. (P),32.31962,74.51504,Combined,Punjab,1,1,772,653
150,Government Girls Elementary School Seowal (Male) (P),32.3198,74.78346,Male,Punjab,2,0,1306,0
151,Government Girls Elementary School Seowal (Female) (P),32.3198,74.78349,Female,Punjab,0,2,0,1047
258,Government Girls High School Langay(Male)(P),32.31995,74.64141,Male,Punjab,2,0,1178,0
259,Government Girls High School Langay(Female)(P),32.31995,74.64144,Female,Punjab,0,2,0,994
219,Government Boys Elementary School Jodhala (P),32.32057,74.5606,Combined,Punjab,1,1,905,740
149,Government Boys Elementary School Seowal.,32.32069,74.78255,Combined,Punjab,1,1,729,582
213,Government Boys Primary School Ferozke Nagra. (Male) (P),32.32106,74.52648,Male,Punjab,2,0,1349,0
269,Government Girls Primary School Khurpa. (P),32.32251,74.66893,Combined,Punjab,1,1,460,364
6,Government Girls Primary School Rajian. (P),32.32276,74.74136,Combined,Punjab,1,1,510,394
223,Government Girls Primary School Laveray.(Male) (P),32.32332,74.58917,Male,Punjab,2,0,1199,0
224,Government Girls Primary School Laveray.(Female) (P),32.32332,74.5892,Female,Punjab,0,2,0,906
195,Government Boys Primary School Kalo Ke Nagra. (P),32.32735,74.48628,Combined,Punjab,1,1,809,674
256,Government Boys Primary School Abdali (P),32.32809,74.62167,Combined,Punjab,1,1,891,726
257,Government Girls Primary School-Nangal Bajwa. (P),32.33351,74.64044,Combined,Punjab,2,1,921,771
7,Government Girls Primary School Hameed Pur (P),32.33361,74.73972,Combined,Punjab,2,2,991,782
161,Government Girls Primary School Said Pur Hanjli. (PEF),32.33543,74.85128,Combined,Punjab,1,1,417,331
159,Government Boys Primary School Eis Pur. (P),32.3364,74.82056,Combined,Punjab,1,1,555,447
254,Government Girls Primary School Dhingranwali. (P),32.33822,74.60236,Combined,Punjab,1,1,780,639
270,Government Girls Primary School  Buttar Dogran (P),32.33928,74.68886,Combined,Punjab,1,1,774,577
266,Government Boys Primary School Mundeke Berian (Female)  (P),32.34028,74.65728,Female,Punjab,0,2,0,1154
265,Government Girls High School Mundeke Berian (Male) (P),32.34037,74.65063,Male,Punjab,2,0,1519,0
267,Government Girls High School Mundeke Berian. (P),32.3404,74.65058,Combined,Punjab,1,1,589,489
144,Government Boys Primary School Dheroke/Bambe.,32.34049,74.79192,Combined,Punjab,1,1,798,606
145,Government Girls Primary School Khan Hari. (P),32.34084,74.76569,Combined,Punjab,1,1,377,264
162,Government Boys  Primary School Jhatokay. (P),32.34228,74.82271,Combined,Punjab,2,2,997,805
46,Government Girls Primary School No.2 Chwinda. (P),32.34306,74.70294,Combined,Punjab,1,1,598,431
8,Basic Health Unit Kotli Saiydan (P),32.34306,74.74305,Combined,Punjab,1,1,530,457
50,Office Assistant Education Officer (Women) Chwinda. (Female) (P),32.34333,74.70444,Female,Punjab,0,2,0,908
47,Government Boys Primary School No.1 Chwinda.(Male)  (P),32.3441,74.70341,Male,Punjab,2,0,1182,0
48,Government Boys Primary School No.1 Chwinda.(Female)  (P),32.3441,74.70344,Female,Punjab,0,2,0,1012
141,Government Boys High School Thro. (P),32.34452,74.80611,Combined,Punjab,2,1,951,678
253,Government Boys Primary School Nathu Kalair. (P),32.3457,74.58324,Combined,Punjab,1,1,679,511
251,Government Girls Community Model  School Purab Klair.(male),32.34597,74.63403,Male,Punjab,2,0,1115,0
252,Government Girls Community Model  School Purab Klair.(Female),32.34597,74.63406,Female,Punjab,0,2,0,898
49,Government Boys DC High School Chawinda Upper Building . (Male) (P),32.34599,74.70546,Male,Punjab,2,0,981,0
52,Government Boys DC High School Chawinda Upper Building . (Male) (P),32.34599,74.70549,Male,Punjab,2,0,1182,0
53,Government Boys DC High School Chawinda Upper Building . (Female) (P),32.34599,74.70552,Female,Punjab,0,2,0,1032
51,Office Committee Ghar Chawinda. (P),32.34611,74.70444,Combined,Punjab,1,1,462,432
5,Government Boys Primary School Dogranwali. (P),32.34657,74.7474,Combined,Punjab,2,2,1008,848
43,Government Girls Higher Secondery School Chawinda.(Female)  (P),32.34676,74.71034,Female,Punjab,0,2,0,1261
146,Government Model Primary School Mata Hari. (P),32.34681,74.76083,Combined,Punjab,1,1,812,554
249,Government Model Primery School Bhathay.,32.34683,74.62241,Combined,Punjab,1,1,477,333
42,Government Girls Higher Secondery School Chawinda.(Male)  (P),32.34686,74.70895,Male,Punjab,2,0,1458,0
41,Government Girls Primary School No.1 Chawinda. (P),32.34694,74.70889,Combined,Punjab,1,1,672,583
147,Government Boys Primary School Dogri Harian(Male) (P),32.34747,74.77294,Male,Punjab,2,0,1499,0
40,Government Boys Islamia High School Chawinda. (P),32.3475,74.70083,Combined,Punjab,1,1,785,588
148,Government Girls High School Dogri Harian.(Female),32.348,74.77144,Female,Punjab,0,2,0,1200
38,Government Boys Primary School No.2 Bording House Chwinda. (Male) (P),32.34818,74.70185,Male,Punjab,2,0,1211,0
39,Government Boys Primary School No.2 Bording House Chwinda. (Female) (P),32.34818,74.70188,Female,Punjab,0,2,0,1051
36,Government Boys Degree College Chawinda.(Male) (P),32.3493,74.69719,Male,Punjab,2,0,1041,0
37,Government Boys Degree College Chawinda.(Female) (P),32.34952,74.69721,Female,Punjab,0,2,0,798
160,Government Girls Primary School Mehtab Pur Hanjli. (P),32.35002,74.84339,Combined,Punjab,1,1,613,415
44,Government Boys Islamia High School Chawinda. (Male) (P),32.35028,74.70694,Male,Punjab,2,0,1108,0
45,Government Boys Islamia High School Chawinda. (Female) (P),32.35028,74.70697,Female,Punjab,0,2,0,1035
32,Government Girls Elementary School Jassoran(Male) (P),32.35178,74.67949,Male,Punjab,2,0,1200,0
33,Government Girls Elementary School Jassoran(Female) (P),32.35178,74.67952,Female,Punjab,0,2,0,947
34,Government Boys Primary School Jassoran (P),32.35242,74.67728,Combined,Punjab,1,1,688,538
142,Government Girls High School Tharo.  (Male)(P),32.35561,74.7983,Male,Punjab,2,0,1487,0
143,Government Girls High School Tharo.  (Female)(P),32.35561,74.79833,Female,Punjab,0,2,0,1115
3,Government Model Primary School Sahnewali (P),32.35579,74.71371,Combined,Punjab,1,1,868,698
277,Government Boys Primary School Sohdreki.(Male) (P),32.35655,74.64815,Male,Punjab,2,0,1041,0
278,Government Boys Primary School Sohdreki (Femae)  (P),32.35655,74.64818,Female,Punjab,0,2,0,849
216,Government Girls Elementary School Sorangi.(Male) (P),32.35659,74.50777,Male,Punjab,2,0,1064,0
217,Government Girls Elementary School Sorangi.(Female) (P),32.35659,74.5078,Female,Punjab,0,2,0,743
240,Government Boys Primary School Dhilwan (P),32.35805,74.57384,Combined,Punjab,2,2,1034,752
241,Government Boys Primary School Sohal (P),32.3581,74.59288,Combined,Punjab,1,1,580,476
4,Government Girls Primary School Ballowali (P),32.36114,74.73035,Combined,Punjab,2,2,1058,820
35,Government Girls Primary School Wajeedwali (P),32.36374,74.6983,Combined,Punjab,1,1,755,609
250,Government Girls Primary School Buttar Sehjdin (P),32.36456,74.62112,Combined,Punjab,2,1,913,663
242,Government Girls Primary School Mehnga. (P),32.36552,74.5983,Combined,Punjab,1,1,628,451
138,Government Model Primery School Sangrai Pur.,32.36662,74.80231,Combined,Punjab,1,1,577,390
19,Government Girls Primary School Warsalke. (P),32.36848,74.74969,Combined,Punjab,1,1,572,402
279,Government Girls Primary School Lalewali (P),32.36898,74.65015,Combined,Punjab,1,1,901,650
137,Government Boys Primary School Dhulam Khalwan.(PEF),32.3691,74.8242,Combined,Punjab,2,1,923,723
1,Government Girls Primary School Kalewali. (P),32.36933,74.71697,Combined,Punjab,1,1,869,743
275,Government Comunity Model School Bheloke. (Male) (P),32.37243,74.65823,Combined,Punjab,2,2,1035,750
14,Government Boys High School Alhar. (Male) (P),32.37323,74.67188,Male,Punjab,2,0,968,0
15,Government Boys High School Alhar. (Female) (P),32.37323,74.67191,Female,Punjab,0,2,0,867
280,Government Model Primery School Fateh Pur.,32.37374,74.66085,Combined,Punjab,1,1,623,429
139,Government Girls Primary School Joya. (P),32.37452,74.85597,Combined,Punjab,2,1,931,736
12,Government Girls Primary School Chak Dia Sing.,32.37538,74.68031,Combined,Punjab,1,1,427,303
13,Government Model Primary School Basra. (P),32.37643,74.68658,Combined,Punjab,2,1,917,700
18,Government Model Primary School Kamoke. (P),32.37695,74.75532,Combined,Punjab,1,1,907,713
260,Government Boys High School Baddiana. (Male) (P),32.37793,74.61084,Male,Punjab,3,0,1714,0
261,Government Boys High School Baddiana. (Female) (P),32.37793,74.61087,Female,Punjab,0,2,0,1249
262,Government Boys High School Baddiana (West-P) (Male) (P),32.37793,74.6109,Male,Punjab,2,0,1442,0
140,Government Boys High School Khan Pur Syedan. (P),32.37817,74.81751,Combined,Punjab,1,1,831,689
263,Government Girls Higher Secondery School Baddiana (Female) (P),32.37889,74.61124,Female,Punjab,0,2,0,1259
264,Government Girls Higher Secondery School Baddiana. (P),32.37889,74.61127,Combined,Punjab,1,1,493,365
31,Government Boys Primary School Kotli Jandran. (P),32.38081,74.70182,Combined,Punjab,1,1,466,419
60,Government Girls Primary School Rai Pur.(Male) (P),32.3843,74.82228,Male,Punjab,2,0,1096,0
61,Government Girls Primary School Rai Pur.(Female) (P),32.3843,74.82231,Female,Punjab,0,2,0,796
17,Government Boys Primary School Marl (P),32.38508,74.74399,Combined,Punjab,1,1,724,537
16,Government Girls Primary School Saboke.,32.38554,74.73552,Combined,Punjab,1,1,541,491
