StationId,PollingStation,Lat,Lng,BoothType,Province,MaleBooths,FemaleBooths,MaleVoters,FemaleVoters
68,Rest House Jalal Pur (Male)  (P)*,28.657313058192663,70.45423639482352,Male,Punjab,4,0,1650,0
69,Govt. Boys Primary School Jalal Pur (Female)  (P)*,28.666673920603145,70.45625056536645,Female,Punjab,0,2,0,1149
67,Govt. Girls Primary School Jaind Wali  (Female)  (P)*,28.67903,70.43934,Female,Punjab,0,3,0,1476
66,Govt. Boys Elementary School Jaind Wali  (Male)  (P)*,28.679043783630075,70.44165370092398,Male,Punjab,4,0,1888,0
71,Govt. Boys Primary School Dera Gabolan (P)*,28.68552714838132,70.46871593829394,Combined,Punjab,2,2,1011,756
70,Govt. Boys Primary School Basti Rainka (T)**,28.694873172324044,70.4742267696249,Combined,Punjab,2,2,947,655
73,Govt. Boys Primary School Kallar Wali (Female)  (P)*,28.69511019428259,70.40148333588391,Female,Punjab,0,3,0,1335
139,Govt. Girls Primary School Rang Pur Basti Toba Machian (P)*,28.698124866908763,70.35779480070838,Combined,Punjab,1,1,642,485
110,Govt. Boys Primary School Kotla Mehmood Khan Chak No.56/NP (P)*,28.699082545691596,70.34618558073898,Combined,Punjab,1,1,671,454
78,Govt. Girls Elementary School Mian Wali Sheikhan (Female)  (P)*,28.704772187348876,70.46838653328533,Female,Punjab,0,2,0,1118
107,Govt. Girls High School Sardar Garh (Female)  (P)*,28.704964751932547,70.43418839040926,Female,Punjab,0,2,0,1062
106,Govt. Girls High School Sardar Garh (Female)  (P)*,28.704964751932547,70.4342183904093,Female,Punjab,0,2,0,1269
104,Govt. Boys High School Sardar Garh (Male)  (P)*,28.704973368634473,70.43496058798839,Male,Punjab,4,0,1692,0
105,Govt. Boys High School Sardar Garh (Male)  (P)*,28.704973368634473,70.4349905879884,Male,Punjab,3,0,1374,0
77,Govt. Boys High School Mian Wali Sheikhan (Male)  (P)*,28.705293297671766,70.46846517483318,Male,Punjab,3,0,1397,0
137,Govt. Boys Primary School Rang Pur Basti Malana (Male),28.70737801146467,70.36608750928038,Male,Punjab,4,0,1785,0
138,Govt. Boys Primary School Rang Pur Basti Malana (Female),28.70737801146467,70.3661175092804,Female,Punjab,0,2,0,1223
103,Govt. Girls Primary School Mehmood Garh Basti Jind Wadda,28.709171606400766,70.4479539975854,Combined,Punjab,2,2,1248,897
109,Govt. Girls Primary School Mud Ismail Shah Pur (Male)  (P)*,28.71119,70.32999,Male,Punjab,4,0,1722,0
108,Govt. Boys Primary School Shah Pur  (Female)  (P)*,28.7147028008601,70.32082333128977,Female,Punjab,0,2,0,1125
72,Govt. Boys Primary School Thali Mohana Mouza Kallar Wali (Male)  (P)*,28.72366,70.40173,Male,Punjab,3,0,1548,0
140,Govt. Boys Elementary School Chak No. 55/NP (P)*,28.72378236529374,70.34227170695952,Combined,Punjab,1,1,673,449
92,Govt. Boys Primary School Puran (Male)  (P)*,28.725571707588138,70.3938929698001,Male,Punjab,2,0,1287,0
93,Govt. Boys Primary School Puran (Female)  (P)*,28.725571707588138,70.3939229698001,Female,Punjab,0,2,0,977
51,Govt. Boys Primary School  Adam Arain (Male)  (P)*,28.744244023062286,70.41681868559891,Male,Punjab,3,0,1627,0
52,Govt. Girls Primary School  Adam Arain  (Female)  (P)*,28.74843327076534,70.41837832365884,Female,Punjab,0,2,0,1261
41,Govt. Boys Primary School Baloch Nagar Mouza Phul Lolai (P)*,28.749039403301783,70.47516650789429,Combined,Punjab,1,1,743,526
81,Govt. Boys Primary School Kotla Rai Qabool Rashid Abad (Female)  (P)*,28.750722321755816,70.4520195443378,Female,Punjab,0,2,0,1061
75,Govt. Boys Elementary School Thul Hassan RYK (Male)  (P)*,28.750825031237223,70.33724704728269,Male,Punjab,4,0,1638,0
76,Govt. Boys Elementary School Thul Hassan RYK (Female)  (P)*,28.750825031237223,70.3372770472827,Female,Punjab,0,2,0,1293
79,Govt. Boys Primary School Chak No.60/NP,28.753026268161584,70.4293042952488,Combined,Punjab,2,2,1239,938
38,Govt. Girls P/S Ghazi Pur,28.75385,70.5089,Combined,Punjab,2,2,1108,867
99,Govt. Boys Primary School Thul Khair Muhammad (Male)  (P)*,28.757577616836965,70.35838177371265,Male,Punjab,3,0,1431,0
100,Govt. Girls Primary School Thul Khair Muhammad (Female)  (P)*,28.75794,70.35838,Female,Punjab,0,2,0,1089
39,Govt. Boys High School Ghazi Pur (Male)  (P)*,28.759053955668666,70.51005757917169,Male,Punjab,2,0,1324,0
40,Govt. Boys High School Ghazi Pur (Female)  (P)*,28.759053955668666,70.5100875791717,Female,Punjab,0,2,0,987
54,Govt. Boys High School Rukan Pur Middle Portion (Female)  (P)*,28.76276559896309,70.39076404656684,Female,Punjab,0,3,0,1467
94,Govt. Boys High School Rukan Pur Rahim Yar Khan (Male)  (P)*,28.762788252352742,70.39073492230548,Male,Punjab,2,0,1245,0
95,Govt. Boys High School Rukan Pur Rahim Yar Khan (Female)  (P)*,28.762788252352742,70.3907649223055,Female,Punjab,0,2,0,915
53,Govt. Boys High School Rukan Pur High Portion (Male)  (P)*,28.762788252352742,70.3907949223055,Male,Punjab,4,0,1981,0
90,Govt. Girls Primary School Jam Kalo Sangi Mouza Taj Pur Pir Wala (Male)  (P)*,28.76292,70.37344,Male,Punjab,4,0,1708,0
91,Rest House Taj Pur Pir Wala (Female)  (P)*,28.76638901014151,70.38863034005823,Female,Punjab,0,2,0,1239
80,Govt. Boys Primary School Kotla Rai Qabool Basti Ablani (Male)  (P)*,28.766565843804546,70.45198976961278,Male,Punjab,3,0,1445,0
88,Govt. Boys Primary School Murad Pur (Female),28.771371948979727,70.42729815632343,Female,Punjab,0,2,0,822
89,Govt. Boys Primary School Murad Pur (Male),28.771371948979727,70.4273281563234,Male,Punjab,2,0,1068,0
46,Govt. Boys Primary School Sher Muhammad Mouza Musahib Lolai,28.779285048350967,70.49788244009153,Combined,Punjab,2,2,1181,934
102,Govt. Girls Primary School Dudi Sangi Rahim Yar Khan (Female)  (P)*,28.78095,70.3656,Female,Punjab,0,3,0,1464
9,Govt. Girls Elementary School- Muhammad Khan,28.78235,70.50647,Combined,Punjab,2,1,709,671
74,Govt. Boys Primary School Khalti RYK  (P)*,28.784727159875985,70.32416251988478,Combined,Punjab,2,2,914,671
96,Govt. Boys Elementary School Qasba Rukan Pur  (Male)  (P)*,28.78503790609749,70.3962891973191,Male,Punjab,2,0,1302,0
97,Govt. Boys Elementary School Qasba Rukan Pur  (Female)  (P)*,28.78503790609749,70.3963191973191,Female,Punjab,0,2,0,855
101,Govt. Boys Primary School Dudi Sangi Rahim Yar Khan (Male)  (P)*,28.785108586185828,70.36429437520438,Male,Punjab,4,0,1868,0
98,Govt. Girls Elementary School Rukan Pur,28.78586,70.39525,Combined,Punjab,2,2,1103,826
57,Govt. Boys Elementary School Ghous Pur Machian (Male)  (P)*,28.78661229846421,70.45579736999375,Male,Punjab,2,0,1313,0
58,Govt. Boys Elementary School Ghous Pur Machian (Female)  (P)*,28.78661229846421,70.4558273699937,Female,Punjab,0,2,0,994
59,Govt. Boys Elementary School Ghous Pur Machian,28.78661229846421,70.4558573699938,Combined,Punjab,1,1,670,552
87,Govt. Girls Elementary School Bashir Ahmed Sangi Mouza Murad Pur,28.7886,70.4209,Combined,Punjab,1,1,539,435
8,Govt. Boys Elementary School Muhammad Khan,28.790191750915373,70.49577797322569,Combined,Punjab,2,1,863,707
11,Office of the Agriculture Officer Zahir Pir (P)*,28.79853117232461,70.53598583521058,Combined,Punjab,1,1,471,319
12,Govt. Rest House National High Way Zahir Pir,28.79996,70.53448,Combined,Punjab,1,1,480,425
5,Govt. Boys Primary School Chanjan Basti Lanjaran Mouza Zahir Pir (Male),28.800461908889275,70.49533817765234,Male,Punjab,3,0,1324,0
6,Govt. Boys Primary School Chanjan Basti Lanjaran Mouza Zahir Pir (Female),28.800461908889275,70.4953681776523,Female,Punjab,0,2,0,1009
10,Govt. Girls Primary School Taatar Chachar (P)*,28.802018635089876,70.54100246750025,Combined,Punjab,2,1,728,536
3,Govt. Degree College for Women- Zahir Pir,28.80257,70.52547,Combined,Punjab,2,1,707,536
13,Govt. Boys Primary School Taatar Chachar (P)*,28.803349924828012,70.53865079376187,Combined,Punjab,2,1,907,742
61,Govt. Girls Primary School Basti Allah Bux Gopang (Female)  (P)*,28.803873077597533,70.4082365607661,Female,Punjab,0,2,0,1168
84,Govt. Girls Elementary School Missan Abad (Female)  (P)*,28.808237291709727,70.46813387177012,Female,Punjab,0,3,0,1424
85,Govt. Boys Elementary School Tail Panjnad (P)*,28.808245974402038,70.44319148843404,Combined,Punjab,2,1,854,582
86,Govt. Boys Elementary School Tail Panjnad (P)*,28.808245974402038,70.443221488434,Combined,Punjab,2,1,779,521
4,Govt. Girls Higher Secondary School- Zahir Pir (P)*,28.80843642467285,70.52202244132758,Combined,Punjab,2,1,854,641
1,Govt. Girls Higher Secondary School- Zahir Pir,28.808497812418288,70.52205057801338,Combined,Punjab,2,1,822,607
19,Govt. Veterinary Hospital Zahir Pir (P)*,28.809634487057995,70.52420303241671,Combined,Punjab,2,1,837,628
16,Govt. Vocational Training Center- Zahir Pir (Female)  (P)*,28.810088630969627,70.52450602966162,Female,Punjab,0,2,0,1253
17,Govt. Vocational Training Center- Zahir Pir (P)*,28.810088630969627,70.5245360296616,Combined,Punjab,1,1,622,433
15,Govt. Vocational Training Center- Zahir Pir (Male)  (P)*,28.81010566069772,70.5244952784177,Male,Punjab,3,0,1555,0
14,Govt. Boys Higher secondary  School Zahir Pir (Primary Portion) (P)*,28.81015615052071,70.52315070130996,Combined,Punjab,2,1,830,686
18,Govt. Boys Higher Secondary School (Primary Portion) Zahir Pir,28.81015615052071,70.52318070131,Combined,Punjab,1,1,726,563
82,Govt. Boys Primary School Hamid Alyani (P)*,28.81077980830226,70.49349463674417,Combined,Punjab,2,1,770,603
7,Govt. Girls Primary School- Basti Abdul Sattar Khan Mouza Zahir Pir (P)*,28.8109267200777,70.5300084693741,Combined,Punjab,2,1,908,724
63,Govt. Girls Primary School Manik (Female)  (P)*,28.811201614791468,70.42741770167801,Female,Punjab,0,2,0,1250
62,Govt. Boys Primary School Manik (Male)  (P)*,28.81125930984316,70.42763131351954,Male,Punjab,3,0,1620,0
2,Govt. Handicraft Centre Sadaat Colony Zahir Pir,28.81228,70.51654,Combined,Punjab,2,2,910,691
118,Govt. Boys Elementary School Taranda Moulvian,28.81278672373941,70.57584689629675,Combined,Punjab,2,2,1123,791
83,Govt. Boys High School Missan Abad (Male)  (P)*,28.81338396827788,70.46818914963023,Male,Punjab,4,0,1750,0
60,Govt. Boys Primary School Kachi Zaman (Male)  (P)*,28.814668722786053,70.4012587205553,Male,Punjab,4,0,1726,0
37,Govt. Girls Primary School- Basti Ghanair (P)*,28.816261451322752,70.54394856252975,Combined,Punjab,2,1,959,720
116,Govt. Girls Primary School Faiz Abad (Pai Ahna) (P)*,28.818745610775256,70.59764169645382,Combined,Punjab,2,1,779,540
115,Govt. Boys Primary School Pai Ahna,28.818865849937197,70.59151583763152,Combined,Punjab,1,1,972,722
64,Govt. Boys Primary School Haji Pur  (Male),28.822434369108755,70.44194674071468,Male,Punjab,3,0,1618,0
65,Govt. Boys Primary School Haji Pur  (Female),28.822434369108755,70.4419767407147,Female,Punjab,0,2,0,1230
117,Govt. Girls Primary School Mohalan  (P)*,28.825743556035953,70.57291114611351,Combined,Punjab,2,1,922,620
56,Govt. Boys Primary School Bahadur Pur Jadid,28.82982689730476,70.46541145604314,Combined,Punjab,2,2,1259,883
36,Govt. Girls Primary School Ghanair Qasai Da Khoo (P)*,28.829959261843907,70.56060560344444,Combined,Punjab,2,1,875,501
55,Govt. Boys Elementary School Hamid Pur,28.83254398567151,70.44723917708018,Combined,Punjab,2,2,1151,906
48,Govt. Girls Primary School Basti Abdul Majeed (P)*,28.83564893896564,70.52360820751375,Combined,Punjab,2,1,870,568
42,Govt. Boys Primary School Hasil Pur (Basti Jalal Pur) (P)*,28.8379249594427,70.4798940055448,Combined,Punjab,2,1,800,540
43,Govt. Girls Primary School Hasil Pur (Basti Jalal Pur) (P)*,28.83893685840059,70.48047192471256,Combined,Punjab,1,1,647,461
126,Govt. Girls Primary School Faridabad (P)*,28.839268274538608,70.60274772096572,Combined,Punjab,1,1,587,414
130,Govt. Boys Primary School Taranda Madhu Khan (Basti Qazi Noor Muhammad) (P)*,28.843589368153175,70.65548687426254,Combined,Punjab,1,1,637,420
131,Govt. Girls Primary School Taranda Madhu Khan (Basti Qazi Noor Muhammad) (P)*,28.843880640959913,70.65475443789806,Combined,Punjab,1,1,626,422
128,Govt. Boys Primary School Kot Shahan (Basti Chah Fattu Wala) (P)*,28.848608539687206,70.62373548023727,Combined,Punjab,2,1,966,654
33,Govt. Boys High School Ghous Pur  (P)*,28.849396333652003,70.54807154114893,Combined,Punjab,2,2,1035,630
34,Govt. Boys High School Ghous Pur (P)*,28.849396333652003,70.5481015411489,Combined,Punjab,2,1,843,586
50,Govt. Girls Primary School Chandia Basti  Ghulam Hussain Pahor (Female)  (P)*,28.85038649748427,70.50067481585853,Female,Punjab,0,2,0,1034
49,Govt. Boys Primary School Chandia (Male)  (P)*,28.85056470532682,70.50069510474884,Male,Punjab,3,0,1523,0
35,Govt. Girls Elementary School Ghous Pur (P)*,28.851390415870227,70.54759022719331,Combined,Punjab,2,1,971,654
125,Govt. Boys Primary School Mud Darbari (Basti Gadola),28.853850115913367,70.59966415198359,Combined,Punjab,2,2,1234,792
127,Govt. Girls Primary School Rashid Abad Basti Qadeem Kot Shahan (P)*,28.860893804595285,70.63963351791462,Combined,Punjab,2,1,777,489
129,Govt. Girls Primary School Ghulam Rasool Naich (P)*,28.86313001811815,70.63902436846799,Combined,Punjab,2,1,816,484
45,Govt. Girls Primary School Mughalabad Basti Karim  Bakhsh Ghaleja (Female)  (P)*,28.86751645120691,70.4801833798389,Female,Punjab,0,2,0,891
124,Govt. Girls High School Fateh Pur Kamal (Female),28.86756,70.62415,Female,Punjab,0,2,0,1106
44,Govt. Boys Primary School Basti Kaarim Bakhsh (Male)  (P)*,28.86771573964551,70.48038019301671,Male,Punjab,2,0,1234,0
25,Govt. Girls Primary School- Noor Wala- City (P)*,28.86806710762404,70.4613826025786,Combined,Punjab,1,1,677,555
32,Govt. Boys Primary School- Haider Abad (Female),28.8685835901834,70.46080379418159,Female,Punjab,0,2,0,1181
122,Govt. Boys High School Fateh Pur Kamal (Middle Portion)  (Male),28.869673996776225,70.62040639760163,Male,Punjab,3,0,1596,0
123,Govt. Boys High School Fateh Pur Kamal (Lab Portion) (P)*,28.869673996776225,70.6204363976016,Combined,Punjab,1,1,544,432
121,Govt. Boys High School Fateh Pur Kamal (High Portion) (P)*,28.869715794831215,70.62045712604652,Combined,Punjab,2,2,1169,767
31,Govt. P/S Chachran Sharif (Male),28.87341,70.4543,Male,Punjab,3,0,1565,0
26,Veterinary Hospital- Chachran Sharif (P)*,28.873866403674548,70.46257593984627,Combined,Punjab,2,1,716,563
27,Govt. Boys Secondary School Chachran Sharif Primary Portion,28.874223526664554,70.46243227597526,Combined,Punjab,2,1,839,716
28,Govt. Boys Secondary School Chachran Sharif High Portion (Male),28.874223526664554,70.4624622759753,Male,Punjab,4,0,1760,0
21,Govt. Girls Primary School Mud Adil (Female)  (P)*,28.875241438454783,70.51436972097511,Female,Punjab,0,2,0,1029
29,Govt. Girls Secondary School Chachran Sharif Middle Portion (Female),28.876033217983917,70.45588260860458,Female,Punjab,0,3,0,1439
30,Govt. Girls Secondary School Chachran Sharif High Portion,28.876033217983917,70.4559126086046,Combined,Punjab,1,1,749,539
111,Govt. Boys High School Kotli Murad (High Portion),28.884433514287,70.57889658592312,Combined,Punjab,2,1,1148,624
112,Govt. Boys High School Kotli Murad (Middle Portion),28.884433514287,70.5789265859231,Combined,Punjab,2,1,902,568
20,Govt. Boys Primary School Mud Adil (Male)  (P)*,28.89267640830717,70.50711942524347,Male,Punjab,3,0,1451,0
23,Govt. Boys Primary School Mud Adil (Basti Jam Hayat Muhammad) (P)* (Male),28.89267640830717,70.5071494252435,Male,Punjab,2,0,1320,0
114,Govt. Boys Primary School Mehboobabad  (P)*,28.893157696188965,70.55187388800637,Combined,Punjab,2,1,828,516
22,Govt. Boys Primary School Ahmed Kudan Basti Jam Ameer,28.893319436703244,70.524977542181,Combined,Punjab,2,1,881,683
24,Govt. Girls Primary School Abdullah Khan Mouza Ahmed Kudan (Female),28.89814739023168,70.53163672860542,Female,Punjab,0,2,0,1039
47,Govt. Girls Primary School Basti Abdullah Khan (P)*,28.89814739023168,70.5316667286054,Combined,Punjab,2,1,888,561
113,Govt. Boys Primary School Head Lanji War (P)*,28.89857,70.58008,Combined,Punjab,2,1,786,433
120,Govt. Boys Primary School Ghulam Muhammad Khusa (Female)  (P)*,28.90521,70.60026,Combined,Punjab,1,1,332,224
132,Govt. Boys Elementary School Samoka (P)*,28.907658295280665,70.56308322258033,Combined,Punjab,2,1,873,627
133,Govt. Girls Primary School- Samoka (P)*,28.926269608025205,70.55309816788908,Combined,Punjab,2,1,816,566
119,Govt. Boys Elementary School Nathani (Muhammad Hussain Shakir) (Male)  (P)*,28.930345364509787,70.56034286557377,Combined,Punjab,2,2,1285,756
135,Govt. Boys Elementary School Azmatullah (Basti Mukhtar Ahmed),28.940250287797298,70.59485983264807,Combined,Punjab,2,2,1154,842
134,Govt. Boys Primary School Gud Pur  (P)*,28.94689059565473,70.57562238958826,Combined,Punjab,2,1,813,588
136,Govt. Boys Primary School Thatha Dhagrocha (Basti Imam Bakhsh Jatoi) (P)*,28.992553344321315,70.61853548905705,Combined,Punjab,2,1,831,628
