StationId,PollingStation,Lat,Lng,BoothType,Province,MaleBooths,FemaleBooths,MaleVoters,FemaleVoters
109,Government Girls Primary School - Faqeer Pura- Gujranwala  (Female),32.14634,74.21615,Female,Punjab,0,4,0,2007
111,Government Boys Primary School - Faqeer Pura- Gujranwala  (Female),32.1488,74.21513,Female,Punjab,0,3,0,1704
100,Quaid Science Base High School  Kot Habibullah- Faqeer Pura- (Combined),32.15032,74.21591,Combined,Punjab,2,2,1297,1002
106,Subhan Ideal Boys Primary School - Ali Park- Gujranwala (Female),32.1524,74.21241,Female,Punjab,0,4,0,1939
104,Government MC Boys Primary School - Ali Park- Gujranwala (Female),32.15456,74.21198,Female,Punjab,0,3,0,1462
103,Modern Science High School  Private Oppisite SukhChain Wala Kashmir Road Gujrawnmala (Male),32.1561,74.21123,Male,Punjab,4,0,1972,0
101,K T Model Higher Secondary School Usman Park Farid Town- Gujranwala (Male),32.1583,74.21105,Male,Punjab,3,0,1535,0
102,K T Model Higher Secondary School Usman Park Farid Town- Gujranwala (Female),32.1583,74.21108,Female,Punjab,0,2,0,1149
107,K T Model Higher Secondary School Usman Park Farid Town- Gujranwala (Male),32.1583,74.21111,Male,Punjab,2,0,1387,0
108,K T Model Higher Secondary School Usman Park Farid Town- Gujranwala (Male),32.1583,74.21114,Male,Punjab,2,0,1247,0
110,K T Model Higher Secondary School Usman Park Farid Town- Gujranwala (Male),32.1583,74.21117,Male,Punjab,4,0,2247,0
98,Hafiz Academy High School Kashmir Road Gujranwala (Male),32.15865,74.21136,Male,Punjab,3,0,2020,0
99,Hafiz Academy High School Kashmir Road Gujranwala (Female),32.15865,74.21139,Female,Punjab,0,3,0,1694
91,Government Elementary School  for Boys- Farid Town- Gujranwala (Combined),32.15875,74.2206,Combined,Punjab,2,2,1313,990
119,Government  Girls High School  Gulzar-e- Islam (Combined ),32.16022,74.19717,Combined,Punjab,2,2,1326,1288
105,The Best Educator School System- Usman Park- Gujranwala  (Male),32.16028,74.21388,Male,Punjab,4,0,2603,0
83,Allied School Canal Campus (Male),32.1605,74.21748,Male,Punjab,3,0,1632,0
85,Allied School Canal Campus- Gujranwala (Male),32.1605,74.21751,Male,Punjab,3,0,1541,0
88,Government  Girls Elementary School  Farid Town Pasroor Road- Gujranwala (Female),32.16056,74.21483,Female,Punjab,0,3,0,1405
90,Government  Girls Elementary School  Farid Town Pasroor Road- Gujranwala (Female),32.16056,74.21486,Female,Punjab,0,4,0,1872
79,Al Mustafa School Pasroor Road Gali No.4 Butta Wali Fareed Road  (Male),32.16127,74.21329,Male,Punjab,3,0,1880,0
87,Government Modern Girls High School - Ittefaq Colony- Gujranwala (Male),32.16144,74.2094,Male,Punjab,3,0,1820,0
89,Government Modern Girls High School - Ittefaq Colony- Gujranwala (Male),32.16144,74.20943,Male,Punjab,4,0,2457,0
115,Government Boys College  Dina Nagar Road- Satellite Town- Gujranwala (Male),32.16151,74.20178,Male,Punjab,3,0,1497,0
117,Government Boys College  Dina Nagar Road- Satellite Town- Gujranwala (Male),32.16151,74.20181,Male,Punjab,2,0,1093,0
80,Tameer-e-Millat Model Girls High School Saddique Akbar Park Fareed Town Fareed Road(Female),32.16198,74.21198,Female,Punjab,0,3,0,1549
116,Government Girls Model Normal High School - Satellite Town- Gujranwala ( Female),32.16227,74.20558,Female,Punjab,0,2,0,1304
114,Government Millat High School  Satellite Town  (Combined),32.16251,74.20725,Combined,Punjab,1,1,761,725
62,Government Primary School  Gali No. 30- Popular Nursery- Gujranwala (Female),32.16399,74.20967,Female,Punjab,0,2,0,1462
93,Saint Paul High School Saleem Colony Near Upper Chanab Cannel (Female),32.16419,74.22147,Female,Punjab,0,2,0,1180
95,Saint Paul High School Saleem Colony Near Upper Chanab Cannel (Female),32.16419,74.2215,Female,Punjab,0,2,0,1311
97,Saint Paul High School Saleem Colony Near Upper Chanab Cannel (Female),32.16419,74.22153,Female,Punjab,0,2,0,1269
112,Government Girls College Satellite Town (Male),32.16463,74.19839,Male,Punjab,3,0,1558,0
84,Government Boys Primary School  Klair Sabri- Farid Town- Gujranwala (Female),32.16483,74.2126,Female,Punjab,0,2,0,1258
86,Government Boys Primary School  Klair Sabri- Farid Town- Gujranwala (Female),32.16483,74.21263,Female,Punjab,0,2,0,1193
57,St. Joseph Urdu School- Gujranwala (Male),32.16864,74.19877,Male,Punjab,2,0,1656,0
59,St. Joseph Urdu School- Gujranwala (Male),32.16864,74.1988,Male,Punjab,2,0,1020,0
77,Kins International Public School- Madinah Colony- Gujranwala (Male),32.16882,74.21483,Male,Punjab,2,0,1258,0
81,Kins International Public School- Madinah Colony- Gujranwala (Male),32.16882,74.21486,Male,Punjab,4,0,1819,0
78,Government  Boys Tamir-Nau High School Ratta Road- Gujranwala (Female),32.16943,74.21088,Female,Punjab,0,2,0,1106
82,Government  Boys Tamir-Nau High School Ratta Road- Gujranwala (Female),32.16961,74.21114,Female,Punjab,0,3,0,1513
92,Government Girls High School- Ratta Bajwa- Fareed Road Saleem colony Gujrawnala  (Male),32.16971,74.22052,Male,Punjab,2,0,1577,0
94,Government Girls High School- Ratta Bajwa- Fareed Road Saleem colony Gujrawnala  (Male),32.16971,74.22055,Male,Punjab,2,0,1739,0
96,Government Girls High School- Ratta Bajwa- Fareed Road Saleem colony Gujrawnala  (Male),32.16971,74.22058,Male,Punjab,3,0,1697,0
58,St. Joseph English School- Gujranwala (Female),32.17007,74.20001,Female,Punjab,0,2,0,1498
60,St. Joseph English School- Gujranwala (Female),32.17007,74.20004,Female,Punjab,0,2,0,889
61,Excellence College- Near Popular Nursery- Gujranwala (Male),32.17067,74.20316,Male,Punjab,2,0,1639,0
73,Government Girls Middle School  Ratta Bajwa- Gujranwala (Female),32.17081,74.22127,Female,Punjab,0,3,0,1961
74,Government Girls Middle School  Ratta Bajwa- Gujranwala (Female),32.17081,74.2213,Female,Punjab,0,3,0,1391
71,Government Boys High School  Ratta Bajwa- Gujranwala (Male),32.17094,74.22141,Male,Punjab,4,0,1946,0
72,Government Boys High School  Ratta Bajwa- Gujranwala (Male),32.17094,74.22144,Male,Punjab,4,0,2552,0
75,Falcon International School System- Shahzad Town- Gujranwala (Male),32.17137,74.21238,Male,Punjab,2,0,1415,0
76,Falcon International School System- Shahzad Town- Gujranwala (Female),32.17137,74.21241,Female,Punjab,0,2,0,1044
66,Government Syed Girls High School - Gujranwala (Female),32.17214,74.20748,Female,Punjab,0,4,0,1923
65,Government Degree College for Women- Main Tariqabad Road- Gujranwala (Male),32.17272,74.2095,Male,Punjab,4,0,2352,0
63,Sunrise Public High School - Gali No. 2- Main Bazar- Abid Colony- Gujranwala (Male),32.17303,74.20667,Male,Punjab,3,0,1501,0
64,Sunrise Public High School - Gali No. 2- Main Bazar- Abid Colony- Gujranwala (Female),32.17303,74.2067,Female,Punjab,0,2,0,1371
55,Allied Science College- Khokharki- Gujranwala (Male),32.1735,74.20014,Male,Punjab,4,0,2098,0
54,SAP School - Muqaddas Road- Gujranwala (Female),32.17427,74.20572,Female,Punjab,0,3,0,1464
56,SAP School - Muqaddas Road- Gujranwala (Female),32.17427,74.20575,Female,Punjab,0,4,0,1807
53,Zenab Memorial Government Girls Elementary School  Sahran Street- Khokhrki Sialkot Road- Gujranwala (Male),32.17667,74.20361,Male,Punjab,3,0,1656,0
8,Dar-Arqam School main Commissioner Road (Female),32.17731,74.19682,Female,Punjab,0,3,0,1795
45,The Message School of Quality Training Hamilton Road Gujranwala (Male),32.17866,74.19899,Male,Punjab,2,0,1384,0
42,Allied School- DC road Campus- Kacha Fattomand Road- Gujranwala (Combined),32.17929,74.19801,Combined,Punjab,2,2,1285,1049
7,Allied School- DC Road Campus Kacha Fatoomand Road- Gujranwala (Male),32.17929,74.19804,Male,Punjab,4,0,2103,0
26,Jadeed Dastgir High School- Jinnah Road Campus- Gujranwala (Male),32.17986,74.1935,Male,Punjab,3,0,1798,0
27,Jadeed Dastgir High School- Jinnah Road Campus- Gujranwala (Female),32.17986,74.19353,Female,Punjab,0,3,0,1449
46,Apex Science School and Academy- Ghazi street Gala Agency Tail wala (Female),32.18056,74.19945,Female,Punjab,0,2,0,1271
67,Gohriya Educational High School (Branch-1)- Main Bazar- Raja Colony- Gujranwala (Male),32.18079,74.21119,Male,Punjab,3,0,1847,0
68,Khadija Ideal High School - Gujranwala (Female),32.18098,74.21666,Female,Punjab,0,3,0,1439
70,Khadija Ideal High School - Gujranwala (Female),32.18098,74.21669,Female,Punjab,0,3,0,1641
69,Gohriya Educational High School (Branch-2)- Main Bazar No. 03- Raja Colony- Gujranwala (Male),32.18122,74.21183,Male,Punjab,4,0,2103,0
41,The Paramount School Gali Tail wali Agency Sialkot Road Gujranwala (IPS) (Female),32.18139,74.20389,Female,Punjab,0,3,0,1122
44,Concept School Gala Idrees Thanaydar Butt wala Noor Pura (Female),32.18222,74.20361,Female,Punjab,0,3,0,1641
5,AMTS Agricultural Machinery Training School Near DC Road (Male),32.18322,74.18338,Male,Punjab,2,0,1342,0
6,AMTS Agricultural Machinery Training School Near DC Road (Female),32.18322,74.18341,Female,Punjab,0,2,0,1295
48,Faisal Hamad School Street Aray Wali- Bheekhopura Gujranwala (Female),32.18472,74.20499,Female,Punjab,0,3,0,1421
43,Guideline Public School Sialkot Road Gujranwala (Male),32.18556,74.20722,Male,Punjab,3,0,1761,0
10,JADEED DASTAGIR SCHOOL- DC ROAD Gujranwala (Male) (Junior Campus),32.18575,74.19276,Male,Punjab,3,0,1501,0
11,JADEED DASTAGIR SCHOOL- DC ROAD Gujranwala (Female) (Junior Campus),32.18575,74.19279,Female,Punjab,0,2,0,1304
12,JADEED DASTAGIR SCHOOL- DC ROAD Gujranwala  (Junior Campus) (Combined),32.18575,74.19282,Combined,Punjab,2,2,1260,1069
51,Government Girls Primary School  Fattomand (Male),32.18611,74.20361,Male,Punjab,2,0,1683,0
52,Government Girls Primary School  Fattomand (Female),32.18611,74.20364,Female,Punjab,0,2,0,1384
47,Greenz Colleges- Sialkot Road- Near Mama Gee Hotel Fattomand Gujranwala (Male),32.18639,74.20833,Male,Punjab,3,0,1752,0
1,Quid e Azam Divisional Public School- Gujranwala (Senior Portion) (Male),32.18702,74.18287,Male,Punjab,4,0,2446,0
2,Quid e Azam Divisional Public School- Gujranwala (Senior Portion) (Female),32.18702,74.1829,Female,Punjab,0,4,0,1959
3,Quid e Azam Divisional Public School- Gujranwala (College Portion) (Male),32.18702,74.18293,Male,Punjab,3,0,1570,0
4,Quid e Azam Divisional Public School- Gujranwala (College Portion) (Female),32.18702,74.18296,Female,Punjab,0,3,0,1434
16,Government  Girls High School  Bheekopura- Kacha Fatomand (Male),32.18722,74.20499,Male,Punjab,4,0,2752,0
17,Government  Girls High School  Bheekopura- Kacha Fatomand (Female),32.18722,74.20502,Female,Punjab,0,4,0,2307
14,Pakistan School National Town(Male),32.18889,74.20444,Male,Punjab,4,0,2075,0
15,Pakistan School National Town(Female),32.18889,74.20447,Female,Punjab,0,3,0,1540
22,Government .FD Model High School For Boys- Fatomand (Combined),32.19028,74.20083,Combined,Punjab,2,2,1305,961
23,Government .FD Model High School For Boys- Fatomand (Male),32.19028,74.20086,Male,Punjab,4,0,2004,0
24,Government .FD Model High School For Boys- Fatomand (Female),32.19028,74.20089,Female,Punjab,0,3,0,1617
9,Government Girls Primary School  Usman Colony (Combined),32.19139,74.20694,Combined,Punjab,2,2,1143,937
49,Islamic Vision School System- Kacha Fatomand Road Mafiwala. (Male),32.19361,74.20305,Male,Punjab,3,0,1659,0
50,Islamic Vision School System- Kacha Fatomand Road Mafiwala..(Female),32.19361,74.20308,Female,Punjab,0,2,0,1326
13,The Oxford School of Science  Bazar Zaheer Malik wala Sialkot Bypass (Combined),32.19493,74.20977,Combined,Punjab,2,2,1736,1249
19,Al Badar Girls High School Zaheer Colony Sialkot By Pass  (Female),32.1953,74.21351,Female,Punjab,0,2,0,843
40,Green Land Public School Mohala Ali Abad Sialkot Bypass Road Gujranwala  (Male),32.19627,74.20813,Male,Punjab,3,0,1321,0
18,Government Special Education Center Mohallah Alia Abad Sialkot Bypass (Male),32.19861,74.20833,Male,Punjab,4,0,1140,0
20,Punjab Group of College Near Garden Town Gujranwala (Male),32.20301,74.20116,Male,Punjab,4,0,2042,0
21,Punjab Group of College Near Garden Town Gujranwala (Female),32.20301,74.20119,Female,Punjab,0,3,0,1480
25,Board of Intermediate & Secondary Education- (Combined),32.20313,74.18842,Combined,Punjab,2,2,1092,926
28,Board of Intermediate & Secondary Education- (Male),32.20313,74.18845,Male,Punjab,4,0,2217,0
29,Board of Intermediate & Secondary Education- (Female),32.20313,74.18848,Female,Punjab,0,4,0,1773
30,Board of Intermediate & Secondary Education- (Male),32.20313,74.18851,Male,Punjab,3,0,1868,0
31,Board of Intermediate & Secondary Education- (Female),32.20313,74.18854,Female,Punjab,0,3,0,1490
39,Chenab College of Engineering and Techonology Opp: BISE Gujranwala (Combined),32.20327,74.18921,Combined,Punjab,2,2,1116,875
38,GIFT University- Lohianwala (Combined),32.20327,74.19268,Combined,Punjab,2,2,1151,866
36,PIPS School & College Lohianwala Bypass Road Gujranwala (Male),32.20333,74.18995,Male,Punjab,3,0,1791,0
37,PIPS School & College Lohianwala Bypass Road Gujranwala (Female),32.20333,74.18998,Female,Punjab,0,3,0,1378
33,Government Girls High School  Lohianwala (Female),32.20638,74.18244,Female,Punjab,0,2,0,1556
35,Government Girls High School  Lohianwala (Female),32.20638,74.18247,Female,Punjab,0,2,0,1270
32,Government .Boys High School  Lohianwala (Male),32.20826,74.18363,Male,Punjab,4,0,1995,0
34,Government .Boys High School  Lohianwala (Male),32.20826,74.18366,Male,Punjab,3,0,1617,0
