StationId,PollingStation,Lat,Lng,BoothType,Province,MaleBooths,FemaleBooths,MaleVoters,FemaleVoters
82,Government Primary School- Rajay (Combined),28.27512,62.66552,Combined,Balochistan,1,1,444,191
81,Government Primary School Gowalishtab (Combined),28.31068,62.73368,Combined,Balochistan,2,1,617,267
80,Government Primary School- Essa Tahir (Combined),28.59722,63.06662,Combined,Balochistan,1,1,155,134
87,Government Boys Primary School Killi Malik Khuda-e-Nazar Talab (Combined),28.63138,61.84458,Combined,Balochistan,1,1,851,429
31,Government Boys High School- Yak Mach (Male),28.74299,63.84766,Male,Balochistan,2,0,1098,0
32,Government Primary School- Yak Mach (Female),28.74938,63.84612,Female,Balochistan,0,1,0,867
26,Government Primary School- Jujki (Combined),28.79099,64.02032,Combined,Balochistan,1,1,652,523
74,Government Girls Middle School-Shair Abad Nokundi (Combined),28.81891,62.75476,Combined,Balochistan,1,1,159,148
76,Government Girls Pirmary School- Killi Gharibabad Nokundi (Female),28.82056,62.755,Female,Balochistan,0,2,0,1028
75,Government Boys High School- Gharibabad Nokundi (Male),28.82264,62.75213,Male,Balochistan,2,0,1324,0
38,Government Primary School- Killi Siachang (Combined),28.82495,64.65339,Combined,Balochistan,1,1,351,241
72,Government Girls High School- Nokundi (Male),28.82764,62.74199,Male,Balochistan,2,0,988,0
70,Government Boys High School- Nokundi (Male),28.82845,62.74526,Male,Balochistan,3,0,1547,0
71,Governament Girls Primary School- Mashriqi Bazar Nokundi (Female),28.82849,62.74761,Female,Balochistan,0,2,0,1268
73,Government Girls Primary School-Killi Custom Nokundi (Female),28.82889,62.73583,Female,Balochistan,0,2,0,842
21,Government Boys Pirmary School- Nawar (Combined),28.83096,64.55969,Combined,Balochistan,1,1,221,191
7,Government Boys Pirmary School- Killi Baz Muhammad (Male),28.87971,64.40325,Male,Balochistan,2,0,1098,0
9,Government Boys Middle School Killi Noor Bakhsh (Male),28.88,64.4046,Male,Balochistan,2,0,806,0
10,Government Girls Pirmary School- Killi Noor Bakhsh (Female),28.88068,64.40179,Female,Balochistan,0,2,0,673
6,Government Girls Middle School Killi Khan Jan (Female),28.88185,64.41199,Female,Balochistan,0,1,0,783
4,Government Boys Pirmary School- Killi Khan Jan (Male),28.88204,64.40904,Male,Balochistan,2,0,1001,0
8,Agriculture Office-Killi Baz Muhammad (Female),28.88454,64.40369,Female,Balochistan,0,1,0,892
5,Government Girls High School Dalbandin (Female),28.88536,64.40536,Female,Balochistan,0,2,0,921
3,Government Boys High School Dalbandin (Male),28.88539,64.40255,Male,Balochistan,2,0,1127,0
67,Improvised- Killi Muhammad Naseer Kalag (Combined),28.88768,64.40802,Combined,Balochistan,1,1,783,529
20,Government Girls Middle School- Killi Kohi Khan (Combined),28.88775,64.42458,Combined,Balochistan,1,1,450,351
2,Government Girls Middle School Killi Khuda-e-Rahim (Female),28.88802,64.41668,Female,Balochistan,0,2,0,1144
19,Government Boys Middle School- Killi Khuda Bakhsh (Combined),28.8883,64.41924,Combined,Balochistan,1,1,745,560
1,Government Boys High School Killi Khuda-e-Rahim Dalbandin (Male),28.88893,64.41503,Male,Balochistan,2,0,1436,0
11,Government Boys Pirmary School- Killi Sirdar Hashim Khan (Male),28.8933,64.40245,Male,Balochistan,2,0,1245,0
18,Government Girls Middle School- Killi Rasool Bakhsh Sumalani Dalbandin (Female),28.89333,64.41158,Female,Balochistan,0,2,0,1201
17,Government Boys High School- Killi Rasool Bakhsh Sumalani Dalbandin (Male),28.89421,64.41199,Male,Balochistan,2,0,1543,0
12,Government Girls Pirmary School- Killi Sirdar Hashim Khan (Male),28.89448,64.40126,Male,Balochistan,2,0,1239,0
36,Government High School- Che-ater (Combined),28.89594,64.91486,Combined,Balochistan,1,1,452,348
16,Government Girls Middle School- Killi Qasim Khan Dalbandin (Female),28.89633,64.40044,Female,Balochistan,0,2,0,837
37,Governmnent Boys Primary School- Malik Muhammad Azam Kunark (Combined),28.89721,64.95053,Combined,Balochistan,1,1,665,492
15,Government Boys High School- Killi Qasim Khan Dalbandin (Male),28.89857,64.40133,Male,Balochistan,2,0,1147,0
14,Government Girls High School- Faisal Colony Dalbandin (Female),28.90108,64.39753,Female,Balochistan,0,2,0,956
39,Government Boys Middle School- Killi Janu Khan (Mazang) Bazgaz (Combined),28.91949,64.8188,Combined,Balochistan,1,1,787,540
35,Government Boys Primary School- Killi Sirdar Alam Charsar (Combined),28.93641,65.06261,Combined,Balochistan,1,1,675,472
85,Government Boys Primary School Killi Sirdar Abdul Rahim Khalji (Male),28.94056,61.58305,Male,Balochistan,1,0,608,0
27,Government Middle School- Killi Ayub Kanni (Combined),28.94067,64.24052,Combined,Balochistan,1,1,374,266
22,Government Middle School- Pishuk (Combined),28.94255,64.6123,Combined,Balochistan,1,1,371,273
29,Government Girls High School- Sergaisha (Female),28.95043,64.38041,Female,Balochistan,0,1,0,853
28,Government Boys Middle School- Sergaisha (Male),28.95282,64.3848,Male,Balochistan,2,0,1201,0
86,Goverrnmnet High School Taftan Station (Combined),28.95406,61.58492,Combined,Balochistan,2,1,845,502
23,Government Pirmary School- Karuduk Killi Madad Khan (Combined),28.95973,64.68523,Combined,Balochistan,1,1,463,346
66,Government Primary School- Mirohi (Combined),28.96454,63.75251,Combined,Balochistan,1,1,350,282
84,B&rR Rest House- Taftan (Combined),28.97746,61.55337,Combined,Balochistan,2,1,820,776
33,Government Middle Shcool- Killi Khuda Bakhsh Khushkeen Nali (Combined),28.98205,65.22291,Combined,Balochistan,1,1,663,455
68,Government Primary School- Killi Malik Abdul Rehman (Mir Khan Chah Mirohi Drigwan (Combined),28.99102,63.64883,Combined,Balochistan,1,1,260,185
69,Government Middle School- Killi Muhammad Murad Gat (Combined),28.99211,63.57457,Combined,Balochistan,1,1,274,213
34,UC Office- Padag Sang Band (Combined),29.00345,65.31717,Combined,Balochistan,1,1,608,352
79,Government Primary School Mashkicha (Combined),29.00496,62.46074,Combined,Balochistan,1,1,368,279
24,Government Boys High School- Pat Ganoko (Combined),29.02577,64.01293,Combined,Balochistan,1,1,436,330
25,Government Boys Primary School- Chalghazi (Combined),29.10736,64.17763,Combined,Balochistan,1,1,800,553
55,Government Boys High School- Amin Abad (Combined),29.14042,64.69756,Combined,Balochistan,1,1,702,536
77,Government Primary School-  Julli (Combined),29.14188,63.34486,Combined,Balochistan,1,1,163,144
56,Government Boys Primary School- Killi Haji Zakria Aminabad (Combined),29.14855,64.71397,Combined,Balochistan,1,1,518,363
65,Government Primary School- Johar Kareez (Combined),29.17691,63.59093,Combined,Balochistan,1,1,207,177
61,Improvised Hu- Killi Mohim Khan (Combined),29.21483,64.69416,Combined,Balochistan,1,1,727,431
57,Government Boys Primary School-Killi Roshan Ali Bag Shah Salar (Combined),29.21527,64.69294,Combined,Balochistan,1,1,665,390
64,Government Middle School- Amri (Combined),29.2459,63.62578,Combined,Balochistan,1,1,827,503
30,Government Primary School- Posti (Combined),29.24845,64.27816,Combined,Balochistan,1,1,643,395
88,Government Primary School Sandak- Killi Khawasti (Combined),29.26567,61.56277,Combined,Balochistan,1,1,578,438
54,Government Boys Middle School- Killi Shadishaif (Combined),29.26977,64.68978,Combined,Balochistan,1,1,619,416
53,Government Primary School- Killi Haji Kochal Khan (Combined),29.28527,64.67165,Combined,Balochistan,1,1,556,332
52,Government Boys Primary School- Killi Nadir Abad (Combined),29.29717,64.67487,Combined,Balochistan,1,1,667,457
41,Govenment Boys Primary School- Killa Kurd (Combined),29.2998,64.31198,Combined,Balochistan,1,1,559,283
78,Government Primary School-Sirdar Khuda Bakhsh Sherzai (Combined),29.30075,63.53534,Combined,Balochistan,1,1,419,322
51,Government Boys High School- Dashat Goran (Combined),29.31272,64.67921,Combined,Balochistan,1,1,668,444
42,Government Primary School- Dognan (Combined),29.32217,64.44373,Combined,Balochistan,1,1,914,455
50,Government Girls Primary School- Killi Sakhi Pir Muhammad (Female),29.34488,64.6943,Female,Balochistan,0,2,0,1622
49,Government Primary School- Killi Saeed Abad (Male),29.34496,64.67168,Male,Balochistan,2,0,1340,0
48,Government Boys Middle School- Killi Sakhi Pir Muhammad (Male),29.34684,64.69409,Male,Balochistan,2,0,1284,0
83,Government Primary School Dewanag (Combined),29.34845,63.31717,Combined,Balochistan,1,1,328,295
47,Government Boys High School- Padagi Lashkar Khan (Combined),29.35208,64.69904,Combined,Balochistan,2,1,1004,764
43,Government Primary School-Lajay Kareez (Combined),29.35763,64.71232,Combined,Balochistan,1,1,1009,253
44,Government Primary School- Killi Nok Abad (Combiend),29.37421,64.71342,Combined,Balochistan,1,1,562,806
59,Vitnery Dispensary- Killi Mustafa (Combined),29.38246,64.06197,Combined,Balochistan,1,1,1005,560
40,Government Primary School- Ziarat Balanosh (Combined),29.38534,64.55505,Combined,Balochistan,1,1,580,369
58,Government Boys Primary School- Killi Barab Chah (Combined),29.39041,64.00996,Combined,Balochistan,1,1,1146,668
60,Government Primary School- Suleh Kareez (Combined),29.42207,63.72791,Combined,Balochistan,1,1,499,324
63,Vitnery Dispansary-Killi Muhammad Anwar Patkok (Combined),29.44845,63.38493,Combined,Balochistan,1,1,839,552
62,Government Primary School-Killi Shahbaz Khan Patkok (Combined),29.45665,63.37475,Combined,Balochistan,1,1,346,260
45,Government Primary School- Killi Gul Muhammad Lashkarab (Combined),29.47425,64.758,Combined,Balochistan,1,1,906,559
89,Government Primary School- Killi Abdullah Jan Kachao (Combined),29.50972,61.25917,Combined,Balochistan,1,1,333,208
46,Government Primary School- Killi Haji Muhammad Nalap (Combined),29.5464,64.80098,Combined,Balochistan,1,1,723,403
