SerialId,PollingStation,UC,CensusBlock,VotersSerial,MaleVoters,FemaleVoters,TotalVoters,MaleBooths,FemaleBooths,TotalBooths
,,KHAWAR TOWN* REHMAN VILLAS,071060702,1-436 B-2,436,0,436,,,
,,NAIZ PARK KHAWAR TOWN,071060703,1-340 B-3,340,0,340,,,
,,GHOUSIA PARK* NIAZ PARK,071060704,1-666 B-4,666,0,666,,,
217,GOVT PRIMARY SCHOOL* REHMAT PUREA BAIDIAN ROAD LAHORE CANTT.(FEMALE),BHUTTA CHOWK GHOUSIA PARK,071060701,1-144 B-1,0,144,144,,4,4
,,KHAWAR TOWN REHMAN VILLAS,071060702,1-372 B-2,0,372,372,,,
,,NAIZ PARK KHAWAR ,071060703,1-224 B-3,0,224,224,,,
,,GHOUSIA PARK NIAZ PARK,071060704,1-550 B-4,0,550,550,,,
218,AL WARIS ACADEMY NAIDR ABAD BAIDIAN ROAD LAHORE CANTT.(COMBINED),CHOUNG BHAIDAIN ROAD,071060705,1-517 M  B-1,517,0,517,1,1,2
,,CHOUNG BAIDAIN ROAD,071060705,1-414-F B-2,0,414,414,,,
219,PAKISTAN FOUNDATION HIGH SCHOOL E/675 ST NO. 2 SITTARA COLONY NO 01 CHOUNGI AMAR SIDHU LAHORE,SITTAR COLONY AMAR SIDHU,071060801,1-466 M B-1,466,0,466,1,1,2
,CANTT.(COMBINED),SITTAR COLONY AMAR SIDHU,071060801,1-246 F,0,246,246,,,
,,SITTARA COLONY AMAR SIDHU,071060804,1-238 M 1-45 F B-2,238,0,238,,,
,,SITTARA COLONY AMAR SIDHU,071060804,-,,145,145,,,
220,DIVISIONAL MODEL PUBLIC HIGH SCHOOL GHAZI ROAD LAHORE CANTT. MALE,MEHBOOL COLONY / SITTARA COLONY,071060802,1-586 B-1,586,0,586,1,1,2
,,MEHBOOB COLONY MUHAMMAD PURA,071060803,1-443 B-2,443,0,443,,,
221,DIVISIONAL MODEL PUBLIC HIGH SCHOOL GHAZI ROAD LAHORE CANTT. FEMALE,MEHBOOB COLONY / SITTARA COLONY,071060802,1-379 B-1,0,379,379,0,2,2
,,MEHBOOB COLONY MUHAMAD PURA,071060803,1-447 B-2,0,447,447,,,
222,GOVE ELEMENTARY SCHOOL BOWLI CAMP LAHORE CANTT MALE,DERA MANDI DEFENCE,071070101  1-530 B-2,-,350,0,350,3,0,3
,,SARDAR COLONY MUHAMMADI COLONY,071070102  1-587 B-2,-,587,0,587,,,
,,PATHAWALI GALI GHAZI ROAD,071070103  1-595 B-3,-,595,0,595,,,
223,GOVT ELEMENTARY SCHOOL BOWH CAMP LAHREO CANTT.FEMALE,DERA MANDI DEFENCE,071070101,1-303 B-1,0,303,303,0,3,3
,,SARDDAR COLONY MUHAMMADI COLONY,071070102,1-374 B-2,0,374,374,,,
,,BAU WALA EAST BARKI ROAD,071070103,1-449 B-3,0,449,449,,,
224,GOVT COMMUNITY SCHOOL CHOUNG KHURD LAHORE CANTT.(COMBINED),RAU WALA WEST BARKI ROAD,071070104,1-541 M B-1,541,0,541,1,1,2
,,DOGRAI KHURDK BARKI ROAD,071070105,1-122 M B-2,122,0,122,,,
,,DOGRAI KHURD BARKI ROAD,071070105,1-113 F,0,113,113,,,
225,GOVT PRIMARY SCHOOL SEHJPAL LAHORE CANTT MALE,SAJPAL BHATTA CHOWK,071070201  1-446 B-1,-,446,0,446,2,0,2
,,GOHAWA BAIDIAN ROAD,071070202  1-776 B-2,-,776,0,776,,,
226,GOVT PRIMARY SCHOOL SEHJPAL LAHORE CANTT. FEMALE,SAJPAL BHATTA CHOWK,071070201  1-273B-1,-,0,273,273,0,2,2
,,GOHAWA BAIDIAN ROAD,071070202  1-602 B-2,-,0,602,602,,,
227,GOVT PRIAMRY SCHOOL SEHJPAL ALHRE CANTT.(COMBINED),SAJPAL DEFENCE ROAD,071070203  1-552 M B-1,-,552,0,552,1,1,2
,,SAJPAL DEFENCE ROAD,071070203  1-364 F,-,0,364,364,,,
,,NAI ABADI GOHAWA,071070204  1-156-M B-2,-,156,0,156,,,
,,NAI ABADI GOHAWA,071070204  1-98 F,-,0,98,98,,,
228,AL NOOR GIRLS HIGH SCHOOL HAJI PARK BAIDAIN ROAD* LAHROE CANTT MALE,BHATTA CHOWK KHURDA BUX COL.,071070301,1-161 B-1,616,0,616,2,0,2
,,BHUTTA KOHARR,071070302,1-545 B-2,545,0,545,,,
229,AL NOOR GIRLS HIGH SCHOL HAJI PARK BAIDAIN ROAD LAHORE CANTT.FEMALE,BHATTA CHOWK KHUDA BOX COL.,071070301,1-681 B-1,0,681,681,0,2,2
,,BHUTTA KOHARR,071070302,1-323 B-2,0,323,323,,,
230,TIPU SULTAN PUBLIC HIGH SCHOOL KASHIF COLONY BADIAN ROAD LAHROE,NAI ABADI GOHAWA,071070303,1-655 B-1,655,0,655,3,0,3
,CANTT.MALE,NAI ABADI GOHAWA,071070303,656-1403 B-2,748,0,748,,,
,,MADINA PARK GOHAWA,071070305,1-448 B-3,448,0,448,,,
231,TUPU SULTAN PUBLIC HIGH SCHOOL KASHIF COLONY BADIAN ROAD LAHROE CANTT.,NAI ABADI GOHAWA,071070303,1-861 B-1,0,861,861,0,2,2
,FEMALE,MADIAN PARK GOHAWA,071070305,1-265 B-2,0,265,265,,,
232,MUBEEN SCHOOL 200METRES FROM MANWAL STOP BAIDAN ROAD LAHORE CANTT.(COMBINED),HAJI PARK REHMAT PUREA BADIAN ROAD,071070304,1-854M B-1,854,0,854,1,1,2
,,HAJI PARK REHMAT PUREA BADIAN ROAD,071070304,1-504 F B-2,0,504,504,,,
233,GOVT PRIMARY SCHOOL JINDRA KHURD LAHROE CANTT.MALE,MALIK PURA QASIM PURA,071070401,1-285 B-1,285,0,285,2,,2
,,MALIK PURA JUGGIAN ALFA,071070402,1-369 B-2,369,0,369,,,
234,GOVT PRIMARY SCHOOL JINDRA KHURD LAHORE CANTT.FEMALE,MALIK PURA* QASIM PURA,071070401,1-204-B-1,0,204,204,0,2,2
,,MALIK PURA* JUGGIAN ALFA,071070402,1-164-B-2,0,164,164,,,
235,APOSTOLIC GRAMMER SECONDERY SCHOOL NEAR,DARG PURA,071070403,1-238 M B-1,238,0,238,1,1,2
236,GOVT BOYS PRIMARY SCHOOL GOHAWA* LAHORE CANTT.MALE,JUGGIAN ALFA GHOUSIA COL.,071070501,1-319-B-1,319,0,319,3,0,3
,,EID GAH GOHAWA,071070502,1-592 B-2,592,0,592,,,
,,CHACHO WALI KALAN,071070503,1-298 B-3,298,0,298,,,
237,GOVT BOYS PRIMARY SCHOOL BOHAWA LAHORE CANTT.FEMALE,JUGGIAN ALFA* GHOSIA COL.,071070501,1-276- B-1,0,276,276,0,,0
,,EID GAH GOHAWA,071070502,1-386 B-2,0,386,386,,,
,,CHACHO WALI KALAN,071070503,1-192 B-3,0,192,192,,,
238,GOVT PRIMARY SCHOOL JINDRAN KHURD COMMUNITY KNOWN AS JINDRAN DAIRY NEAR BARKI ROAD LAHORE CANTT.(COMBINED),JUNDRAN KALAN JALLARAN PEER BUKHSH,071070504  1-483 M B 1,-,483,0,483,1,1,2
,,JUNDRAN KALAN JALLARAN PEER BUKHSH,071070504  1-336 F B 2,-,0,336,336,,,
239,MOBEEN SCHOOL 2 METERS FROM MANAWALA STOP GARIDIAN ROAD LAHORE CANTT.MALE,GHOUSIA COLONY GOHAWA,071070601  1-726 B-1,-,726,0,726,2,0,2
,,CHACHO WALI KHURD,071070604  1-265 B 2,-,265,0,265,,,
240,MOBEEN STATION 2 METERS FROM MANAWALA STOP BAIDIAN ROAD LAHORE CANTT.FEMALE,GHOUSIA COLONY GOHAWA,071070601,1-540 B-1,0,540,540,0,2,2
,,CHACHO WALI KHURD,071070604,1-184 B-2,0,184,184,,,
241,MOBEEN SCHOOL 2 METERSD FORM MANAWAL STOP BAIDIAN ROAD LAHROE CANTT.MALE,FAZAL PARK ISMAIL PARK,071070602  1---994 B-1,-,994,,994,2,0,2
,,MANAWALA STOP,071070603  1---439 B-2,-,439,,439,,,
242,MOBEEN SCHOOL 2 METERS FROM MANAWAL STOP BAIDIAN ROAD LAHORE CANTT.FEMALE.,FAZAL PARK ISMAIL PURA,071070602  1---644 B-1,-,,644,644,0,2,2
,,NANAWALSTOP,071070603  1---172 B-2,-,,172,172,,,
