StationId,PollingStation,Lat,Lng,BoothType,Province,MaleBooths,FemaleBooths,MaleVoters,FemaleVoters
38,Government Girls Middle School Muhammad Khan Magsi (Female),26.03197,68.32784,Female,Sindh,0,3,0,1102
40,Government Boys Primary School Naqur (Combined),26.05003,68.29944,Combined,Sindh,2,2,659,528
39,Government Boys Primary School Mitho Banglani (Combined),26.05724,68.3271,Combined,Sindh,2,2,446,427
78,Government Boys High  School Sabu Rahu (Comb),26.05991,68.32718,Combined,Sindh,2,2,775,689
77,Government Girls High School Sabu Rahu (Comb),26.06027,68.32935,Combined,Sindh,2,2,620,497
44,Government Boys Primary School Morio Lakho (Male),26.07489,68.25111,Male,Sindh,4,0,1308,0
76,Government Girls Primary School Dildar Abad (Female),26.07507,68.32694,Female,Sindh,0,3,0,960
43,Government Girls Community Centre Morio Lakho (Female),26.07588,68.24873,Female,Sindh,0,3,0,1084
75,Government Boys Primary School Dildar Abad (Male),26.07598,68.32672,Male,Sindh,3,0,1045,0
52,Government Boys High School Shah Inayat (Combined),26.07751,68.44848,Combined,Sindh,2,2,609,529
53,Government Boys Primary School Shah Inayat (Combined),26.07753,68.44848,Combined,Sindh,1,1,410,322
41,Government Boys Primary School Punhon Ghodaro (Male),26.08008,68.26439,Male,Sindh,3,0,898,0
42,Government Boys Middle  School Azizabad (Female),26.08156,68.26727,Female,Sindh,0,2,0,715
139,Government Boys Primary School Mari Sabqi (Male),26.0835,68.18331,Male,Sindh,2,0,670,0
131,Government Boys Primary School New Mari Jalbani (Combined),26.08376,68.19964,Combined,Sindh,2,2,425,434
138,Government Boys High School Mari Jalbani (Combined),26.08391,68.20745,Combined,Sindh,1,1,404,398
132,Government Boys Primary School Mari Jalbani (Combined),26.0841,68.20068,Combined,Sindh,2,2,483,508
134,Government Girls Middle School Mari Jalbani (Combined),26.08489,68.19782,Combined,Sindh,1,1,349,363
50,Government Boys Primary School Samo Magsi (Combined),26.08553,68.45481,Combined,Sindh,1,1,334,297
140,Government Girls Middle School Mari Sabqi (Female),26.08657,68.18686,Female,Sindh,0,2,0,641
45,Government Boys Primary School Mahmood Keerio (Combined),26.09621,68.28173,Combined,Sindh,2,2,662,586
121,Government Girls High School Mehrabpur (Female),26.09629,68.14886,Female,Sindh,0,3,0,864
119,Government Girls Primary School Mehrabpur (Female),26.09663,68.14866,Female,Sindh,0,2,0,501
116,Government Boys Primary School Ladho Chandio (Combined),26.0971,68.17335,Combined,Sindh,2,2,537,428
51,Government Boys Primary School Iban-ja-Unar (Combined),26.0993,68.461,Combined,Sindh,2,2,701,572
122,Government Boys Higher Secondary School Syed Shabbir Ahmed Shah Mehrab Pur (Male),26.10095,68.15103,Male,Sindh,2,0,882,0
120,Government Boys Primary School Mehrabpur (Male),26.10122,68.15003,Male,Sindh,2,0,543,0
123,Government Boys Primary School Bajhi Chandio (Combined),26.1014,68.16628,Combined,Sindh,2,2,530,504
36,Government Girls Community Model School Jam Khan Laghari (Combined),26.1015,68.315,Combined,Sindh,2,2,511,467
67,Government Boys Primary School Pyaro Jamali (Combined),26.10381,68.3605,Combined,Sindh,2,2,563,571
35,Government Boys Primary School Muhallah Faqeer Khaskheli (Combined),26.10515,68.31021,Combined,Sindh,1,1,425,378
48,Basic Health Unit Karam Jamali (Female),26.10842,68.4473,Female,Sindh,0,2,0,633
47,Government Boys Middle School Karam Jamali  (Male),26.10847,68.44713,Male,Sindh,2,0,611,0
34,Government Boys Primary School Batho (New) (Combined),26.11418,68.41966,Combined,Sindh,1,1,331,322
55,Government Boys Elementary School Allah Rakhio Jamali (Combined),26.11418,68.41969,Combined,Sindh,2,2,674,569
71,Government Boys Primary School Nadir Jamali (Combined),26.11525,68.34956,Combined,Sindh,1,2,382,426
137,Government Boys Primary School Rahmoo Keerio (Combined),26.11564,68.22906,Combined,Sindh,2,2,660,573
57,Government Boys High School Mehar Ali Jamali (Female),26.11579,68.39799,Female,Sindh,0,3,0,958
56,Government Boys Primary School Mehar Ali Jamali (Old) (Male),26.11588,68.39916,Male,Sindh,3,0,982,0
54,Government Girls Elementary School Mehar Ali Jamali   (Combined),26.1176,68.40367,Combined,Sindh,2,2,529,543
74,Government Girls Primary School Adam Brohi (Female),26.11941,68.36958,Female,Sindh,0,2,0,711
70,Government Boys Primary School Nabi Bux Khaskheli (Combined),26.11947,68.34073,Combined,Sindh,2,2,476,443
73,Government Boys Primary School Adam Brohi (Male),26.12014,68.37021,Male,Sindh,3,0,847,0
24,Government Boys Primary  School Sand Keerio (Male),26.12016,68.28727,Male,Sindh,3,0,1016,0
25,Government Boys Primary  School Sand Keerio (Female),26.12016,68.2873,Female,Sindh,0,3,0,946
72,Government Boys Primary School Manzoor Abad (Combined),26.12149,68.38334,Combined,Sindh,2,1,439,319
117,Government Boys Primary School Haji Jarrar Lund (Combined),26.12163,68.17267,Combined,Sindh,1,1,352,286
135,Government Girls Primary School  Bukhsho Magsi (Female),26.12163,68.195,Female,Sindh,0,2,0,668
133,Government Boys Primary School Jeando Lund (Combined),26.1219,68.20441,Combined,Sindh,2,2,540,531
136,Government Boys Primary School Bukhsho Magsi (Male),26.12196,68.19517,Male,Sindh,2,0,706,0
115,Government Boys Middle School Murad Ali Chandio (Combined),26.12477,68.14624,Combined,Sindh,2,2,617,560
13,Government Boys Primary School Main Urdu Old Sakrand (Male),26.12516,68.28526,Male,Sindh,3,0,955,0
14,Government Boys Primary School Main Urdu Old Sakrand (Female),26.12516,68.28529,Female,Sindh,0,3,0,880
5,Government Girls Primary School- Hussainabad Colony (Male),26.12516,68.28532,Male,Sindh,3,0,918,0
6,Government Girls Primary School- Hussainabad Colony (Female),26.12516,68.28535,Female,Sindh,0,3,0,899
26,Government Boys Primary School Sakrand Form (Male),26.12546,68.28231,Male,Sindh,3,0,733,0
27,Government Boys Primary School Sakrand Form (Female),26.12546,68.28234,Female,Sindh,0,3,0,655
97,Government Boys Primary School Khan Muhammad Chowhan (Combined),26.12766,68.2389,Combined,Sindh,2,1,490,368
144,Government Girls High School Majeed Keerio (Female),26.12883,68.21916,Female,Sindh,0,3,0,977
143,Government Boys High School Majeed Keerio (Male),26.1301,68.21921,Male,Sindh,3,0,1056,0
46,Government Boys Primary School Sahib Khan Jamali (Combined),26.13139,68.42097,Combined,Sindh,1,1,431,375
20,Government Boys Primary School Shaheed Colony Sakrand (Combined),26.13214,68.27806,Combined,Sindh,2,2,496,479
49,Government Boys Primary School Mevo Jamali (Combined),26.13269,68.4313,Combined,Sindh,2,2,555,549
17,Government Boys Primary School Sachal Sarmast Colony Sakrand (Combined),26.13394,68.2717,Combined,Sindh,2,2,600,528
69,Government Boys Primary School Natho Keerio (Combined),26.13395,68.3306,Combined,Sindh,2,1,455,418
29,Government Girls Primary School Ganhwar Zounor (Combined),26.1346,68.29068,Combined,Sindh,2,2,524,438
153,Government Boys High School Daleel Dero (Male),26.13493,68.27543,Male,Sindh,3,0,890,0
154,Government Boys High School Daleel Dero (Female),26.13493,68.27546,Female,Sindh,0,3,0,839
11,Government Boys High School- Sakrand- UC II (Male),26.13497,68.27541,Male,Sindh,3,0,1385,0
12,Government Boys High School- Sakrand- UC II (Female),26.13497,68.27544,Female,Sindh,0,3,0,1111
104,Government Boys Primary School Ali Bux Chohan (Male),26.13534,68.25253,Male,Sindh,3,0,828,0
105,Government Boys Primary School Ali Bux Chohan (Female),26.13534,68.25256,Female,Sindh,0,3,0,753
16,Government Girls Primar y School Manik Keerio Sakrand (Comined),26.13619,68.26869,Combined,Sindh,2,2,538,437
7,Town Committee Office- Sakrand (Male),26.13633,68.27395,Male,Sindh,2,0,715,0
8,Town Committee Office- Sakrand (Female),26.13633,68.27398,Female,Sindh,0,2,0,747
15,Government Boys Primary School Main Sindhi Old Sakrand (Combined),26.13704,68.27217,Combined,Sindh,2,2,683,617
61,Government Boys Primary School Shahmir Zardari (Combined),26.13706,68.40915,Combined,Sindh,1,1,322,293
103,Government Boys Primary School Haji Khan Keerio (Female),26.13888,68.24586,Female,Sindh,0,2,0,679
102,Government Girls  Middle School Haji Khan Keerio (Male),26.1389,68.24586,Male,Sindh,2,0,735,0
18,Government Urdu Primary Main School Mehran Colony Sakrand (Male),26.13907,68.27614,Male,Sindh,2,0,854,0
19,Government Urdu Primary Main School Mehran Colony Sakrand (Female),26.13907,68.27617,Female,Sindh,0,2,0,830
58,Government Boys Primary School Wasayo Jamali (Combined),26.13923,68.42004,Combined,Sindh,2,2,785,654
21,Government Girls High School No. 1 Sakrand (Male),26.13924,68.27699,Male,Sindh,4,0,1241,0
22,Government Girls High School No. 1 Sakrand (Female),26.13924,68.27702,Female,Sindh,0,4,0,1116
23,Government Girls Primary School- Shahnawaz Zauor Colony (Combined),26.13932,68.28214,Combined,Sindh,1,2,418,433
10,Government Boys Primary School Pir Bux Magsi (Female),26.13934,68.27544,Female,Sindh,0,2,0,691
9,Government Boys Primary School Pir Bux Magsi (Male),26.13934,68.27547,Male,Sindh,2,0,854,0
64,Government Boys Middle School Punhoon Jamali (Male),26.13977,68.34675,Male,Sindh,3,0,1144,0
30,Government Boys Primary School Pir Zakri II (Male),26.13992,68.28516,Male,Sindh,2,0,718,0
31,Government Girls Primary School Pir Zakri II (Female),26.13992,68.28519,Female,Sindh,0,2,0,642
65,Basic Health Unit Punhoon Jamali (Female),26.14057,68.34582,Female,Sindh,0,3,0,954
59,Government Boys Primary School Hassan Jamali (Female),26.1406,68.42913,Female,Sindh,0,2,0,698
60,Government Boys Primary School Hassan Jamali (Male),26.1406,68.42916,Male,Sindh,2,0,754,0
3,Government Boys Primary School New Urdu Syed Shabir Ahmed Shah (Male),26.14136,68.27199,Male,Sindh,3,0,1182,0
4,Government Boys Primary School New Urdu Syed  Shabir Ahmed Shah (Female),26.14136,68.27202,Female,Sindh,0,3,0,1016
113,Government Boys Primary School Ghulam Hyder Bhutto (Combined),26.14162,68.22109,Combined,Sindh,2,2,675,610
89,Government Boys Primary School Khadhar (Combined),26.14235,68.37058,Combined,Sindh,1,1,433,386
90,Government Boys High School Khadhar (Combined),26.14257,68.37105,Combined,Sindh,2,2,459,415
63,Government Boys Primary School Ali Khan Brohi (Combined),26.14289,68.40452,Combined,Sindh,2,1,469,409
1,Government Boys Degree College- Sakrand (Combined),26.14565,68.27459,Combined,Sindh,2,2,908,792
146,Government Boys Elementary School Pir Paryal Shah (Female),26.1467,68.18407,Female,Sindh,0,2,0,748
147,Government Boys Elementary School Pir Paryal Shah (Male),26.1467,68.1841,Male,Sindh,3,0,854,0
118,Government Boys Primary School Fatehpur (Combined),26.14692,68.13693,Combined,Sindh,2,1,437,379
110,Government Boys Primary School Malook Abad (Combined),26.15049,68.28075,Combined,Sindh,2,2,719,668
99,Government Boys Primary School Pir Zakari I (Male),26.15103,68.25798,Male,Sindh,2,0,911,0
124,Government Boys Primary School Hamzo Chandio (Combined),26.15177,68.16687,Combined,Sindh,1,1,353,267
84,Government Boys Middle School Umar Bodleja (Combined),26.15221,68.39257,Combined,Sindh,2,2,580,511
68,Government Boys Primary School Shah Muhammad Jamali (Combined),26.15259,68.31572,Combined,Sindh,2,2,609,576
114,Government Boys Primary School Jalalani (Combined),26.15272,68.24966,Combined,Sindh,1,1,387,432
145,Government Boys Primary School Paliyo Khero (Combined),26.15302,68.19761,Combined,Sindh,2,2,556,461
62,Government Boys Primary School Noor Mohammad Jamali (Combined),26.15388,68.40604,Combined,Sindh,2,1,436,372
101,Government Boys Primary School Bachal Keerio (Combined),26.15762,68.27129,Combined,Sindh,2,2,748,665
129,Government Boys Primary School Jam Jodho (Combined),26.15886,68.15385,Combined,Sindh,2,2,630,561
98,Government Boys Elementary School Gul Muhammad Magsi (Combined),26.1598,68.27912,Combined,Sindh,2,2,678,549
92,Government Boys Primary School Palio Magsi (Male),26.16173,68.36098,Male,Sindh,3,0,984,0
91,Government Boys Primary School Baqar Magsi (Combined),26.162,68.34573,Combined,Sindh,2,2,536,459
93,Government Boys Middle School Palio Magsi (Female),26.16258,68.36208,Female,Sindh,0,3,0,807
112,Government Boys Primary School New Dadh (Combined),26.16585,68.22638,Combined,Sindh,2,2,531,540
130,Government Boys Primary School Ghandia (Combined),26.16657,68.18053,Combined,Sindh,1,1,400,359
87,Government Boys Primary School Bahadur Jokhio (Combined),26.16667,68.33559,Combined,Sindh,2,2,697,674
127,Government Boys High School Misri Khoso (Male),26.17089,68.12286,Male,Sindh,3,0,924,0
128,Government Boys High School Misri Khoso (Female),26.17089,68.12289,Female,Sindh,0,3,0,817
109,Government Boys Primary School Sahito Jokhio (Combined),26.17149,68.29829,Combined,Sindh,2,2,570,541
111,Government Boys Primary School Khadim hussain khichi (Combined),26.17189,68.20724,Combined,Sindh,1,2,436,419
106,Government Boys Primary School Nazar Mohammad Unar (Combined),26.17278,68.24924,Combined,Sindh,2,2,487,434
107,Government Boys Primary School Muhammad Hassan Unar (Combined),26.17422,68.2515,Combined,Sindh,1,1,299,266
86,Government Boys Middle School Kaley Bux Rind (Combined),26.17492,68.34332,Combined,Sindh,2,2,455,475
141,Basic Health Unit Shamil Unar (Combined),26.17509,68.18477,Combined,Sindh,1,1,200,220
96,Government Boys Primary School Lakha Abad (Combined),26.17737,68.35732,Combined,Sindh,2,2,481,427
126,Government Boys Middle School Rahib Shah (Male),26.18158,68.158,Male,Sindh,3,0,941,0
125,Government Boys Primary School Rahib Shah (Female),26.18231,68.15891,Female,Sindh,0,3,0,816
88,Government Boys Primary School Mian Shora (Combined),26.18645,68.35432,Combined,Sindh,1,1,469,400
152,Government Boys Primary School Noor Bhoora (Combined),26.18783,68.19711,Combined,Sindh,1,1,393,358
149,Government Boys Primary School Asghar Unar (Male),26.18995,68.26195,Male,Sindh,4,0,1681,0
148,Government Girls Primary School Asghar Unar (Female),26.19001,68.26195,Female,Sindh,0,4,0,1614
83,Government Boys Primary School Sukhpur  (Comb),26.19023,68.33063,Combined,Sindh,1,1,249,241
151,Basic Health Unit Dino Shah (Female),26.19116,68.22066,Female,Sindh,0,3,0,978
156,Government Boys Primary School Chattan Shah (Male),26.19144,68.09359,Male,Sindh,2,0,804,0
80,Government Boys Primary School Ali Murad Bhutto (Combined),26.19234,68.39777,Combined,Sindh,1,1,335,294
150,Government Boys Primary School Dino Shah (Male),26.19239,68.21867,Male,Sindh,4,0,1193,0
81,Government Girls Primary School Ali Murad Bhutto (Combined),26.1925,68.3982,Combined,Sindh,1,1,437,390
108,Government Boys Primary School Qasim Magsi (Combined),26.19298,68.2829,Combined,Sindh,2,1,503,438
157,Government Girls Primary School Chattan Shah (Female),26.19346,68.09484,Female,Sindh,0,2,0,721
175,Government Boys Primary School Pir Nazar Muhammadd Shah Nasri (Combined),26.19438,68.08128,Combined,Sindh,2,2,666,590
142,Government Boys Primary School Payaro Chandio (Combined),26.19689,68.2166,Combined,Sindh,2,2,449,381
165,Government Boys Primary School Ali Muhammad Mari (Combined),26.19973,68.15118,Combined,Sindh,2,2,794,884
94,Government Boys Primary School Khabbar Lakhmir (Male),26.20214,68.3659,Male,Sindh,3,0,869,0
155,Government Boys Primary School Masti Chandio (Combined),26.20248,68.22624,Combined,Sindh,2,2,552,470
28,Agricultural Training Institute- Sakrand Farm (Combined),26.20263,68.36493,Combined,Sindh,2,2,634,566
95,Government Girls Elementary School Khabbar Lakhmir (Female),26.20263,68.36494,Female,Sindh,0,3,0,762
82,Government Boys Primary School Nawab Bhatti (Combined),26.20422,68.37543,Combined,Sindh,2,2,728,625
166,Government Boys Primary School Wali Muhammad Unar (Combined),26.2065,68.17335,Combined,Sindh,2,2,677,634
158,Government Boys Primary School Yar Muhammad Tanwari (Combined),26.20979,68.10385,Combined,Sindh,2,1,460,386
85,Government Boys High School Ghulam Mustafa Shah Landhi (Combined),26.21745,68.33521,Combined,Sindh,2,2,497,426
79,Government Boys Primary School Sallahudin Dahri  (Combined),26.22248,68.36805,Combined,Sindh,2,2,508,415
159,Government Boys High School Budhal Shah (Male),26.22263,68.12393,Male,Sindh,3,0,778,0
160,Government Boys High School Budhal Shah (Female),26.22263,68.12396,Female,Sindh,0,2,0,629
161,Government Boys Primary School Golo Dahari (Male),26.22866,68.14538,Male,Sindh,3,0,831,0
100,Government Girls Primary School Pir Zakari I (Female),26.22914,68.14539,Female,Sindh,0,2,0,813
162,Government Girls Primary School Golo Dahari (Female),26.22915,68.14529,Female,Sindh,0,2,0,677
164,Government Boys High School Sukhio Munahejo (Combined),26.23362,68.16473,Combined,Sindh,2,1,470,413
169,Government Boys Middle School Nabaho Bhoora (Female),26.23384,68.18277,Female,Sindh,0,3,0,930
170,Government Boys Middle School Nabaho Bhoora (Male),26.23384,68.1828,Male,Sindh,3,0,1045,0
163,Government Boys Primary School  Ramzan Dahari (Combined),26.23866,68.14257,Combined,Sindh,2,2,735,545
183,Government Boys Primary School Hazir Pir (Combined),26.23866,68.1426,Combined,Sindh,2,2,773,653
185,Government Boys Primary School Mir Muhammad Lakho (Combined),26.2407878,68.4109322,Combined,Sindh,2,2,558,477
173,Government Boys Primary School Fatuhal Zardari (Male),26.24677,68.11813,Male,Sindh,3,0,826,0
174,Government Boys Primary School Fatuhal Zardari (Female),26.24677,68.11816,Female,Sindh,0,2,0,624
37,Government Boys High School Muhammad Khan Magsi (Male),26.24711,68.4005334,Male,Sindh,4,0,1243,0
32,Government Boys Primary School Hamal Faqeer Laghari (Female),26.2529503,68.4056127,Female,Sindh,0,4,0,1309
33,Government Boys High School Hamal Faqeer Laghari (Male),26.2529503,68.4056427,Male,Sindh,4,0,1337,0
176,Government Boys High School Mashaikh (Female),26.25646,68.14251,Female,Sindh,0,2,0,582
177,Government Boys High School Mashaikh (Male),26.25646,68.14254,Male,Sindh,2,0,684,0
172,Government Boys Primary School Hayat Mari (Combined),26.25722,68.11358,Combined,Sindh,1,1,397,337
167,Government Boys High School Ghabar Dahari (Male),26.26368,68.17788,Male,Sindh,3,0,755,0
168,Government Boys High School Ghabar Dahari (Female),26.26368,68.17791,Female,Sindh,0,2,0,614
178,Government Boys Primary School Jado Juno (Male),26.26373,68.08725,Male,Sindh,2,0,540,0
179,Government Boys Primary School Jado Juno (Female),26.26373,68.08728,Female,Sindh,0,2,0,434
184,Basic Health Unit Noor Moddle Village (Combined),26.26465,68.05498,Combined,Sindh,2,2,701,604
171,Government Boys Middle School Ghanwar Mehar(Combined),26.26709,68.07116,Combined,Sindh,2,1,512,430
186,Government Boys Primary School Lakhat (Female),26.27698,68.03536,Female,Sindh,0,3,0,771
187,Government Boys Primary School Lakhat (Male),26.27698,68.03539,Male,Sindh,3,0,885,0
181,Government Boys Primary School Razi Jatoi (Male),26.29867,67.98709,Male,Sindh,3,0,922,0
182,Government Boys Primary School Razi Jatoi (Female),26.29867,67.98712,Female,Sindh,0,3,0,791
180,Government Boys Primary School Noor Shah (Combined),26.30344,67.96656,Combined,Sindh,1,1,322,290
